Hotel_Name,Review_Date,Review_Rating,Review_Title,Review_Text,Reviewer_Date_Of_Stay,Reviewer_Trip_Type,Reviewer_Location,Reviewer_Profile_Link
Marrakech Ryads Parc & Spa,Mark M wrote a review Mar 14,50,Ahmed the Great,The rooms were clean spacious and comfortable. The hotel staff were so welcoming and helpful; especially Ahmed from the Terrace Bar….he treated us like family. Great guy! Food and pool facilities were excellent!,Date of stay: March 2023,Trip type: Traveled with friends,"Belfast City Region, United Kingdom",https://www.tripadvisor.com/Profile/markmP3644FB
Marrakech Ryads Parc & Spa,Deb wrote a review Mar 14,50,A must stay,This has been an wonderful trip.  I had sun and delicious food and drinks.  The staff were incredibly happy all with an amazing can do attitude.  Lots of entertainment from cooking classes water fun gym and spa.  The food and beverage manager Faska was so hospitable and knew my name instead of my room number.  The bar staff El Habib and Ahmed had your drink ready before you asked. Amazing hospitality and service.  The receptionist YasminehayatAssiaimanenada should all be managers….. there’s nothing they can’t do for you or find out.  Such a wonderful welcome…. I highly recommend this hotel and will be returning.,Date of stay: March 2023,Trip type: Traveled solo,"Bath, United Kingdom",https://www.tripadvisor.com/Profile/debbeec
Marrakech Ryads Parc & Spa,Meander41632676111 wrote a review Mar 7,50,Fabulous Holiday,The hotel exceeded all expectations. The food was superb and for an all inclusive it never seemed to lack variety and choice each day. The staff are wonderful and couldn’t do enough for you. The maid service is second to none. Fabulous holiday at this hotel. We will be back.,Date of stay: March 2023,Trip type: Traveled as a couple,,https://www.tripadvisor.com/Profile/Meander41632676111
Marrakech Ryads Parc & Spa,Sharona V wrote a review Mar 5,50,Great Vacation,We had a great holiday the staff is very welcoming and friendly. We met a waiter at the hotel named Ahmed Laghrib who gave us advice this holiday so we could make our days as productive as possible. He taught us Arabic words and made sure we lacked nothing. Really a topper !! They do everything they can to make sure you have a great holiday. We met the locals and went on adventurous excursions. If you don't feel like going into town the hotel has a great animation team who know how to keep young and old entertained. We will definitely come back here and also recommend everyone to go there.,Date of stay: March 2023,Trip type: Traveled with friends,,https://www.tripadvisor.com/Profile/407sharonav
Marrakech Ryads Parc & Spa,Ian B wrote a review Mar 5,40,Cheeky 4 days away,Looked at all the mixed reviews on this hotel  so went there with no expectations . We just knew it was raining at home and was looking for some sun and a few days together . It’s quite a big hotel  a bit tucked out the way would be a bit of a criticism  but our rooms were clean food was ok and the staff we encountered were very friendly . Animation came for a chat everyday around the pool  despite us just wanting to relax . Still nice they took the time to come and say hi . Tarik in particular was very friendly  although he had a bit of a dodgy man bun  which all the guys seem to like . The drinks in the restaurant is a bit of a funny set up  with a guy at a table pouring drinks from a table  a bit like an 80’s engagement party 😁. Spirits and cocktails weren’t what they are meant to be  but this is an African Muslim country  so just go with it .  Entertainment is the usual kids thing then poor caberet and quiz  very much geared up for the French  so take a book  chat to each other and have a few drinks .  My wife lost her new iPhone one day and the staff went above and beyond to help find it  and a female staff member had handed it in for which we were very grateful . I wanted to tip one guy who’d really helped but he was insistent he needed no reward . I went looking for him that evening and forced the equivalent of £8 on him . He started praying as we left .  Couple of bits of advice would be to arrange transport before arrival . Taxi rank is a bit intimidating  and you’re sort man handled into a cab before you’ve sorted a price  and passport control is a bit strict and unwelcoming .  Final bit of advice is  we did a couple of trips to break our few days up . A morning out at the medina was a good one  although not for the faint hearted . A lot of people up close and personal  snake charmers etc  the second was a show in the evening with horses and a meal in a Bedouin tent . All of it was so bad  it was actually funny . Up to you if you’d want to go  but we wouldn’t rush back .  To summarise  hotel gave us a decent few days away  nice staff and food ok . Would be nothing much to do if it were raining  but we were very lucky whilst we were there .,Date of stay: February 2023,Trip type: Traveled as a couple,"St Osyth, United Kingdom",https://www.tripadvisor.com/Profile/ianbB298SE
Marrakech Ryads Parc & Spa,Inspire11828024300 wrote a review Mar 3,40,February trip for sun and warmth,This was my second stay in Marrakesh. It seemed like the perfect escape for some February sunshine. The highlights of this hotel were the attractive buildings and planting large pools (with one being heated even in February.)  Spacious and calming rooms friendly staff and good quality food. The negatives about the hotel for us were mainly to do with the volume of the constant music that ran from 10 am to 5 pm and could be heard everywhere on site including in your room with the windows and door shut. If you’re not a fan of constant thumping bass then this probably isn’t the hotel for you. The spa was pretty much closed except for the treatment room and the pool there was not heated and not in use. The alcohol choices were very limited but they poured a generous gandt and local wine was pretty good and could be found all day. As we were ‘off season’ the hotel was about 1/4 full leaving plenty of space in the restaurant bar and round the pool.  We’d happily return ( with earplugs) to enjoy the sunshine and trips to the souk which is 30 min on the hotel shuttle bus .,Date of stay: February 2023,Trip type: Traveled with friends,,https://www.tripadvisor.com/Profile/Inspire11828024300
Marrakech Ryads Parc & Spa,windows690 wrote a review Jan 2023,30,Honest opinion,The hotel is lovely and pool .  The room was dirty reported to reception and they said they would sort they didn’t . We had dirt on floors and there was a nest on balcony of insects . Nothing was done .  The hotel is not geared up for winter guest . All areas apart from rooms had no heat . It was freezing inside at night in bar  restaurant and reception cold .  Food was good  great selection staff friendly  The older bar staff were friendly . The animation  Team were really miserable and didn’t make any effort speaking to any of the guest unless it was showtime .  The food was good and drinks were nice  The hotel is far out to the nightlife and if you want to get on bus to Marrekech . The last bus was 10.30 and it parked far out to town . Or it is 20 pounds each was for a cab . Gardens and views lovely .  Massage really nice . Wouldn’t recommend facials face hurting after 3 days,Date of stay: January 2023,Trip type: Traveled as a couple,Bristol,https://www.tripadvisor.com/Profile/windows690
Marrakech Ryads Parc & Spa,Jayne H wrote a review Jan 2023,50,Short stay,We are two couples staying for short break. Three of us took the 3 day spa treatment. It was worth every penny. The entire experience was relaxing. The girls were so welcoming smiling faces and friendly. Don't miss out!  A lovely hotel all staff very friendly and happy to help you. We'd come back again 😊,Date of stay: January 2023,Trip type: Traveled as a couple,,https://www.tripadvisor.com/Profile/112jayneh
Marrakech Ryads Parc & Spa,Karen W wrote a review Jan 2023,50,Marrakesh Ryad Parc and Spa Hotel,We are 2 couples staying at the hotel and the exceptional service and fun we’ve had with Essalhi Ahmad at the Terrace bar is the best i’ve ever had. I’d stay here again because of him. Thanks Essalhi.,Date of stay: January 2023,Trip type: Traveled with friends,"Brighton, United Kingdom",https://www.tripadvisor.com/Profile/149karenw
Marrakech Ryads Parc & Spa,linda wrote a review Jan 2023,50,Great place !,Great place to enjoy as solo or friends or family with différents activity to do around.  Food was good!  The bar Team was great!  Specially Hamed very polite always with the smile and happy to help.  Animation was good !  Very nice entertainment during the evening  Will definitely come back!,Date of stay: December 2022,Trip type: Traveled with family,"London, United Kingdom",https://www.tripadvisor.com/Profile/GrandTour28140844390
Marrakech Ryads Parc & Spa,Becca L wrote a review Dec 2022,40,Fabulous,Loved staying in this hotel. This was my 3rd visit this year and couldn’t fault it. The pool is great days at the pool were made extra special by Mohammed working at the pool bar. Infact all of the bar staff made us feel like royalty during our stays. There was no request too large for the two Ahmed’s! They made us feel extra special. Simple things like remembering our orders and making us cocktails to try really make a holiday in an all inclusive. Was slightly disappointed by the interactions from some of the animation team very clearly only interested in the 20 something girls which clearly took up a lot of their attention both throughout the day and at night. However my experience was saved by the excellent service from bar restaurant and reception staff.    Overall would 100% recommend the hotel and will definitely be back.,Date of stay: November 2022,Trip type: Traveled with friends,,https://www.tripadvisor.com/Profile/beccal730
Marrakech Ryads Parc & Spa,E N wrote a review Dec 2022,50,Amazing bar staff,I recently had the pleasure of visiting this hotel and was blown away by the amazing service provided by the bartenders at the hotel's bar. In particular Ahmed was attentive and made sure that I had everything I needed. The drinks were perfectly made and the staff were so friendly and engaging that it really made my experience at the bar stand out. I would highly recommend this hotel to anyone visiting Marrakech– the service truly made my stay more enjoyable. Thank you for your excellent service!,Date of stay: November 2022,Trip type: Traveled with friends,,https://www.tripadvisor.com/Profile/Yhdhdh
Marrakech Ryads Parc & Spa,Khloe M wrote a review Dec 2022,40,Fabulous,Had the best time and the staff were so friendly. Ahmed the main bar man in the Terasse bar was great went above and beyond to make sure we were enjoying our stay.  The animation team put an amazing show on and tried to involve everyone,Date of stay: August 2022,Trip type: Traveled with friends,,https://www.tripadvisor.com/Profile/khloem828
Marrakech Ryads Parc & Spa,Kkelly M wrote a review Dec 2022,40,Amazing,We have stayed at this hotel a couple of times now and had an amazing time every time even when it was in the quieter season. The staff are so friendly and couldn’t do more for you. Special shout out to both Ahmed’s in the terasse bar and Mohammed at the pool bar they were fantastic! Would recommend this hotel time and time again,Date of stay: November 2022,Trip type: Traveled with friends,,https://www.tripadvisor.com/Profile/kkellym2022
Marrakech Ryads Parc & Spa,Stuart E wrote a review Dec 2022,50,Excellent holiday in Marrakesh,This is the second time we’ve been to this hotel I would highly recommend it. The staff are very friendly. The food is excellent quite a high variety of different food… There are two swimming pools one for kids and adults pool…. The animation staff are really good very friendly just like all the other staff everybody does the hardest to keep you happy especially Asma who is always happy to see you and has always a lovely smile.  Would highly recommend going all-inclusive because all the drinks and everything is part of the package and be in Marrakesh is virtually guaranteed the hot weather.  Given that I’ve been to Marrakesh a few times for me this is the best place to come too.,Date of stay: November 2022,Trip type: Traveled with friends,,https://www.tripadvisor.com/Profile/stuarte992
Marrakech Ryads Parc & Spa,Matthew Enevoldsen wrote a review Dec 2022,50,Marrakesh,Very nice and helpful service animation team was very helpful and friendly staff are very friendly and happy and willing to help at the drop of a hat they have great entertainment most nights with karaoke and performances for the animation team are very good to watch,Date of stay: November 2022,Trip type: Traveled with friends,,https://www.tripadvisor.com/Profile/R9329FLmatthewe
Marrakech Ryads Parc & Spa,SamBecky S wrote a review Nov 2022,50,Amazing holiday,Lovely hotel very remote and relaxing. Only 30 minute trip to the airport which is handy. Hotel is immaculately clean especially the rooms & pool area. Staff are so friendly & welcoming. Entertainment team are one of the best teams I have ever experienced. From morning to night they make such an effort with the guests. A special shout out to Joseph who is the best animation :-) but the whole team is a credit to the chief of entertainment!! I enjoy my stay there every time I visit.,Date of stay: November 2022,,Essex,https://www.tripadvisor.com/Profile/sambeckys
Marrakech Ryads Parc & Spa,Sharon M wrote a review Nov 2022,50,Fantastic 4 day break,Just returned from a 4 day break  hotel is about 30 min taxi ride from airport  it is quite remote but it was perfect for us as just wanted a relaxing break .there is a spa on site  tennis courts  basketball court table tennis and the entertainment staff have activities on during the day ( there are All fantastic ) and make a point in speaking to all guests everyday also have entertainment at night untill 11 pm .  The rooms are in a block of riads with your own balcony  fridge and hairdryer  it was very clean   The food was good although not always to our taste  but that’s what’s seeing different countries is about ( we didn’t go hungry ) there was also a good selection of drinks on offer and a coffee machine that’s available all day .and plenty bottles off water .  They also have holidays reps there that can also organise trips like desert safari  quad bikes hot air balloons and a guided tour into Marrakech .  Beach towels are available also you pay a deposit and get it back when you hand them in.  I was a bit nervous about going here after reading all the bad reviews but it was excellent and actually thought I was reading about a different place 😄beautiful place with excellent staff would definitely go back in November as temperatures were great,Date of stay: November 2022,Trip type: Traveled with family,"Blairgowrie, United Kingdom",https://www.tripadvisor.com/Profile/sharonmY8177ZH
Marrakech Ryads Parc & Spa,T D wrote a review Nov 2022,10,FILTHY! Truly Shocking.,This place has potential the pool area and lobby seem impressive but the rest of the place is filthy and completely neglected. It seems as though it was built and then just left half abandoned. Honestly some of it looks like a scene from a zombie film.  We left and went to the Sol Oasis next door. The difference in quality cleanliness and friendliness of staff could not be more stark. A warning to all . DO NOT GO HERE!!  Shame on Love Holidays who advertise this as a 4 star.,Date of stay: November 2022,,"East Grinstead, United Kingdom",https://www.tripadvisor.com/Profile/tdA1831CE
Marrakech Ryads Parc & Spa,Raymon H wrote a review Nov 2022,20,"Do not come here, stay in the sol oasis by Melia next door",This is one of the worst all inclusive hotels in morocco i have stayed in many. The rooms are old insecure and full of mosquitoes. The wine is undrinkable the food is poor quality and repetitive. There is nowhere outside the reception or your room where you can sit or sunbathe without being surrounded by smokers. Most of the staff are not properly trained to serve food drinks or provide any customer service and the management ignore complaints and do nothing to improve the place. I stayed here for 11 days and it felt like a prison sentence. The only worse hotel in my experience was the argana in Agadir but this was less than a third of the price per night. Morocco has many excellent all inclusive resort hotels check carefully before booking and do not waste your time and money coming to this one you will regret it.,Date of stay: November 2022,Trip type: Traveled solo,"Rivehaute, France",https://www.tripadvisor.com/Profile/raymonh499
Marrakech Ryads Parc & Spa,Eilidh M wrote a review Oct 2022,30,Below average,Arrived and taken to our room to find out someone was in it so had to wait and given another. The key cards were a nightmare and had to get reset at least once a day.  Room was okay bathroom dated and not the cleanest.  Left without electricity one day and reception were rude and basically told tough luck.    Food was awful the same every day just about. I ended up with a bacterial disease campylobacter which was confirmed when I returned home by doctor. I was ill for roughly 6 days and needed antibiotics. I mentioned this to staff who weren’t interested at the time.  Even when there was a spillage of  Juice by a child I mentioned to staff numerous times so no one slipped. They weren’t inwtetested I ended up cleaning it up with napkins.    Entertainment team worked there socks off  And tried to get most people  Involved but was very samey if you are there for over 7 days. They seem to work crazy hours and don’t get the thanks or appreciation for there work.    Bar staff were nice but felt pressured a lot of the time to tip. Also first night when we arrived were charged 200 dirham for bottle of Coke as after 11pm. Also felt there was not a lot of choice of all inclusive drinks no rum and cocktails were rubbish. And served in paper or plastic cups a lot of the time with no ice.    Bus times to and from Marrakesh were not suitable bus was never on time far to hot and even over booked on occasion.    Also the litter around hotel grounds was prettty bad I found myself picking rubbish up and binning it.    All in all I wouldn’t return to this hotel cheap yes but don’t believe it could pass for anything over a 2/3 star.,Date of stay: October 2022,Trip type: Traveled with friends,,https://www.tripadvisor.com/Profile/125eilidhm
Marrakech Ryads Parc & Spa,Global62230768224 wrote a review Oct 2022,10,Worst place ever stated on a holiday!,This was the worst place we have ever been to on a holiday.  Google reccomends this place stating it is a four star hotel in our opinion this was more like a one star hotel.  The hygeine of the hotel was dreadful there was blood stains on the bedding hair on the bathroom and room floor the food is left uncovered and has flies on it. Upon arrival there was a half eaten plate of food in the stairwell by our room that was then left there for 3 days! The food was also of a very low quality and wasnt good at all.  In terms of comfort the bed was almost unsleepable being so hard it feels like concrete. We had to layer 2 blankets under the sheet in order to sleep. There is also nowhere in the hotel that is comfortable to sit and relax the deck chairs around the pool are also rather uncomfortable but more comfortable that the bed!  In addition the staff at the hotel were very unfriendly and unhelpful. For example our bathtub had no plug so we couldnt use it we asked 4 times for one and they never supplied. The only staff who were nice and friendly were the animation team.  2 of the 3 resturants advertised were closed and just be aware the deposit for towels is cash only which was not made aware on website. They have a ATM on site but it charges 20% fee for transactions!  Lastly for english travellers be aware that everything is in french including entertainment for children.,Date of stay: October 2022,Trip type: Traveled as a couple,"Woking, United Kingdom",https://www.tripadvisor.com/Profile/Global62230768224
Marrakech Ryads Parc & Spa,Taz H wrote a review Oct 2022,10,Mr Hussain,Just got back on 14october22 was the worse holiday iv experience. Fell ill second day food poison never had anything like this.. all the way till I left been ill came back hospital straight away 14hrs wait AE . The food wasn't covered up fly's every were on plates food knifes and forkes dirty hygiene no cleaning with sanitises or anything in this place. Food left open all time germ paradise for all . Room not up to standered dirty towels. Safe could not lock room to far to walk no lifts in place if disable as I seen way out of center as not disclosed properly .or sold as if next door to town iv left my friend's there they have become ill now with a baby.. this place needs closed and relook at there policy on health an hygiene urgent please don't go it's my worse evere holiday iv experience and would not wish it on anyone. Food is all contaminated with raw food out and cook food around it,Date of stay: October 2022,Trip type: Traveled solo,,https://www.tripadvisor.com/Profile/612tazh
Marrakech Ryads Parc & Spa,Katie B wrote a review Oct 2022,40,Good value for money - realistic review,I came here with my boyfriend for a week we wanted an easy sunny all inclusive holiday and that’s what we got.    Enjoy the review..    Being British: ignore other reviews the staff treat you all the same we felt. Naturally they know more French like the majority of Marrakech but they always tried to conversate and all of the staff were nice to us. Terrace bar staff nicer than pool bar staff.    Reception: Did the job got us checked in and helped us with any thing we needed and always pleasant. Agree that they will finish anything they are currently dealing with first but never found them rude.    Food/ Drink: good variety of food for all three meals would switch up main dishes (fish/chicken etc daily) but the majority of standard salads / cheeses / meats / condiments stayed the same but because we’re not fussy we’re absolutely fine with this. Also catered for days when you weren’t feeling cultural and will indeed serve chicken nug nugs. Only complaint not enough nugs and the snack bar needed to be on for longer throughout the day with a better selection.    Alcohol: appreciate this should fall into the drink category but it deserves its own. First day you think it’s the best thing in the world by day 4 it’s paint stripper but we got a second wind to carry us through. Served sometimes in coffee cups by pool but at least no one got any glass in their feet    Animation/entertainment: the team work so so hard and make an effort with everyone they will always try to get you involved and special shout to mimi she is so lovely. The evening entertainment is good and an easy watch when your having a drink after dinner. If you don’t like baby shark don’t do all inclusive?    Every time a new activity comes along the Tracy beaker theme tune with a hint of snake charmer remix comes on.    Aqua gym: do it.    Rooms: beds are hard but you get over it. Towels need a revamp. We had a lovely big room with double bed and two singles well decorated and way better than expected.    Resort and Pool: super clean well looked after and plenty of sun beds.    The Shop: could do with selling water / soft drinks etc otherwise it’s alright    We had no trouble and had a lovely holiday :),Date of stay: October 2022,Trip type: Traveled as a couple,,https://www.tripadvisor.com/Profile/katiebF6692HH
Marrakech Ryads Parc & Spa,homerda wrote a review Oct 2022,20,Overall Poor.,I am a regular at hotels in Marrakech sometimes coming twice a year staying at a variety of different stared and priced hotels  But the Ona Ryads Hotel and Spa is the only bad experience I have had out of a dozen trips    Firstly the service is incredibly poor throughout so unlike any other place I have stayed and so different to the Morocco I have experienced before.    And There are so many small things like never having glasses or plastic pool glasses so tall drinks are served in wine glasses or mainly In disposable cups    The food is often reheated in the main restaurant and cooked from frozen in the snack bar    The room i stayed in was large but poor with cracked tiles and with small old towels    The pool toilets are cavernous but unfinished ..like a building site.    Even the entertainment team who do work hard seem to focus on one type of tourist ( the under 30s) ..    I haven’t tried the Spa which is separate but several people said it was fully booked so couldn’t get any treatments when they stayed .. maybe a sign that this is good .. but disappointing for those that came here for a Spa break    If you are over 30 and or like a little attention to detail even a little customer engagement stay just about anywhere else in Marrakech,Date of stay: October 2022,,"London, United Kingdom",https://www.tripadvisor.com/Profile/homerda
