Hotel_Name,Review_Date,Review_Rating,Review_Title,Review_Text,Reviewer_Date_Of_Stay,Reviewer_Trip_Type,Reviewer_Location,Reviewer_Profile_Link
Marrakech Ryads Parc & Spa,Tara Y wrote a review Oct 2019,40,Good hotel,Me and my husband stayed here For 1 week the accommodation was clean and modern only complaint was there was no tea/ coffee facilities in the room which we found very strange as all the hotels we've stayed in being all incl have always had this the food was our main concern  there wasn't too much variety  it was pretty much the same day in day out  made us feel quite bloated and the 2 restaurants that were on the resort  you had to pay for Seperately  so we stuck to the main restaurant the pool restaurant was also same food on a daily basis pizza  burgers chips these were ok though  the pool areas are beautiful and chilled  we spent most of our time in the pool as the weather was amazingly hot this year  in the 40's  very dry heat but beautiful  we didn't visit the spa at all as went for chilled holiday  I have to say we found the main thing that made our holiday was the entertainment staff  wow they work hard all day and night around the pool in the day making sure they talk and make all guests feel happy and welcome it was my husbands birthday and they made it special and fun  they also do the evening entertainment on a regular basis and make it enjoyable and fun there is also a blue bar that is open after the evening entertainment finishes but again I don't feel happy with this as you have to pay for the drinks separately again  makes me feel that this hotel is not really all incl !! The staff overall are friendly and helpful  the shuttle bus ride to the market and souks is regular and just 30 mins ride  free  20 minute walk the other end and was great overall would go back for a shorter stay / girls weekend  but would mark it down to a 3* hotel and not 4* .,Date of stay: September 2019,Trip type: Traveled as a couple,,https://www.tripadvisor.com/Profile/TaraY51
Marrakech Ryads Parc & Spa,Maddie’s Travels wrote a review Oct 2019,40,Came to this hotel for a weeks stay on all inclusive in September 2019,I looked at many hotels and reviews and chose this hotel although not visited Marrakech before have been to several all inclusive Hotels around Egypt and i have to say this Hotel is up there as one of my favourites. The pool is absolutely stunning and very clean never a shortage of sun beds. There is one all inclusive restaurant the food was very good especially the breakfast and lunchhplenty of choices freshly cooked omelettes on the odd occasion the food could have been hotter but this was probably as we ate late and the food was probably hotter earlier.  We were allocated a room a bit far from the main hotel was poorly lit at night but we managed to change rooms after two nights and the next room was much better. The rooms are beautifully decorated in a Ryad style and the air conditioning and wifi were great. The animation team are fantastic and the entertainment was far better than other hotels i have stayed in and i couldn't fault the dedication and hard work from the team. The Moroccan evening was fabulous horses and camels snake charmer belly dances it was truly magical.  I loved the fact there is a courtesy bus which takes you to the Medina the only downside is the bus drops you off a good twenty minute walk away fro the Square but if you like a walk then its no biggie. On the whole this stay in the wonderful hotel was all i hoped for and i would highly recommend it and will definitely be returning next year as i loved the hotel and the ambience and staff.,Date of stay: September 2019,,"East Sussex, United Kingdom",https://www.tripadvisor.com/Profile/300663
Marrakech Ryads Parc & Spa,301jaynes wrote a review Sep 2019,50,Fantastic hotel,This hotel was amazing.  The staff from reception to bar staff couldn’t do enough for you.  Rooms were spotlessly clean.... but.... just a couple of things to improve on no tea or coffee making facilities in the room which would have been nice.  And just 3 sockets none by the bed. Just mAde it a little difficult charging phones hairdryer etc. And the lighting wasn’t great. But that’s all I can think of as a negative.    The animation team work so hard from morning to late at night and every day/evening make a point of going around and saying good morning to all the guests... they’re absolute amazing. You can be as involved as you would like they are never too pushy.  The lifeguards are friendly chatty and willing to help with towels sun beds or even swimming advice..... lovely guys.  The restaurant has a great selection all day although I must say the flies at times drove me mad. 😡  But I would say the best holiday I have had and I cannot wait to come again next year.  Thank you to all the staff for a great trip.    Jayne & Alex,Date of stay: September 2019,Trip type: Traveled with friends,Morden,https://www.tripadvisor.com/Profile/301jaynes
Marrakech Ryads Parc & Spa,walshj1 wrote a review Sep 2019,20,All Inclusive - but not as you know it,Overall a poor stay saved only by the amazing weather in Marrakesh. The main issues come from this not being a true all inclusive resort the constant need to keep paying more leaves a bad taste.    Restaurants - only the buffet is in the all inclusive. The two others are not one of these is a tapas restaurant which we didn’t see used once the other a Moroccan restaurant which we visited. This was a waste of time since the menu was then served in the buffet the next day you also had to pay for the wine which was free in the buffet just 10 meters away...    Drinks - in reality there are very limited drinks available. Lager Moroccan wine Moroccan gin and Moroccan vodka the later two are used with fruit juice to make a variety of three cocktails.    Pool - towels have to be hired there is also no drinks service and since glasses are only collected twice a day you will also be clearing away drinks.    Snacks - these are the left over pastries from the mornings buffet breakfast served in the building by the pool that used to be a restaurant (now really just an empty space). Want to have some ice cream to cool down? That will be extra...    Spa - of course treatments are extra and the price on these is good value. What isn’t is that if you have booked numerous treatments you aren’t allowed to wait in the spa unless you pay £8 per person per hour - not a huge price but annoying especially when you have paid for your treatments and you cash is a half hour round trip away.    Gym - this is by far and away the worst gym I have ever been in. It wasn’t cleaned the week we were there so everything has a crust of salt no cleaning equipment is left either so presumably this will continue until geological formations start to form under the bars. Air con? Yes (sometimes) but it’s set to 28 degrees which makes it fairly pointless. The most disappointing thing was that this gum is used by the hotels staff none of whom made any effort to clean up after themselves.    Overall avoid this hotel but visit Marrakesh,Date of stay: September 2019,Trip type: Traveled as a couple,,https://www.tripadvisor.com/Profile/walshj1
Marrakech Ryads Parc & Spa,Lewis B wrote a review Sep 2019,20,Not 4*,We’ve been here 2 days now and the experience has got to the level where I’ve even created an account to leave this review to help others who are thinking of coming here.    On arrival we were left waiting with a staff member on the phone and the other 2 having a conversation with one another. After standing there waiting the gentleman didn’t say hello and passed us 2 forms to fill out (general info).    He said our room would be ready at 12.00 (we expected 2Pm so was happy) to leave our bags at the door of the hotel where they will be taken to the room for us. He pointed where the bar was and gave us no additional info.    12pm comes so my girlfriend and I walk over excited to start our holiday. One of the two after staff who were previously chatting said nothing else but “2PM”. We explained the above and the gentlemen who dealt with us was on the phone next to us.    We began to walk back to the bar confused and a little annoyed as it was 40 degree heat and we were still in our travelling clothes and just been told 12pm. As we began to walk off he shouts at us waving the key card. We walk back over hoping to get some info or at least told where our room was but nothing. We are now standing at the lobby room key in hand no idea where we are going and spot our bags still outside (in the sun).    We decide to take our own bags and ask a member of a staff (a gentlemen to what his job role is other than being rude and sexist to customers I’m not sure) for directions to room 512.    We explained we was tired received no info about the hotel or anything and been left to wonder the complex in the bid to find our hotel with now our luggage to drag around. He said to my girlfriend “look here lady after day 1 everything be ok” which we didn’t really feel was the appropriate reply. He pointed loosely where to go and still had no idea where was going and where anything was.    With it being day 1 of the holiday we were just happy to be there in the sun and begin to enjoy ourselves (not relying on any staff). We went into the room to shower off to find the bath dirty and as we showered the plug cover fell off leaving a filthy metal plug underneath.    As we was by the pool a member of staff told us how we must pay a deposit for the correct towel (we used a room one). Which would of been completely fine had someone told us leaving us feel rather awkward.    Day 2 comes and we requested a bottle of water (we are all inclusive). The gentlemen who i assume is some kind of manager as he was in a suit advised we are to have x1 water bottle at breakfast lunch and dinner.    He said we aren’t allowed another one until lunch where my girlfriend then explained that we missed breakfast (which we did). I was sat 20m away which he points at me says “this your partner” my girlfriend said “yes” to which he responds “you have a bottle” (which was also empty and why we was asking for one). He then rudely and reluctantly hands my girlfriend a bottle of water (technically we should have x4 water at this point if that’s the rule of all Inclusive water and the bottle was from dinner the night before!).    The reason for the additional star is that the food is OK and the coffee machine works in the bar (although there is no hot drink facility in the room which for a 4* you’d maybe expect.,Date of stay: September 2019,Trip type: Traveled as a couple,"Broadstone, United Kingdom",https://www.tripadvisor.com/Profile/571lewisb
Marrakech Ryads Parc & Spa,Nigel T wrote a review Sep 2019,40,Very good,So.. Around 30 minute transfer to hotel with a speedy transfer.  It is 15km outside marrakech and there is nothing else in the immediate area.  Check-in was easy and fast shown to ryad by porter.  Foyer area of hotel immaculate dinning areas very good to.  Plenty of fresh food daily all prepared and cooked lovely slightly repetitive but hey aren't they all.  Pool is fantastic one smaller one large and kids. Lovely cool temperature on those hot days.  Cafe by pool hot and cold food another bar too.  Top bar by stage. Entertainment OK you know what to expect so don't complain 🙄😳😁  Room need a attention to detail few small things.  Free transfer into city need to plan and book ahead though.  All staff friendly and helpful. The few small things I asked about were dealt with straight away and hassle free.  10e deposit for pool towels iron on request.  So if you want a quiet holiday away from hussle and bussle of marrakech this is for you.  Only down points no cushions for sun loungers. And attention to detail in the rooms.  Would I stay again... Yes,Date of stay: September 2019,Trip type: Traveled as a couple,"Rhos-on-Sea, United Kingdom",https://www.tripadvisor.com/Profile/796nigelt
Marrakech Ryads Parc & Spa,Jay wrote a review Sep 2019,20,"Stressful experience, rude staff, overpriced, do not book.",Me and my family stayed there for a week first of all it’s in a deserted area far away from everything it’s about a 30min drive to the main square/souks where all the shops are. After a long night we just wanted to get to our hotel and shower but it took us over 2 hours to be checked in with a lack of communication as to what was happening. The guy who checked us in had no idea what he was doing and kept getting everything wrong. We had paid for 3 rooms with twin beds but ended up with double beds. There was loud music all night so unable to sleep even after having our rooms moved after several sleepless nights and countless requests you could still hear the noise!! There was misinformation regarding the shuttle bus to and from the hotel which meant we were unable to use the shuttle bus resulting in a lot of money on expensive taxis. We had massages booked in the hotel so which were overpriced and definitely not worth it with staff re-using dirty towels. We had to wait over 3 hours to receive towels so we could shower! Even after several calls to reception. When we went to the staff at reception with any problems they were rude and unhelpful and accused us of our complaints being invalid. Although several customers had been complaining the entire team we were there. By the end we couldn’t wait to leave. We spoke to the manager as we were leaving who even agreed he had already received several complaints about the reception staff he then offered us a free stay at the hotel for all the problems we had suffered which of course we still have seen no sign of!! Overall a beautiful hotel although very overpriced but the experience was ruined by the awful customer service and their rude and incompetent staff.,Date of stay: September 2019,Trip type: Traveled with family,,https://www.tripadvisor.com/Profile/jay0515
Marrakech Ryads Parc & Spa,Zaink wrote a review Sep 2019,10,TERRIBLE STAY - DO NOT BOOK,This hotel was a nuisance from start to finish. Firstly the hotel is quite far out even though the hotel website states its about 10 minutes away from the main square it's actually minimum 30 minutes. It took the staff 2 and a half hours to check us in (which is the last thing we needed especially as we were extremely tired from travelling). The shuttle service is not that regular and you have to book your seats a day before (which we were not informed of) which meant we spent a lot on taxis. It costs minimum £20 for a single journey - that's how far out the hotel is. We had booked a twin room (which specified 2 single beds) but we're given a double room so only one double bed whereas my siblings had a twin room so 2 single beds and 2 sinks however our room only had the one (even though we booked a twin room too!). To top it all off we had a full body massage which was very poor and could tell the towels were not fresh. Once the massage was over the masseuese straightened the same towel I was lying on for the next client instead of getting a fresh one! Disgusting! Finally the staff were extremely rude when we raised our complaints saying 'we are the only guests who seem to have a problem' when literally 2 minutes later a lady turned up to complain that the tap in her bath had not been working for the past few days which shut the rude staff member up. When we raised our complaints to the hotel manager at check out he promised us an all inclusive 5 night stay for a free and that he would send an email confirming this. 2 weeks later and still no email so not only are the staff rude but also liars. If you want to enjoy your holiday DO NOT BOOK THIS HOTEL.,Date of stay: September 2019,Trip type: Traveled with family,,https://www.tripadvisor.com/Profile/Zkhush
Marrakech Ryads Parc & Spa,Hajira wrote a review Sep 2019,10,Very poor customer service and stressful experience,The hotel description is misleading. The souks/city centre is not a 10 minutes shuttle bus ride away but minimum 30 mins. Shuttle bus information is conflicting - not that regular and limited spaces PLUS same staff member said the rule was to book 1 day before then a couple of days later said you should have booked in advance?! We asked to move rooms because of the noise which they did - lo and behold they moved us to a room where you could still hear the music instead of the back rooms where noise is blocked. Asked for towels - took them several hours to bring despite asking a few times. Kept forgetting to give us shower gel and when requested they brought up more lotion and shampoo! Took 2 hours to check in and were given the wrong wristband; the restaurant manager made out as if we were trying to get free dinner! They also spoke in French about us right in front of us - and when I said I could understand what they were saying they had the decency to at least be embarrassed - very poor service. The manager said he would send us an email for a free stay because of all the issues - nothing received 2 weeks later (no surprise).,Date of stay: September 2019,,,https://www.tripadvisor.com/Profile/Hajira_KT
Marrakech Ryads Parc & Spa,Joana C wrote a review Sep 2019,50,Lovely stay.,We booked a 5 nights in Ona Marrakech and we loved all. The swimming pool area is great has a lot of variety food and the rooms are very clean an comfortable. The hotel have a free shuttle to drop and pick as up in the city. But what we liked the most was the people everybody was nice to us. In our last day we check out in the morning to go on a tour and our flight was late in the evening so Amel and Majder offer us a courtesy room to take a shower an get ready. We also loved the animation team mostly the Munier. Highly recommended.,Date of stay: September 2019,Trip type: Traveled as a couple,,https://www.tripadvisor.com/Profile/JoanaC2011
Marrakech Ryads Parc & Spa,FRC0384 wrote a review Sep 2019,40,Great holiday,I booked this hotel for a week’s holiday with my friend. This was the second year we have done this and after a really good experience in a different country last year I wanted to make sure we equalled that! I have to say having booked it back in early May the trip advisor reviews and also the lack of them worried me! Then from May they picked up and seemed so much better apparently they were due to the property being refurbished. We really needn’t have worried we had a lovely week here! Very relaxing! The staff were all impeccably polite and friendly. The buffet restaurant was the only restaurant that appeared to be being used by diners really and it was like a buffet repetitive in some respects but there were always at least some variations and there were fresh eggs/omelettes every morning.    We stayed in ryad marguerite which was one of the first blocks down from reception. Happy with the room. It was spacious and clean. Only water included in in-room drinks and a couple of issues (air con stuck on though given the 40o heat that was no problem!) and plug socket by the bed not working but certainly not things I would mark down for!    There was a small gym which had what you would expect from a holiday gym it served its purpose and was never overcrowded.    The pool was large. Sunbeds were old and I can definitely imagine that in high season you might struggle to get one but we always managed fine. It could be very loud at times. When the animation team were in the music was loud but in actual fact the team were FANTASTIC! I particularly enjoyed the step aerobics but perhaps not in such a ferocious heat! Never a long queue at the pool bar but I think we were probably off-season again!    The lobby is also huge but beautiful! Plenty of places to sit comfortably and avoid the direct sun.    Yes the location is out of town - about 20 minutes but the hotel ran free shuttle buses that we took regularly. We enjoyed it being a little quieter.    Things to improve on?    If and when you look to get new glass-wear purchase larger ones! The ones they use are very small and in that heat necessitated going to the bar every few minutes!    Big bottles of water available at the bar. Big bottles were really only available during the opening hours of the buffet restaurant or when housekeeping cleaned your room. Plentiful supply of water is essential in the heat that Marrakech experiences!    Better light on stairwells if the ryads- was dark after sunset.    As I say we had a great time and I would both recommend this hotel to others and return myself. Thanks to everyone who made our stay so nice.,Date of stay: September 2019,Trip type: Traveled with friends,"Edinburgh, United Kingdom",https://www.tripadvisor.com/Profile/FRC0384
Marrakech Ryads Parc & Spa,fleaty1 wrote a review Sep 2019,40,GREAT BREAK IN THE SUN,My partner and I wanted a hotel based break to relax and recharge our batteries.This hotel fitted us perfectly  both myself and my boyfriend had never been to Morocco before and didn't know what to expect.We were pleasantly surprisedWe arrived early before check in time but reception where great and really helpful and had no communication issues despite what previous reviews have said  I'm guessing if you speak to them with respect then they will do the same.They gave us our bands and we changed put cases in luggage room and went to pool. This hotel had a great pool and all surrounding areas where very clean and tidy with ample sunbeds the pool bar was basic but had everything that was needed.The apartment in the ryads was pretty decent again very clean and tidy.with a safe. fridgeTv and good aircon .In the whole of our stay we didn't come across a single member of staff that was rude in fact they all made a point of smiling and saying hello.The food was pretty decent but guess what several dishes where Moroccan yes I know that is a real shocker being in Moroccohowever there was also lots of other stuff Paella Lasagne and pizza for example it could have been a bit warmer but apart from that it was all goodhowever there was a lot of people mainly British who seemed to think they where at the Ritz for a few hundred quid and did nothing but moan about the food making comments it wasn't English enough. The entertainment was good but it is very traditional so if you want karaoke or some kind of pub singer this isn't the place for you (stick to Benidorm ) All in all we had a great time and got everything we expected for a last minute budget break  we would be happy to come back again. we encountered none of the issues that some reviews had mentioned that had actually began to worry me just before we went. No ants no bugs  no rudeness decent food with lots of choice (be adventurous try something new ) entertainment that didn't involve someone screaming out the lyrics to My Way  and no early morning music blasting from the pool  yes there was music at about 9.30 am that was at a perfectly normal level.So in summary a great Holiday,Date of stay: September 2019,,"Southampton, United Kingdom",https://www.tripadvisor.com/Profile/fleaty1
Marrakech Ryads Parc & Spa,Luke7 wrote a review Sep 2019,50,"Great food, hotel and staff",Great hotel with great staff don't believe the negative reviews staff are human if you are nice they will be nicer in return they were very polite and helpful it always seems to be my fellow Brits who moan complain about everything and are rude I saw a woman shouting at staff as she wanted a can rather than a glass and yes...she was english from the UK ! This place gets top marks from me in all areas great food  clean and staff are great.  Some advice - make friends with a good taxi driver they are rare but I used a good honest one - as the hotel will charge 250 to the square or you are tied down to the shuttle it should only cost 150 for a taxi call the taxi 20 mins in advance - his name is Siddique he is a very humble honest and joyful man he won't overcharge and has s great personality. His number is 00212661519356. He is also on WhatsApp.,Date of stay: September 2019,Trip type: Traveled with friends,"London, United Kingdom",https://www.tripadvisor.com/Profile/ReviewMan763
