Hotel_Name,Review_Date,Review_Rating,Review_Title,Review_Text,Reviewer_Date_Of_Stay,Reviewer_Trip_Type,Reviewer_Location,Reviewer_Profile_Link
Marrakech Ryads Parc & Spa,Harvey Levene wrote a review Jan 2020,10,Will NEVER go back!,I wanna start this off by saying: I read a lot of reviews on places when travelling and quite a traveller myself and usually find that people can be quite dramatic about their experiences... but the bad ones on here I genuinely would take more seriously than I did.  Firstly the design of the hotel is nice. Nice rooms nice walks around pool area borderline lovely... but the staff firstly were disgustingly rude. We were 2hrs later for check-in and the room STILL wasn't ready for another 2hrs on top of that. Do you think they even apologised? No. The food every single day gave me or one of my four friends a bad stomach. I have a stomach of steel and even I threw up on the 3rd day. Half the food was cold undercooked. Me and my friends even had a personal joke about the eggs throughout the holiday. The staff are basically either careless or borderline passive aggressive ESPECIALLY a specific bartender and I wish I remembered his name now. The hotel basically ripped us off £200 each including completely screwing us over on taxi transfers to the airport when we left. Completely helpless with any questions asked or advice needed. They didn't even properly organise our waterfall tour properly with the guide!  I really really wouldn't recommend this hotel to anyone especially are you can get the same if not better for the same price.,Date of stay: October 2019,,,https://www.tripadvisor.com/Profile/hkindlon
Marrakech Ryads Parc & Spa,Jacinta G wrote a review Dec 2019,10,Honest review,Honest Review which I hope will help make your decision when choosing a hotel.    Pros;  1. Lunch and evening dinner is great! Good selection and there was especially 1 lovely gentleman waiter that served wine.  2. Spa is lovely and good staff but extremely expensive (more than Dublin prices) and you have to pay €10 for indoor pool use for 1 hour. Not free!  3. Rooms were lovely and very comfortable. We had great sleeps!  4. Shuttle bus service was great. Some reviews here said they had to pay for bus but ours was free for the 10 days.  5. The two trips we booked in hotel were fantastic!! Go for the camel ride and dinner in desert. Tour of Berber village was great.  Cons;  1. Pool looks fantastic for photos but that’s all it seemed to be really used for. It’s freezing cold and the “warm” pool was empty for first few days of our trip. However when filled it was still cold. Pool wasn’t really used by anyone.  2. Majority of staff were really rude. On arrival at reception at 12.00am at night we were welcomed by the rudest man I’ve ever met in hospitality. (He wouldn’t give me his name) He was charging us €55 for government tax that which we were never made aware of by anyone but his handling of the situation was extremely shocking. We complained and He laughed and was very sarcastic to us (little sexist) didn’t like a woman questioning him. He never talked us through anything about hotel told us everything was closed at 11 (which we found 1 week later there is a bar opened to 1am). Next day we got a nicer man at reception who explained the tax which was actually only €30. We were happy to pay when explained and treated nicely.  3. I cut my hand badly on broken glass at pool. The hotel didn’t have 1 plaster for me and tried to charge us €4 for one Single plaster in the shop. I actually lost quite a bit of blood but no help from anyone. Very worrying that a hotel this size with 400 guests does not have a first aid box or a box of plasters.  4. Drink is pretty poor. No selection. Everything is warm and we didn’t want to use ice as we got sick from the water. Lots of flies everywhere as surfaces are not kept clean.  5. Bar staff constantly asking us and other guests for cigarettes and for us to get to them drink. One got so comfortable that they just lifted cigarettes from table without asking. I felt some of the staff were a little creepy. Have to note one younger bar man was very friendly.  6. Do not go into the shop within hotel. This man is a con man and will fully exploit tourists!!! Charging on average 3 times the actual price.  7. Poor water service. I was sick one of the nights and needed water and reception told us to wait to 7am next day although they have bottled water In storage they wouldn’t give it to us. It was horrible. This happened a few nights so we started just stacking up on water during the day.  8. Although not the hotels fault there was guests rowing in our complex one night and it lasted for 2 hours. It got very aggressive and we heard smashing and threatening language from the room. No staff or hotel presence came once to intervene. I genuinely hope these guests are ok because we never seen them again! Maybe they were thrown out though.  9. All in all I didn’t feel that safe and kept table pushed up against bedroom at door at night I would never think of doing something like normally but unfortunately that’s how I felt.  10. Safe doesn’t work in rooms and heard his from other guests we met also. (Bit strange).    Advice to hotel - a lot of the cons come back to basic manners and common courtesy! improve on the staffs manners and hospitality skills as this will go a long way!!,Date of stay: December 2019,Trip type: Traveled as a couple,,https://www.tripadvisor.com/Profile/672jacintag
Marrakech Ryads Parc & Spa,alibehnam42 wrote a review Dec 2019,50,Brilliant hotel and staff,I cannot fault this resort! Forget about bad reviews that some never-happy people leave!  After reading mixed reviews I was so worried and unsure of what to expect but on arrival check-in went very smooth although the majority of people only speak French and Arabic but they can still communicate in English you should respect that your French is surely not better than their English too! So take it easy! It is all about holiday and having fun.    Hotel is very very clean beautiful Ryads given to us which was a two bedroom apartment in s breath taking beautiful garden nice traditional moroccan decoration every where which adds a touch to your holiday.    Buffet food always very good i am In Keto diet and my family are very fussy but every meal we were happy with many dishes which we couldn’t try them all in 7 nights stay. At least 50% new food at each meal time so you never fed up with repetitive food.    We were on All Inclusive package and we truly enjoyed our Xmas 2019 here as the weather was so nice and most days around 27c and very hot.    They have a REALL heated pool which is smaller and circular shape but the water temperature is always kept at 22-24c which is perfect so we were always in the water with my two kids.    The big pool is cold (12c) so nobody really uses it in this time of the year.    Hotel provides free shuttle bus to Jamaa El-Fba 3 times a day you just need to book it one day in advance I used the shuttle 4 times (4 days) as I love shopping! Moroccan people are very warm and friendly inside and out.    Animation/Entertainment staff are really lovely and do their best to entertain everyone we enjoyed the show every night. JOJO is one of the guy and he is full of energy and fun he even entertain you buy the pool if he sees you are bored!    They also run a free kids club/mini club were they take care of kids for you and even take them to lunch and dinner so parents can really enjoy their time. SONYA (SONIA) is the Kids club manager she is very lovely and both my kids adore her without Sonya there are girls which I didn’t pick up their names but they are lovely.    Then we have a POOL BAR where you can get your drinks from and two people working there are amazing! A lady called SOUAD and a man called YOUSEF (hope my spelling is not too far!) they were both amazing! Always gave us the drink we wanted with the strength snd taste we liked! They never say NO! Even if you ask them to fill your glass with Vodka Gin or Whisky they will do to hive you being at home feeling very lively people. They even remember your choice of drink and before you order they prepared it for you!    YOUSEF even taught us how to cook Moroccan dishes like Tagin it was a great fun and he is so charming I loved him and we had chat and laugh everyday together. See attached photos.    All in all a great hotel great holiday and service and surely way way more than what we expected to received! Highly recommend this place to families and couples.,Date of stay: December 2019,Trip type: Traveled with family,"Aberdeen, United Kingdom",https://www.tripadvisor.com/Profile/alibehnam42
Marrakech Ryads Parc & Spa,MarjoleinMechelen wrote a review Dec 2019,10,Review Ona Marrakech Dec ‘19 - Jan ‘20,Negatives:  - the hotel is dated  - beds are extremely hard  - main eating hall is just like a canteen. Not cosy at all!!  - main eating hall is not clean  - not a lot off vegetables for breakfast (only tomatoes cucumber and olives).  - no fresh juices  - bad quality soft drinks (cola from a tap without gas)    Positives:  - most off the staff are friendly  - the pool is beautiful    I do not recommend this place.,Date of stay: December 2019,Trip type: Traveled with family,,https://www.tripadvisor.com/Profile/MarjoleinMechelen
Marrakech Ryads Parc & Spa,Roving Lulu Belle wrote a review Dec 2019,40,Fun Christmas break,Overall we had a great time but there are some things that would have been good to know before arriving.    General: the grounds are beautifully kept the food is really good (varied and tasty) - just wine (plus soft drinks) available for all inclusive at meals. We had a family suite - spacious airy clean modern Moroccan decor huge bathroom. Had a couple of maintenance issues - despite two reminders they didn’t get fixed but it didn’t overly affect our experience. However Christmas decorations were up Christmas Eve celebrated Santa visited - great fun.    Good to know:  Location - while the Resort is only 20 minutes north east of the centre taxis can be costly. There is a shuttle from the hotel to the centre - departs hotel 9.30 10.30 15.00 19.00 and returns 13.00 16.30 18.30 22.30. From the shuttle drop-off it is a good 20 minute walk to the main square - with the souks on from there. The shuttle driver can do drop offs en-route eg Majorelle Gardens which saves a long walk.    Activities/day trips - Many of the tour operators pick up from central Marrakesh - so that can limit options. The resort offers them - but they are significantly more costly than online operators so needs a bit of research ahead of time to see if pickup can be arranged. The quad bikes/balloons/camel ride etc operators are based just a few kilometres from the hotel (in the desert) so there must be options.    ATM - the Ona has very limited ATM facilities (ie wasn’t available most of the time) so relies on you having cash (either Dihrams or other) so be prepared as you can’t just charge items to your card.    Local taxes - there is a local tax payable at the hotel which may be additional to your package rate. Check T&C before arriving as this too was payable in cash.    Room locations - the rooms are spread out across the grounds which makes it private and peaceful. However it is quite a walk from the rooms to the reception on uneven ground with very limited lighting - so if there are mobility issues may want to consider requesting a room closer to the reception.    But overall a great stay.,Date of stay: December 2019,Trip type: Traveled with family,"Berkshire, United Kingdom",https://www.tripadvisor.com/Profile/rovinglulubelle
Marrakech Ryads Parc & Spa,wolfgang vald wrote a review Dec 2019,50,dream holiday for anyone,wow I was very impressed everything was perfect! I have never had a better holiday I have had many good ones but nothing can compare to this one the staff are all really friendly everything was simply amazing the entertainment staff were also very friendly reckon everyone will agree that they sometimes feel like close friends to everyone if I could do just one holidqy for the rest of my life Ona Marrakech has no competition and the food was very nice too one of the swimming pools was a bit too cold but apart from that nothing better,Date of stay: December 2019,,,https://www.tripadvisor.com/Profile/wolfgangvald
Marrakech Ryads Parc & Spa,Lydia Z wrote a review Dec 2019,30,GIVE ME BACK MY TOWEL MONEY,I could go into tremendous detail about my experience on my last day of holiday.  The hotel should be ashamed to have someone so rude and sexist and horrible behind their reception. Everyone else at the hotel was so lovely however one guy (who refused to give me his name-wasn’t wearing a name badge) was so horrible to me. He was pointing in my face shouting at me.. all because I didn’t have the receipt even though I had the 9 towel key cards which you get in exchange for the 9 towels after paying the €90 deposit.  He claimed to have ‘refunded’ me on my card and yet 2 months later I still haven’t received the money.  I have emailed and called and yet still nothing. If the hotel does not respond to this I will be taking it further.,Date of stay: September 2019,Trip type: Traveled with family,"Greenhithe, United Kingdom",https://www.tripadvisor.com/Profile/lydiaz2019
Marrakech Ryads Parc & Spa,Eileen Covelle wrote a review Dec 2019,50,A lovely hotel and staff.,We so enjoyed our first trip to Morocco and especially staying at the Ona Marrakesh Ryan’s & Spa. Lovely place to stay just outside Marrakesh. Great staff especially the animators lovely huge pool excellent food.,Date of stay: November 2019,,"Golden Cross, United Kingdom",https://www.tripadvisor.com/Profile/eileeng685
Marrakech Ryads Parc & Spa,Karen M wrote a review Nov 2019,40,Mini Break,When we arrived the receptionist showed us to the restaurant so we could have lunch whilst they booked us in and made sure are room was ready for us. The hotel staff were all professional polite and helpful . The food was very good and plenty of choice. We used the courtesy bus into the city which was very good and we got a taxi back from the main square to the hotel for 150. Dirham. The room was spacious and very clean. We did not use the spa but it did look very nice. The pool was very clean but the water was freezing . The sunbeds were not very comfortable and could benefit from having some sort of padding to lie on. The grounds were well kept.  We would stay here again .,Date of stay: November 2019,Trip type: Traveled as a couple,"Windsor, United Kingdom",https://www.tripadvisor.com/Profile/D8906RKkarenm
Marrakech Ryads Parc & Spa,spikyredzz wrote a review Nov 2019,40,Really enjoyed our stay!,Location: about 30 minutes from the airport. I would recommend booking your transfer in advance it's easier. Hotel operates a shuttle bus to the medina. We used it once with no problem booked the night before completely free large bus.    Reception: very helpful on arrival at 21:30 making sure we made it in for dinner. A bit forgetful when we asked for a room change the following day (plumbing problem) we had to ask three times but changed with no argument. Arranged a late checkout at a reasonable price for departure day. All of the staff were friendly. The luggage porter was so nice helped us on more than one occasion!    Room: first room was lovely very clean comfortable. Strange smell next day which didn't dissipate so we asked for a move. Second room also lovely suite 1001 further from the main building but very close to the pool. Plenty of hot water good air conditioning/heating.    Food: the hotel is isolated so all inclusive is the best plan. We both enjoyed all of the food on offer; breakfast - omelette to order excellent selection of cold meat and cheeses pastries fresh fruit etc. Lunch - varied every day - hot dishes salads desserts fresh fruits breads wine and soft drinks all excellent! Dinner - extensive selection varied by day - we had fish/chicken/beef tagine fresh fish curries chinese seafood salad shrimp kebabs salads pasta pizza and tried every moroccan dish on offer! Overall to our taste the food was outstanding! Not forgetting the restaurant staff who were all friendly we can't speak French but a smile is perfect!    Activities team: what a credit to the hotel this team is! As November is a quiet time with not so many guests the team had to encourage everyone to take part in the poolside activities; they did a great job without pestering anyone who just wanted to relax. Music is loud but we liked that! The team work split shifts from early morning to late night; hardworking young people! Nawal adopted us always a smile and a quick chat to find out our plans for the day. She really made us feel very welcome! We even joined in dancing in the evening unusual for us but so much fun! I wish I could remember everyone's names they are all brilliant!    Entertainment: different every evening - we enjoyed every show not very big audiences in November though. I skipped out at the snake    I would definitely return to the hotel. It felt welcoming and safe. Taking a shuttle to the Medina suited us best of both worlds.,Date of stay: November 2019,,gateshead england,https://www.tripadvisor.com/Profile/spikyredzz
Marrakech Ryads Parc & Spa,Holly wrote a review Nov 2019,30,Not the best. Not the worst.,The hotel is ok - our room was clean and quite nice. Lovely comfy beds. The bath didn't have a plug so you couldn't have a bath but the shower was fab. Nice little balcony had a safe but I don't think it worked - we didn't use it.  We had fresh bottled water put in our fridge every day.  Shuttle bus you MUST book the day before you need to go in as it gets booked up - it's a good free service though.  The women on reception are some of the most miserable unfriendly people I have ever come across. Could do with some training and improving their customer service !! When we arrived we were charged city tax (this is normal) the woman on checkout then tried to charge us again - do not fall for this! I kindly told her we had already paid and nothing more was said. I did read a review before travelling that made mention of this so just be aware.... this is the kind of thing they may try on!  There are excursions and things you can book but I organised these independently through TripAdvisor rather than using the hotel reps.  I visited the spa it was reasonably priced and a really lovely setting.  /the pool is bloody freezing but nice to cool off in on a hot day.  The drinks service is really weird if you're paying all-inclusive you should get all-inclusive? You can literally only take one drink at a time even if they can see your travelling companion waiting on a sunlounger/sofa a little way-away. Very odd! Not had this before!    Overall it was OK. I wouldn't return as I think there is better places on offer. IT was cheap though so can't grumble too much.,Date of stay: November 2019,,"Banbury, United Kingdom",https://www.tripadvisor.com/Profile/Lholly123
Marrakech Ryads Parc & Spa,WJW123 wrote a review Nov 2019,10,Shocking,Unfortunately the hotel let us down time after time. It started with the lead up to staying at the hotel; It was a surprise birthday trip for friends;    several emails/telephone calls being ignored trying to make reservations for the spa /airport pick up  Picked up from airport 1 hr late Arrived at the hotel to find the room advertised didn’t reflect what we booked  3 rooms later we settled for the best of a bad bunch  Toilet broken  Safe not working  Telephone not working  Mini fridge empty  Again several attempts to resolve our issues took up time and effort due to lack of engagement from reception staff. We witnessed so many people complaining and spoke to people who were unhappy.  shuttle was never free but it was - hotel charged a fortune for taxi’s  checked out of the hotel their chip n pin service wasnt working they refused to take to the airport until we paid our £60 bill but we had no cash they made a member of reception take us to cash point the staff member was really rude finalloy half way to the airport they pulled over and said we had to get out as they WERE late for their next job and made us get in to a taxi!    I’ve never been treated so bad the hotel and the reception staff ruined our trip. Yassin the guest services manager was useless and didn’t follow anything through.    On a positive breakfast was great the cleaning staff were friendly    I wouldn’t recommend staying there the money you spend each day on taxi’s will pay for a nicer hotel near the city centre.,Date of stay: October 2019,,"Merseyside, United Kingdom",https://www.tripadvisor.com/Profile/WJW123
Marrakech Ryads Parc & Spa,Laura wrote a review Nov 2019,50,Absolutely fantastic,I have just returned from a week at this fabulous hotel everyone is friendly the food is great with a brilliant choice I read the reviews before we came out and can honestly say.. ignore the bad ones!! There is nothing bad about it the animation team are wonderful all the staff are incredibly helpful... we will be back!!,Date of stay: November 2019,Trip type: Traveled with family,,https://www.tripadvisor.com/Profile/laurakate71
Marrakech Ryads Parc & Spa,PW25 wrote a review Nov 2019,40,Half Term Break with Teens,This hotel is lovely with rooms being spread across the various Ryads there were only 20 rooms per block. We had a family room which was perfect as there were twin beds in one room for our teenage sons and a separate double room for us. The porter that bought our bags for us when we arrived was a great help - showing us how the safe worked and other features in the room. This is by far the longest check I have experienced but there is not much to be done about this. The room was always very clean and tidy - however despite there was obviously four of us staying in the room we were repeatedly left 3 towels. We ran reception each time and an extra towel was provided but this did get a bit tedious as it happened every day!  There were always plenty of sunbeds and there was no need to be up at a ridiculous time to reserve one which was such a pleasant change from places we have stayed at before. There is no getting around it - the pool was FREEZING - it is not heated and the best way to get in was to jump/dive. Once you were in and swimming it was bearable - but such a shame as it was a fantastic pool and would have a lot more use if it was a few degrees warmer.  The restaurant was clean and tidy and the food was generally good breakfast was our favourite meal of the day. Lunch and dinner were quite similar offerings and where food was dished up by staff the portions were often quite stingy - my husband had the pasta and meatballs and was given two meatballs which were marble-sized - he was very unimpressed. As with a lot of other reviewers we found we got a bit bored with the food choices by the end of the week. The freshly made pizza was always good and a big hit with our sons.  The entertainment team were great they always came around the pool for a chat in the mornings and did a great job of encouraging people to join in with the activities. Our boys liked that they could get equipment for different sports particularly table tennis and basketball. The evening shows were on par with what we have experienced in other hotels. The Halloween dance show was very good except for the lighting chap who just went over the top with colours and strobe effect making it very hard to enjoy without a headache which was a pity!  Overall we had a great family break in glorious weather which was our aim there were definitely things that could have been better but none of them were sufficient to spoil our holiday.,Date of stay: October 2019,,"Crawley, United Kingdom",https://www.tripadvisor.com/Profile/PW25
