Hotel_Name,Review_Date,Review_Rating,Review_Title,Review_Text,Reviewer_Date_Of_Stay,Reviewer_Trip_Type,Reviewer_Location,Reviewer_Profile_Link
Opera Plaza Hotel,donna c wrote a review Jul 2014,50,Great hotel,My husband and i stayed from 5th - 12th july. Hotel was lovely and of a very good standard. Lovely clean rooms and furnished really nice. Warning though we had our phone and some cash stolen out of our room. We had been out and came back mid-day room had been cleaned decided to have a couple of hours by the pool. in that time someone had been in and stole. We do use the safe provided but carelessly forget to put cash and phone away after being out.Hotel called police and we reported what had happened.Could have been worse! Lock everything even if leaving room for a few minutes you never know!.Apart from that had a fab time.,Date of stay: July 2014,Trip type: Traveled as a couple,"Worcester, United Kingdom",https://www.tripadvisor.com/Profile/donnac607
Opera Plaza Hotel,Rafid A wrote a review Jul 2014,50,Excellent,We stayed as a family 5 nights between 27/07/2014 to 02/07/2014.  The hotel and the staff are all very good.  We were welcomed first by Abdullah at the reception who gave us a good introduction about the hotel.  The hotel and the rooms are very clean.  The staff are all very helpful and very polite.  The food was very good.  The only downside was the Wi Fi in the rooms; it stopped working from 2nd day of our stay and we have to come to the lobby to access the wi fi.  In general we enjoyed our stay and would like to visit Merrakesh and stay in this hotel in the future.  I would lke to hank all the staff including the receptionists with special thanks to Abdullah the room cleaners the room service and all the staff at the restaurant where we used to have our breakfast and dinner.  As it was Ramadan; They offer us to deliver the Suhoor to our room for free at time convenient for us  Many Thanks    R. Aziz  UK,Date of stay: June 2014,Trip type: Traveled with family,"Hatfield, United Kingdom",https://www.tripadvisor.com/Profile/884rafida
Opera Plaza Hotel,fyemma1 wrote a review Jul 2014,50,Amazing,My husband and I stayed here for a long weekend on the 4th July. The hotel is amazing along with the staff who were extremely friendly and helpful. We can't wait to return next year. Thank you to everyone for making our stay so AMAZING!!!!!!,Date of stay: July 2014,Trip type: Traveled as a couple,"Nottingham, United Kingdom",https://www.tripadvisor.com/Profile/fyemma1
Opera Plaza Hotel,99PSB wrote a review Jul 2014,40,Exceeded expectations!,I stayed from the 8th July until the 12th July on a dinner bed and breakfast basis booked via Superbreaks. Some reports made me a little nervous however my concerns were not necessary at all! The staff were welcoming and friendly the room and facilities were good food was ok and it was very good value for money! I would not hesitate to return to this hotel should I visit Marrakesh again.,Date of stay: July 2014,Trip type: Traveled solo,"Bristol, United Kingdom",https://www.tripadvisor.com/Profile/99PSB
Opera Plaza Hotel,vimal75 wrote a review Jul 2014,10,Stay away from this hotel.,I recently stayed at this hotel and I would Hello I recently stayed at the Opera Plaza Hotel and I strongly recommend you do NOT stay here and think its wise if you keep away. The rooms you cannot fault and some of the staff are pleasant. BUT !!!!  The people on reception are very rude and un-helpful. If you are doing Half board or Bed and breakfast then expect the same food every day which I can guarantee you will be sick of the sight off.    I am going to get straight to the bad points.    The Electric lamp wiring was lose in my room Please see pictures.    I was told I could not bring in food or drink from the local supermarket and that water had to be purchased from them only. ( Not sure why? as I had paid for room and I should be allowed to eat and drink what I wanted )    During the World Cup People were asked to leave !!! If they didn’t buy a drink from the bar. Some people complained stating they had just been out for a family meal in town and didn’t want to buy a drink from the bar.  The bar was very expensive and differed prices were charged depending on who served you. One lady charged me 30 dirhams for a can of coke and the next day a man charged me 40 Dirham.    I was told i was not allowed to hang up my towel on the balcony to let it dry out after being by the pool. My Balcony was at the front of the hotel.    My Television lost all its channels one day! I would also advise not to leave valuables in your room as i heard stories of the cleaners stealing items.  The staff of reception were un-helpful to the couple who had their iPad and charger stolen.    The security guards were often trying to order me a taxi and charging around 150 Dirhams to return me to the airport trying to make a profit for themselves.  I caught a taxi for half that price in the end. They would also try and flag down a taxi for you and again making a profit with the driver.    Finally on my last day I was charged 115 Dirhams so called Hotel tax? Not sure why as this as I had paid for my room in advance for 7 nights in with alpha rooms.  I will be lodging a complaint.    Please check that you will not be charged any extra money after your stay!!!! Please please keep away from this Hotel and don’t let me experience spoil your holiday. ( Stay away from room 217 ),Date of stay: July 2014,Trip type: Traveled solo,Wolverhampton,https://www.tripadvisor.com/Profile/vimal75
Opera Plaza Hotel,La L wrote a review Jul 2014,50,"Lovely hotel, would stay again!",Location: good location from airport (about 12 minute taxi drive) and 20 minute walk from the Jemme el Fna market. There is also a shopping center with retail stores and restaurants about 10 minute walk from the hotel. Around the corner from the hotel is also a breakfast shop that has amazing Naan bread and coffee. Aside from that we didn't venture elsewhere outside the hotel so I don't know what else was near the hotel.    Room: The room was absolutely beautiful. Clean extremely spacious and had modern furniture. More than enough storage space with the closet. The room also comes with a table and seating area. The bathroom was also VERY spacious and comes with a blow dryer and heating rack for drying clothes bathing suits etc. The pictures on the website are true to form of what you will be getting. We were 3 persons occupying one room. The beds are more like twin size beds even though they are described on the website as a single bed. We didn't need to use the cot which was provided for the 3rd person. Two people are able to fit comfortably in one bed. We stayed in the hotel for 2 nights.    Staff: excellent customer service by the staff all the way around! Staff would provide assistance and give us very great information on restaurants and how to get to places. They are all very attentive and responsive. We arrived in Marrakesh on a 2am flight. We went to the hotel because certain members of our group were checking in to the hotel. However other members of the group were going on a camel trekking excursion at 7am so they did not pay for a hotel stay for 5 hours (as expected). The night crew staff had no problem allowing members of our group to hang out and sleep in a lounge section of the lobby. They even kept their luggage in storage until they returned from the excursion to check in to the hotel. I don't know of many hotels that would allow for that. THANKS TO THE STAFF FOR MAKING OUR STAY PLEASURABLE.    Overall experience: This was our first time in Morocco and the Opera Plaza Hotel made it memorable. No issues with anything during the 3 days of our reservation. There are about 3 restaurants within the hotel a spa fitness center large pool lounging area etc. We spent an entire day in the hotel and did not get bored once with all the amenities they offer. The included breakfast had great variety of food and beverages. Outside seating areas and canopy beds by the pool were great for either eating breakfast outside or lounging by the pool. I recommend a pool facing room. We utilized the spa while we were there and it was amazing as well. Spa staff only speak French but we were able to communicate with them with basic requests and signing. Would definitely recommend this hotel to anyone traveling to Marrakesh.,Date of stay: June 2014,Trip type: Traveled with family,"Fort Lauderdale, Florida",https://www.tripadvisor.com/Profile/668lal
Opera Plaza Hotel,Stacey H wrote a review Jul 2014,10,Be warned!! Nice hotel but iPad stolen from locked hotel room,My stay at the Opera Plaza hotel started off really good and the gentlemen who was on reception when we arrived was very pleasant.    We stayed for two nights the pool was really nice the rooms were lovely and the fitness centre was nice.    After our first night we headed by the pool for the day after breakfast. I left my iPad on charge in my room and when I returned in the afternoon the cleaners were in my room and my iPad and charger were gone.    The manager took no responsibility for this and was extremely unhelpful. He sent us on a wild goose chase to two different police stations who said it was nothing to do with them. We were in a country where we did not speak the language and I expected the manager to help us. He tried to imply at one point that it were my friend and I who took the iPad.    We eventually managed to get the police but only because another lady had had her phone stolen from by the pool the day before and the same manager had told her NOT to ring the police and that they would help her find the phone and that they thought they knew who had it. She eventually got fed up of them messing her about that she went outside and stopped a police car who was passing the hotel and made them come in to help her.    Some of the staff at this hotel were really nice but most of them were rude unhelpful and didn't seem to care about their guests. The lady on reception at the Opera Plaza was so rude to me and refused to be my Arabic to English translator for the police and told me to ask at the reception at the red hotel next door.    I can't say anything negative about the look and feel of the hotel as it was lovely. But I would advise you to stay away from this hotel if you would like to keep your belongings. There is clearly a thief amongst the staff and there is some sort of scam going on with the staff at the hotel as you can read on here about all the other incidents that have happened in the last few months.,Date of stay: June 2014,,"Leeds, United Kingdom",https://www.tripadvisor.com/Profile/R345ZJstaceyh
Opera Plaza Hotel,Some Bloke W wrote a review Jul 2014,50,My 3rd visit need I say more,I have stayed in a few hotels in Marrakech but I keep returning to the Opera Plaza. Not only is it a wonderful hotel but the staff are in a different league.  From attentive pool staff great bartenders a friendly face on the door and great reception team.    To me a sign of a good hotel is how they deal with a situation when it doesn't go smoothly. My online travel agent had booked me in the hotel even though the Opera was full. Not a problem they arranged a room in their sister hotel and had me back in the Opera Plaza the next morning....exceptional service from Siham on reception.    This hotel is quite simply a firm favourite of mine anywhere in the world.,Date of stay: April 2014,Trip type: Traveled on business,"London, United Kingdom",https://www.tripadvisor.com/Profile/SomeBlokeWhoTravels
Opera Plaza Hotel,TinaHulbert wrote a review Jul 2014,40,Lovely hotel but doorman very intimidating,Very well decorated hotel that has a wonderful smell on entering the reception and a member of staff playing Moroccan music dressed in traditional costume and serves you mint tea. Our rooms were excellent. Really big. Very comfortable beds and lovely bathroom. Our room overlooked the swimming pool which was really lovely.    This hotel is located very centrally and opposite the train station and the National Theatre. So great for easy sight seeing. We took advantage of the open top bus service that actually stops right outside the entrance to the hotel.    Food was ok but the selection was very limited at breakfast and dinner.    Poolside bar and dining very nice.    Pool lovely and always a sunbed available. Only downside is your drinks are not served in shatterproof or plastic glasses and on our weekend there we noticed quite a few breakages that werent cleaned up very well. One instance a glass was smashed right into the childrens paddling pool and this wasnt tided up by the people who did the breakage or the staff very well.    Our major bug bear of our stay was the doorman. Bit of a thug. We bought some soft drinks water etc to take up to our rooms and he stopped us and wouldnt allow us to take any of them to our room and were made to feel like naughty school children. We had to put them in the left luggage room and ONLY allowed to get them if we were going to be going out of the hotel. After this incidient each time we entered the lobby he would look at our bags and try and look inside them to see if we had any other stashes we were trying to smuggle in!! On our final day he stopped her and asked her to open her small handbag and to look inside. She refused and made a complaint to the management. They were very apologetic.    Other than that hotel was lovely.,Date of stay: June 2014,Trip type: Traveled with friends,"Bradley Stoke, United Kingdom",https://www.tripadvisor.com/Profile/TinaHulbert
Opera Plaza Hotel,Bonita I wrote a review Jun 2014,50,Opera Plaza Hotel.,I must say my first time in Morocco was not without drama this included spending time time in an ICU unit in Marrakesh. Had it not been for the wonderful staff at the Opera Plaza Hotel it would have been much worse. The Opera Plaza Hotel is a modern hotel with large rooms great balcony overlooking the pool area & a varied breakfast menu. The staff go out of their way to make you feel welcome and I'm really sorry I spent half the time in hospital. If you are looking for a great hotel in Marrakesh book a room at the Opera Plaza you won't be disappointed it is located just across the road from Marrakesh Central Train Station. There is however one thing that should be upgraded that is WIFI it is not the best connection apart from that it is a wonderful hotel. In the future I intend to return and visit the places I missed and will definitely choose the Opera Plaza. Thank you Mr Mohamed & Staff.,Date of stay: May 2014,Trip type: Traveled solo,"Melbourne, Australia",https://www.tripadvisor.com/Profile/BonitaIerino
Opera Plaza Hotel,LifeAt60s wrote a review Jun 2014,40,Wonderful Moroccan Style Hotel,It was a good impression when we walked into the lobby; a local performer was playing the Moroccan music with string attached to his hat spinning around. The people are friendly and courteous. However you need to filled out your own registration with lots of info in it.  The dinning room was nice and the buffet displayed variety of Moroccan food. The breakfast was also wonderful with plenty choices. The room was spacious and clean and we can see the outdoor swimming pool.,Date of stay: May 2014,Trip type: Traveled as a couple,Canada,https://www.tripadvisor.com/Profile/LifeAt60s
Opera Plaza Hotel,Rish2014 wrote a review Jun 2014,20,Not bad... But wouldnt stay here again.,"Stayed here with a friend in June although the hotel itself is really nicely decorated kept very clean has a fantastic pool area and is in a great location we found some of the staff unpleasant at times. Dont bother calling housekeeping or room service if they ever pick up the phone it will probably take them an hour to bring anything up and If you even think about walking into the hotel with a bottle of soda/water it is confiscated by the ""bouncer"" at the door at one point we were asked to throw our full water bottles away while sat in the lobby we decided to go sit by the pool with them and were followed by the doorman who took them off us and threw them out. There's a Mcdonalds over the road but the staff don't like you bringing food upto your room either so was asked not to take it up even though my friend wasn't feeling well couldn't come down and had to have his medication on a full stomach. For the price we paid though breakfast was great the majority of the staff are polite and helpful location is great however they lack tea/coffee making facilities in the rooms and the shower setup is terrible you have to climb into the shower shut the screen which doesnt fully close which means water goes everywhere our bath tub had a huge crack it in also which meant we had to shower in an akward position or risk going through the bath. The safe isnt very ""safe"" either the one we had in our room the first night was locked open so a new one was brought over in the morning and just left on the shelf without being secured wouldnt stop someone picking it up and walking off with it. We booked a taxi to the airport on out last day the guy on reception obviously forgot so after waiting around for a while they booked us a mini van (for 2 of us) for 100dh. Rip off but at this point I couldn't be bothered arguing. I wouldn't stay here again.",Date of stay: June 2014,,"London, United Kingdom",https://www.tripadvisor.com/Profile/Rish2014
Opera Plaza Hotel,Awais B wrote a review Jun 2014,10,Be careful,The hotel itself was a nice place with a good location and a nice swimming pool etc. However the reason I am giving it a bad review is that on our second night my friends phone got stolen from the hotel room which was locked ! The hotel staff took no responsibility and basically said its our fault for not putting it in the safe. One member of staff did try to help but advised us to call the police which did not make any difference. Later on in the week there were two more incidents of peoples phone going missing  the hotel need to have cctv in corridors and find this thief who is ruining peoples experience.,Date of stay: June 2014,Trip type: Traveled with friends,"Manchester, United Kingdom",https://www.tripadvisor.com/Profile/921awaisb
Opera Plaza Hotel,Dee222 wrote a review Jun 2014,50,Fantastic stay - wonderful staff!!,This hotel is probably one of the best I've ever stayed in. It's definitely a 4* if not a 5*! My friend & I stayed for 11 nights & we were so delighted with our choice of hotel. The staff were fantastic especially everyone at reception & really took care of us which was really appreciated as we were two females travelling alone. Everyone was so polite helpful friendly kind & attentive. The staff always made sure we got the best deals gave great reccomendations & even haggled taxi prices for us. Our room was on the third floor & was poolside which was good since the front of the hotel was roadside & I would imagine might be noisy. The hotel has a cafe a nightclub bowling alley & a number of great restaurants including Moroccan Thai & Italian. It has a pool snack bar which serves lovely hot & cold food at the pool side restaurant until 11pm & they even served us the delicious pizzas inside the hotel bar when we were watching the world cup! Everything was luxurious about this hotel from the fabulous beds to the wonderful spa the fantastically cool pool to bamboo woven sunloungers & from the delicious & varied food to the fantastic staff. I have nothing but compliments for this hotel. My only suggestion would be to maybe have a kettle with tea & coffee in the rooms. My favourite thing of all about the hotel was definitely the staff. Such lovely people! Thanks you so much for the wonderful experience & amazing holiday from the Irish girls in room 328 & a special hello & thanks to Faiczel & Abdullah in reception :-),Date of stay: June 2014,,"Ennis, Ireland",https://www.tripadvisor.com/Profile/Dee222
Opera Plaza Hotel,Nera2013 wrote a review Jun 2014,50,Super,The hotel is next to the train station but you do not hear anything. The pool and the food are super.  I should recommend this hotel. All the people  at the reception in the restaurant who work there are really friendly.,Date of stay: May 2014,Trip type: Traveled with friends,"Deinze, Belgium",https://www.tripadvisor.com/Profile/Nera2013
Opera Plaza Hotel,Monty wrote a review Jun 2014,20,"The front of house staff are rude, unprofessional and greedy!",The hotel itself is a lovely hotel! Very chic kind of decent location and modern HOWEVER compared to the very hospitable Morrocan culture you encounter in Marrakesh in general the hotel staff and the front of door men are VERY RUDE AND BAD MANNERED! Totally not what you would expect from a hotel of this standard! The Morrocan hospitality is what makes your holiday amazing and unique and it is a shame to say that they failed miserably in this department! All they care about is money and charge 200DH to use to the pool if you are not staying at the hotel and on top of that the drinks menu is overpriced the food is horrible and service is extremely slow by the pool. Would not recommend a stay here better off staying in The Guilez area where it's cheaper to get around more hospitable and deliciously beautiful food restaraunts right on your door step!,Date of stay: June 2014,,"London, United Kingdom",https://www.tripadvisor.com/Profile/Montsz
Opera Plaza Hotel,Rae H wrote a review Jun 2014,50,Can't recommend highly enough,We have just returned from a 4 night stay at the Opera Plaza and have to say what a great hotel it was. The room was beautiful and the breakfast was lovely with a great choice of food and brilliant coffee! We found the staff very friendly answering all our questions and generally being very helpful. There are timer switches in the corridors but the buttons are regularly placed along the wall and very obvious so this didn't cause us any issues. The bed and pillows were very comfortable and the hotel is lovely and quiet even though there were quite a few people staying. One thing you might need to know is that alcohol is very expensive but that seems to be the same for all the hotels in Marrakech not just this one and it was virtually impossible to buy alcohol outside of the hotels due to it being a Muslim country. The only other thing is that there is quite a step into the bath/shower so might not be the best if you have mobility problems (no problem for able bodied people!)  We loved our stay at the Opera Plaza and couldn't believe what we got for our money we would definitely stay there again if we return to Marrakech.,Date of stay: May 2014,Trip type: Traveled as a couple,"Bristol, United Kingdom",https://www.tripadvisor.com/Profile/RaeT98
Opera Plaza Hotel,BuckleeSalop1 wrote a review May 2014,10,"Dreadful, front of house staff couldn't care less.",A thankfully short stay in this place. Ever tried walking along pitch black corridors with timer switches. Doorman couldn't be bothered to speak to guests and concierge run by what appeared to work experience trainees. Avoid like the plague. Mini bar ridiculously overpriced,Date of stay: April 2014,Trip type: Traveled as a couple,"Ludlow, United Kingdom",https://www.tripadvisor.com/Profile/BuckleeSalop1
Opera Plaza Hotel,Bonso71 wrote a review May 2014,30,3 Day Stay,Stayed there as part of a tour of the Imperial Cities. Good average Hotel but lack attention to detail. On arrival at our room the entrance hall was very dark due to a broken lightbulb which I reported but was never replaced. In this dark area the instructions on the safe are in the smallest front size possible which meant that even with reading glasses they could not be read. Therefore had to ask at reception - who then gave wrong details. The shower was in the bath which had a narrow restricted entrance and a 2 foot broken tiled stepover. It appeared that a glass panel which had been in place had been broken or removed. This arrangement also allowed water to go through the gap to the tiled bathroom floor as well as penetrate the cracks in the tiles. This is not good for small elderly people getting in and out of the shower/bath. The food did not meet our expectations. Beer because of the small bottles worked out at between £6-£7 a pint!,Date of stay: May 2014,Trip type: Traveled as a couple,"Seaforde, United Kingdom",https://www.tripadvisor.com/Profile/Bonso71
