Hotel_Name,Review_Date,Review_Rating,Review_Title,Review_Text,Reviewer_Date_Of_Stay,Reviewer_Trip_Type,Reviewer_Location,Reviewer_Profile_Link
Opera Plaza Hotel,Extraordinary699020 wrote a review Nov 2017,40,Great visit,Stayed here for a week at the end of September with our two adult daughters.  Rooms were spacious and clean and breakfast was great with the option of eating poolside.  The hotel is in a great location about a five minute taxi ride to the main square ( 50 dirhams seemed to be the going rate and 70 at night )  Staff all friendly helpful and polite even when confronted by some incredibly rude and arrogant guest.  Morrocco has a different culture and way of life which should be respected. we found everyone incredibly helpful it's also well worth befriending big Hisham the doorman and concierge  throughout our visit he helped with taxis tours and general advice.  The square and souks are 100 miles per hour  but once you learn how to handle the hustle and bustle and don't feel obliged to answer everyone that approaches you ( just avoid eye contact a polite no and ignoring them isn't found to be offensive ) then Marrakesh is a hugely diverse exciting and evocative city ..... love it,Date of stay: September 2017,Trip type: Traveled with family,"Coalburn, United Kingdom",https://www.tripadvisor.com/Profile/Extraordinary699020
Opera Plaza Hotel,guess92 wrote a review Nov 2017,50,Great mini break,A group of us came here back in may 16 for a mini break.    It was amazing from the very first moment. The hotel checked us in quick. We booked quad biking camel riding and evening entertainment and got a great deal from the hotel.    The staff went out of their way to give a special birthday suprise sent to the room which was lovely.    Everything near by and local. Breakfast was good freshly made food.    Door man was great at hailing taxis and giving out information.    Shisha was great and also the pool area and lobby was good,Date of stay: December 2016,Trip type: Traveled with friends,"London, United Kingdom",https://www.tripadvisor.com/Profile/guess92
Opera Plaza Hotel,u0932497 wrote a review Nov 2017,40,Rooms & lobby very good,Rooms are comfortable and good we stayed in august a family of 35 across many rooms found that some sizes of rooms varied although they were all double rooms breakfast could be better and customer service could improve a lot! overall 4/5,Date of stay: August 2017,Trip type: Traveled with family,"Luton, United Kingdom",https://www.tripadvisor.com/Profile/u0932497
Opera Plaza Hotel,Omotayo O wrote a review Oct 2017,30,Good location a good way to start,Nice big room friendly staff the bar is excellent especially if u into Spanish music u will not be disappointed and the staff are excellent. I would have given a 4 star but a few things which are minor there was a lick overhead of our toilet the Wi-Fi is a disappointment very big for me. Other than that nice big rooms good AC breakfast is a must ranges of varieties and friendly staff. Location is also good I would recommend if you in Marrakesh for a week 2 to 3 days the most u stay here especially if u from a big City can be a bit noisy from traffic otherwise fantastic I really enjoyed my stay and I could be back.,Date of stay: October 2017,Trip type: Traveled solo,"London, United Kingdom",https://www.tripadvisor.com/Profile/Omotayo71
Opera Plaza Hotel,DairyKing1 wrote a review Oct 2017,10,Avoid Avoid Avoid!,"Went here with my family for a week and it was the most horrendous hotel experience. The pictures their website and various reviews had us looking forward to staying here but it didn't live up to what we had hoped. We overheard several complaints being made at the reception when we were checking in and we should have known then that this hotel was the wrong decision.    Some of the staff were extremely rude and demeaning they tried to charge us for things we hadn't taken from the mini bar the food was absolutely horrendous the pool closes early and has a burkini ban and the WiFi was excruciatingly slow to use. We even had to beg for a kettle to use in our room to warm the baby's milk and on several occasions they had us waiting hours for simple necessity's like spoons and bowls to feed the baby (one staff member told us they didn't have any dessert spoons - really?!).    Breakfast buffet was included and things would be left out for hours i.e. cheese until it dried up (in the heat) and bread would be left uncovered poolside free to be walked all over by birds. Barely anything edible....we even paid £25pp for a dinner buffet which was bland and dried up. We even made complaints and were given a run around by staff until we spoke to the head chef who was unable to remedy the situation. To make matters worse no outside food was allowed which is extremely hard with young kids and it being Ramadan (few restaurants were closed).    It wouldn't be fair to not include some pros; being location was decent next to train station and easy access to cabs. Some of them have the tendency to rip you off so if you find a fair priced one stay with them for the duration of your trip. We had two rooms a triple and double and they were both spacious and the beds were comfortable. They also had a bowling alley next door which is fairly priced for some wholesome family fun (would definitely recommend).    The hotel basically lacked a 'family friendly' atmosphere and was all business their way to solving their costumers disputes was basically ""If you don't like it tough!"" which was unfortunate as the hotel definitely has potential. If you want a well rounded vacation please pick another hotel. And if the hotel sees this then please actively make an effort to change a few things and realise the importance of your customers and their basic needs.",Date of stay: June 2017,Trip type: Traveled with family,"London, United Kingdom",https://www.tripadvisor.com/Profile/DairyKing1
Opera Plaza Hotel,adelyn wrote a review Oct 2017,50,perfect!,have just got back from a five day break at the opera plaza 5 ladies staying in two rooms next to one another looking over the pool the staff were very friendly and helpful breakfast had lots of choice evrything was clean ate in the hotel for one lunch and one dinner both very good and tried out the hamman we enjoiyed drinking and dancing in the bar area which has a cuban theme with live music every night we were there the wifi was ok one room could only get it on the balcony the only down side for us was it was a little further out than we thought but it was ok and within walking distance of most things over all it was perfect and would definately recommend it ,Date of stay: September 2017,Trip type: Traveled with friends,"Grimsby, United Kingdom",https://www.tripadvisor.com/Profile/adelyn
Opera Plaza Hotel,Londoner20177 wrote a review Oct 2017,10,Bring your earplugs,"The wifi connection in the room was very slow. The wifi will connect and disconnect frequently. The pages will take long time to load. I raised this with reception staff on multiple occasions and was informed ""IT is looking into it"". The Problem remained for duration of our stay.    We had a room with an 'Opera view'. This was effectively facing a very busy main road. The sound of constant horning became a norm even with balcony door closed. The road was always busy- Strongly advisable to bring earplugs if you wish to stay in the rooms with Opera view. Even when you open the balcony door at 5am you can hear the constant traffic & horning. Definitely not recommend for sleepers sensitive to noise. Those who can sleep irrespective of how much traffic noise is around them will still need earplugs as the traffic is never-ending.    The pricing In the hotel seemed to be more expensive then shopping in central London. To give an example small water bottle will cost 25 Dirham in the hotel when the shop outside will cost 3.5 dirhams. Quad bike excursion organised via hotel was quoted as 500 dirhams which will be part of a large group- however looking outside the hotel a private quad bike excursion (where you don't have to be part of a large group) for 3 people cost 400 dirhams.    Room had a balcony with table and chairs which we can supposedly sit on and enjoy the 'Opera view'- Problematic when all you hear is constant horning; busy traffic and not to add the oil smell.    On a plus note the triple room was spacious. Two double beds and one single. There was enough space between the beds and large movement area in the room. Storage was plenty with a large mirror in the room.    Also The room cleaning service was efficient- after leaving on the first day we informed the hotel that the room can be cleaned and when we came back within an hour it was cleaned. The maintenance service was also efficient- complained about sink drainage and it fixed within few minutes of informing reception.",Date of stay: October 2017,Trip type: Traveled with friends,"London, United Kingdom",https://www.tripadvisor.com/Profile/Londoner20177
Opera Plaza Hotel,Jamez A wrote a review Sep 2017,50,Excellent hotel,Just got back from a week stay here the hotel is very clean. Located in a safe decent part of marakech with very helpful staff.  The breakfast was excellent with additional extra touches like the fresh omelettes and pancakes. The choice was very decent. The pool is very clean with many comfy sun beds. The room 220 we stayed inn had excellent pool view. The room itself was very modern with large shower area and storage space with TV and balcony. The room was cleaned everyday by the staff towels bed sheets changed. The staff all speak very good English especially front of house who are very helpful and friendly. I would like to thank all the staff especially the girl from their bookings who sorted this excellent room out on my request.  Look no further hotel is located in nice location you can get around all of marakech very easily from here. I found a large supermarket if you walk out of the hotel turn left down the first road where the station it's 10 min walk but it has everything and it is very cheap. Also a decent place to eat near the hotel was on the same road before the large supermarket opposite the supra tours bus station has red shop front modern looking clean place the food was very nice and very good value.,Date of stay: September 2017,Trip type: Traveled with friends,"London, United Kingdom",https://www.tripadvisor.com/Profile/Zee6666
Opera Plaza Hotel,Angela A wrote a review Aug 2017,40,great start to wedding week,we arrived at the hotel on 1st of August for a 4 night stay in total 13 of usthe rooms were spotlessthe staff so friendlyeveryone greeted you.All areas of the hotel gleamed.Breakfast was very goodwonderful choice and omelettes cooked while you waitedpool area was lovely.We had lunch a few times at the pool bar which was really good.would recommend this hotel and would stay here again.Thank you opera plaza for a wonderful stay,Date of stay: August 2017,Trip type: Traveled with family,"Hereford, United Kingdom",https://www.tripadvisor.com/Profile/395AngelaA
Opera Plaza Hotel,Trish A wrote a review Aug 2017,20,Friends 50th Birthday,We stayed at this hotel with 5 other couples to celebrate a friends 50th birthday in June. I don't like giving bad reviews as I always try to find a positive but I'm afraid on this occasion I can't find one😢  The air conditioning didn't work properly in the bedrooms and in temperatures of over 100* this was unbearable. When I spoke to reception and asked for a different room they looked at me as if I was mad!  The food at breakfast was dreadful with very little choice. The bar was comfortable but staff were not friendly and everything seemed like an effort to them. The bottles of beer had rust around the bottle tops!  The pool area was quite nice but the service was shocking at the pool bar and restaurant. I have a salad that tasted sour due to the lettuce being past the sell by date.  We had to beg for towels and if we were lucky we would get them before we headed to the bar/ restaurant for a spot of lunch!  The bedrooms and bathrooms were shocking! Very tired and basic.  I was very disappointed in my stay at the Opera Plaza Hotel and would not recommend it sorry😢,Date of stay: June 2017,Trip type: Traveled with friends,"Theydon Bois, United Kingdom",https://www.tripadvisor.com/Profile/trisha477
Opera Plaza Hotel,OregonMom123 wrote a review Jul 2017,50,Booked The Red Hotel but got room at Opera Plaza,Great for families with kids as some rooms have three single beds. Spacious rooms with wonderful outdoor pool to escape heat and huge delicious breakfast buffet included with traditional Moroccan breads and dishes alongside American/European dishes (eggs made to order e.g.) Great location by the main avenue outside the Medina.,Date of stay: July 2017,Trip type: Traveled with family,"Portland, Oregon",https://www.tripadvisor.com/Profile/OregonMom123
Opera Plaza Hotel,Adeel N wrote a review Jul 2017,10,Would not recommend! Burkini ban!,Burkini ban in place!!! So wasnt allowed to use pool area. So any women that wish to cover up in pool wont be allowed as there are signs in hotel stating bikini yes burkini no!!!  Service is mediocre but that said the hotel was clean and tidy.  The fact that i was unable to use the pool area because management of the hotel think they can tell me what to wear has completely put me off. I will not return and would not recommend.,Date of stay: October 2016,Trip type: Traveled as a couple,,https://www.tripadvisor.com/Profile/429adeeln
Opera Plaza Hotel,Emese P wrote a review Jun 2017,30,Always put your jewelries into the safe,Staff members were nice but we had some issues with the receptionists. They said that one of the tours started at 9 am that is why we wanted to wake up at 8 am but the phone was ringing at 7.45 : ’The car is here’ so we hurried and I forgot to put my gold earrings into the safe. When we came back to the hotel my earrings disappeared. We notified the receptionists but they did not do anything. After 2 days we asked them again and finally one of the receptionists called the housemaids: ’she said she did not find anything’. We checked the room at least 5 times so it was obvious that somebody had stolen them. In case of an other tour offered by the hotel the pricing method of the tour guide was outrageous since he wanted us to pay three times more than the previously indicated price so we finally refused to take the tour although we paid the transfer to Atlas and the lunch. The recepcionist told us that the manager would talk to the tour organizer agency but we didn't get any feedback on it.  By the way the pool and other services were nice we enjoyed our stay here but these incidents were so depressing and honestly I was very dissapointed.,Date of stay: June 2017,Trip type: Traveled with family,,https://www.tripadvisor.com/Profile/EmeseP48
Opera Plaza Hotel,srini05 wrote a review Jun 2017,40,Nicely located hotel with good amenities,Stayed here during our company offsite. Well appointed large rooms good breakfast a nice pool & decent service. Not too far away from the old town & market. The only complaint I'd have is they didn't have wifi connectivity in the rooms which is hygiene in todays times. But overall was satisfied with the stay.,Date of stay: March 2017,Trip type: Traveled with friends,"Mumbai, India",https://www.tripadvisor.com/Profile/srini05
Opera Plaza Hotel,George B wrote a review Jun 2017,30,Expensive,A nice clean well run hotel with spacious rooms a lovely pool area a decent menu varied food served from main restaurant or poolside bar. But....be aware drink restrictions outside of hotel means you are well over charged for food and drinks! £6 for bottle of corona or bud £6 a single g&t .example..lunch 4 bottles of beer a salad a club sandwich obviously without bacon £46.00 . Restaurants outside just as expensive any bar you find that actually sells alcohol wow for example a group of 4 girls paid £170 for a bottle of vodka in a club. So beware rip off morroco.,Date of stay: June 2017,Trip type: Traveled with friends,"Chertsey, United Kingdom",https://www.tripadvisor.com/Profile/georgeburden50
Opera Plaza Hotel,tasshi_94 wrote a review Jun 2017,50,Comfortable and Excellent,Staff members were amazing as they will make the effort to make your stay enjoyable. Rooms were beautiful and clean! Food within the hotel was tasty and the atmosphere made you feel like you were home. My family and I always stay at the plaza and will always go there every time we visit Marrakech:),Date of stay: July 2016,Trip type: Traveled with family,"Luton, United Kingdom",https://www.tripadvisor.com/Profile/tasshi_94
Opera Plaza Hotel,bengal_tigress wrote a review May 2017,30,"Good location, average hotel and could do with improvement",This is an average hotel and I don't feel it's 4 star worthy. I would say it's a top end 3 star at best. It's pleasant looking from the outside and has small lovely pool which gets a lot of sun. Our rooms were facing the roads. On the first night we got there we were greeted by a friendly staff member. The door man is very helpful and friendly. Other staff were also friendly but there were quite a few who weren't really interested in helping at all and at times could be rude.    It's possible to walk to the Jemaa El Fnaa from here although we always took a cab as you'd have to walk in the heat for about 20 minutes. We never managed a metered taxi so always had to pay above the price. The doorman would normally help with this to ensure it wasn't excessive although the price he negotiated for us was always above the price had it been metered however we appreciated the fact that he did help.    We had breakfast included in ours. It was a very average buffet breakfast (nothing special but nothing to complain about either) although I did like the fact there was a person making omelettes daily. Would have been better if they had more options. Get there early as it does get packed quickly.    Pros:  - Good location  - Rooms were a very decent size safe was good  - Free wifi although you can only do very basic things with it like check email etc. Anything more than that and it won't work and was slow!  - Some friendly staff (the breakfast manager was wonderful he helped us immensely in explaining to staff who do not speak English).  - They had a good spa room where we used the hammam and I felt so refreshed from it. The lady did a wonderful job scrubbing my back. I also had a facial which was very good. I would certainly recommend the hammam and facial but not the rest (see below in cons). It was easy to get an appointment.    Cons:  - The carpets were stained and dirty and although pleasant looking at reception and from the outside as you go up it's actually quite out of date and looks dirty.  - Whilst I'd recommend the hammam and the facial unfortunately the remainder services that we used (massage and manicure/pedicure) were mediocre at best. The massage was just so hard and the lady doing the manicure was very impatient and stroppy and the nail polish came off straight away.  - We didn't realise we needed to bring a towel with us to the spa as although they had towels available they wouldn't allow you to take the towel back upstairs and then bring it back down to them. You must change whilst there so remember to take a towel with you.  - The bed was so hard to the point it gave me a backache. And I'm someone who actually enjoys a firm bed!  - Room cleaning wasn't great. It was below average. We often ran out of toilet tissue and it would take ages to get a replacement which was so frustrating as when the room cleaning had taken place they should have seen there was hardly any tissue and given an extra roll especially as it was evident there were three people in the room. Our duvet covers were also not changed daily.  - We had a room of three single beds. 2 were decent size and 1 was for a small kid. Given it was 3 adults it would have been great if the beds were all the same size especially given the room was big enough and could accommodate it.  - On the day we were leaving at checkout they sent someone upstairs who was rummaging around the room to make sure we hadn't taken any of the towels. I appreciate they need their towels and we had no intention of taking it but it made us feel so uncomfortable of them doing this especially when they were rummaging through the room and panicking since one of the towels was on the bed and blended with the duvet.  - At times the person at reception would be busy on the phone and despite us requiring help would not get off and it was clear it was a personal call not a customer calling. On the day we were checking out the person who needed to check us out (and there's only one person at the desk) was busy having a casual conversation with someone else. She could see we were waiting but did nothing to attempt to serve us and almost made us late.    I would say this hotel is only worth staying at if you're on a budget. It's not worth anymore than £50 a night (per room not per person). (And I am being generous here!)    Would I come back to say? Only if I couldn't find something better then probably yes. Saying that I am returning to Marrakech in July and although Opera Plaza was an option we have chosen to stay at a different 4 star hotel who has similar reviews to Opera Plaza but was cheaper in price.    Would I recommend it? If you're looking for a real 4 star hotel then no as it is not 4 star quality. If you're happy with 3 stars or below then yes. Don't get me wrong it's an average hotel but it really needs some major improvement to be considered 4 stars (in terms of service and quality and just general maintenance).,Date of stay: June 2016,Trip type: Traveled with friends,"London, United Kingdom",https://www.tripadvisor.com/Profile/bengal_tigress
Opera Plaza Hotel,shaSouthAfrica wrote a review May 2017,50,Excellent hotel,We stayed here for three nights. Very clean rooms comfortable pillows and bed. No kettle and bottled water safe is available in the room. Breakfast is excellent. The staff are very informative and friendly. Beautiful decor and a wonderful fragrance as you enter the hotel. Close to shops and restaurants. Be careful as you get in and out of the bath as it is quite high. Free wifi occasionally slow.,Date of stay: May 2017,Trip type: Traveled as a couple,south africa,https://www.tripadvisor.com/Profile/shaSouthAfrica
Opera Plaza Hotel,BibigulDoha wrote a review May 2017,40,Good location & Comfortable room,We arrived from Rabat. It was a big group of 25 persons. Our group leaders / organisers went to the Reception while we waited in the spacious cool lobby.  Our luggage was wheeled in rapidly. We got our allotted rooms and got our luggage marked and left for upstairs. The luggage followed in a while as there were many of us and only 2 persons handling it.  The rooms were big with comfortable beds 2 arm chairs with a table between and a big desk and chair.    The only thing missing and disappointing was the lack of an Ironing table and iron. It has become a standard feature all over the world but not so in Morocco. This being the third hotel we stayed in since the beginning of our visit to the country.    The breakfast was great loved the variety enjoyed freshly made eggs in the morning with loads of fruit and other goodies.  Enjoyed the live music one evening in the bar. Requested a couple of songs and the singers did a good job.  The hotel is a leisurely walk of 15-18 mins from the Menara Mall.,Date of stay: April 2017,Trip type: Traveled with friends,"Islamabad, Pakistan",https://www.tripadvisor.com/Profile/BibigulDoha
Opera Plaza Hotel,Shehnaz P wrote a review May 2017,50,Amazing stay,We stayed at the hotel Opera Plaza for 7 nights. We enjoyed our stay clean hotel great friendly staff. Variety choice of food. Definitely would go again. The room was up to our standards. Comfy beds. Bathroom was spot on. Thankyouu to All at Opera Plaza.,Date of stay: October 2016,Trip type: Traveled as a couple,"Leicester, United Kingdom",https://www.tripadvisor.com/Profile/shehnazp
Opera Plaza Hotel,Ashfaq H wrote a review May 2017,40,Family holiday,I really enjoyed my stay at the opera plaza nice clean rooms breakfast was good they make you omelette and paranta on request. Went with kids they really enjoyed the pool which again was very clean you have to place deposit for a beach towel 200 dihrams which you get back once returned. The only downside was the wifi which was not great unless your by the poolside. Location was good close to train station and manera mall.,Date of stay: May 2017,Trip type: Traveled with family,"Birmingham, United Kingdom",https://www.tripadvisor.com/Profile/625ashfaqh
Opera Plaza Hotel,Adnaan N wrote a review May 2017,30,Decent hotel,The rooms are very smart and comfortable  except there's no kettle or tea;coffee facilities yet the hotel moans when food or drink is brought from outside in.They also ban women from swimming in the pool area unless a bikini or swimming costume is worn meaning conservative outfits such as shorts and t-shirts aren't allowed even though it's a Muslim country ? A bit too western for my liking and not a very Moroccan feel.,Date of stay: April 2017,Trip type: Traveled with family,,https://www.tripadvisor.com/Profile/AdnaanN3
