Hotel_Name,Review_Date,Review_Rating,Review_Title,Review_Text,Reviewer_Date_Of_Stay,Reviewer_Trip_Type,Reviewer_Location,Reviewer_Profile_Link
Opera Plaza Hotel,nataliem962019 wrote a review Mar 16,40,Great location to explore Marrakesh,Stayed here for 3 nights. Really nice hotel with great location! The only disappointment we had was that we paid extra for a pool view. However on arrival we noticed there were building works being done to the pool so this wasn’t accessible and we were not informed and instead had a view of a building site :( However we did book through booking.com so not entirely hotels fault.    Pros:  Big spacey rooms  Breakfast - good variety and fresh juices are lovely  Nice spacious bathroom  Nice restaurant / sitting area outside (if the pool was done)  Mini fridge with drinks available to purchase  Room service available (we did this after a long day trip and it got to our room within 20 minutes!)    Cons:  Uncomfortable bed - mattress was very firm which I guess is down to personal preference but this really hurt my back and my sleep was awful during our stay.  Air con (room too hot- was a notice on the wall stating air con does not come on until 30th April so we spent every night waking up sweating)    Recommendations:  Check the hotels pool is open prior to booking !  Request a room away from the bowling alley (we were 3 floors up and could still just about hear it until late)  Day trip to Aït Benhaddou and Ouarzazate  The jemaa el fna market (take bag that you can close and don’t take valuable belongings if you don’t have to and HAGGLE!)  The parc Lalla hasna right by the market is a great place to sit and cool down in the shade  And taxis!!! try and agree a price before your trip otherwise they’re going to charge a fortune. We got charged 200dh for a 5 minute drive which is equivalent to £18 for us!! Shocking.  Exchange money a bit at a time as the exchange rates aren’t great and you could lose out a lot by doing it all at the airport. Lots of places in Marrakesh to exchange money- train station next door to hotel does it.  Restaurant called bagatelle was lovely! French menu but you could make out what a lot of it was (it was also about 15 min walk).    Overall be confident! As we found we were being done over for prices pretty much everywhere shops/ taxis etc. Don’t be afraid to say no or to haggle ! :),Date of stay: March 2023,Trip type: Traveled as a couple,,https://www.tripadvisor.com/Profile/nataliem962019
Opera Plaza Hotel,lara wrote a review Feb 2023,30,Convenient Location,Stayed as part of large tour group. The Hotel is around a couple of miles or 10 minute taxi drive of the main square. On a busy junction so as a pedestrian bit nerve wracking crossing the roads at Zebras when the drivers mainly ignore the green man. Just follow the locals as they seem to have the confidence to cross the roads at will. Money change and ATM available at railway station which is a 5 minute walk of hotel    Positives for the hotel were clean comfortable good choice of food for both breakfast and dinner.    Negatives - hotel check in process for a large group is just ridiculous. Took 2 hours to get room. Reception wanted all the visa information before issuing a room key. Reception could have obviated this by taking in the passports and guests collecting at a later stage. Done a number of tours and this was the worst check in process I have to deal with. In the dining room it took along time to clear tables and bar service was very slow. Checkout for a large group is also painful as every mini- bar has to be checked individually on the morning of departure    Customer Service was below par for what is supposed to be a 4 star hotel and hence the rating,Date of stay: January 2023,,,https://www.tripadvisor.com/Profile/drakus10
Opera Plaza Hotel,Smith S wrote a review Jan 2023,50,Amazing,Came in a group  Everything was top the sublime breakfasts the buffet dinner excellent  The setting beautiful and the teams are kindly and present for us  We will come Back thank you for everything  Smith,Date of stay: January 2023,Trip type: Traveled with friends,,https://www.tripadvisor.com/Profile/278smiths
Opera Plaza Hotel,Maroua A wrote a review Jan 2023,50,Amazing hotel .,That was my first time visiting Marrakech and I have chosen OPERA PLAZA HOTEL as a place to stay . Such as a stunning hotel especially the food it was phenomenal and delicious . I loved it. Thank you chef .,Date of stay: January 2023,Trip type: Traveled as a couple,,https://www.tripadvisor.com/Profile/marouaa252
Opera Plaza Hotel,Mohit wrote a review Jan 2023,20,Okayish hotel with zero customer service,We had booked a room for 2 adults and 2 kids. They provided me with a double bed and a single bed. They also gave stuff for 3 people e.g. 3 towels. Initially they even refused to provide a 4th towel but after a while they agreed to give it - imagine! Though we received 4th towel 2nd night after asking them 4 times and complaining manager about this.    Staff (especially reception) is very poor. No one would ever smile or greet. I havent seen any other hotel with such indifferent staff.    Hotel is ok - not a 4 star. Breakfast was decent and some of the kitchen staff was quite nice.    Not worth the money you pay.,Date of stay: January 2023,Trip type: Traveled with family,,https://www.tripadvisor.com/Profile/Travellermohit1
Opera Plaza Hotel,Manuel G wrote a review Jan 2023,40,An outstanding accomodation outside the Medina.,A very good four star international hotel less than 10 minutes drive from the Medina with a very convenient private parking just aside the hotel.  Extremely large and well designed room facing the internal swimming pool court so not noisy at all.  Luxurious breakfast mixing international and local food several made to order.  I strongly suggest this hotel if you are looking for an international accomodation outside the Medina.,Date of stay: December 2022,,"Pavia, Italy",https://www.tripadvisor.com/Profile/V4018FFmanuelg
Opera Plaza Hotel,GF_Gavin wrote a review Jan 2023,40,Good up-market hotel,Up-market well-run hotel situated in a good area of Marrakech close to the railway station. Room was large with a comfortable bed the air-conditioning worked well nice balcony overlooking the inner courtyard gardens and pool. Thankfully all the hotel rooms seem to overlook the courtyard rather than the busy streets outside. Room was spotlessly clean. Bathroom was huge with a bath and a big walk-in shower. The room alo had a safe and a mini-bar so well-equipped.  Restaurant food was good buffet style with plenty of choice. More staff in the restaurant would have been good though as ordering drinks was a slow process.  The restaurant by the pool was good too and service always very helpful and efficient. The pool was good with staff always on hand for safety and keeping everything neat and tidy and clean.,Date of stay: November 2022,Trip type: Traveled solo,"Coggeshall, United Kingdom",https://www.tripadvisor.com/Profile/GF_Gavin
Opera Plaza Hotel,Vik K wrote a review Dec 2022,40,Recommend,Very nice property deserving of 4 stars and it’s solid hotels.com rating. Great breakfast with freshly made omelettes and fresh orange juice. Pool area and common spaces are very stylish. Rooms were clean and comfortable with good size bathrooms. Located adjacent to the train station . Sound proofing in the rooms could be improved otherwise a good stay .,Date of stay: December 2022,Trip type: Traveled with friends,,https://www.tripadvisor.com/Profile/284vikk
Opera Plaza Hotel,Ashley W wrote a review Nov 2022,50,Fine hotel in a quieter area of Marrakech.,We stayed for five nights as a party of 40 on an organised tour with breakfast and dinner. Great selection of food cooked in a local style for both breakfast and dinner. Room was large clean good facilities large bed & good quality bedding Bathroom was excellent with clean thick towels changed on request. Short transfer from the airport and located in a modern area of the city amongst high end hotels. 40 minute walk to the main square along leafy boulevards or taxi easily available. Pool was open but cold at this time of year. Friendly and efficient staff. A great hotel if you want to be in a quieter area of the city.,Date of stay: November 2022,,United Kingdom,https://www.tripadvisor.com/Profile/ashleywU3151QN
Opera Plaza Hotel,Marise D wrote a review Nov 2022,10,Do not recommend,This was one of the worst experiences at a hotel that we have had.  Our check in was delayed for 2 hours because the front desk manager claimed that the tour company had not confirmed the room. 5 of the rooms were able to check in.    Front Desk Manager was rude and dismissive and needs training in customer service. He has a surly attitude and did not bother to apologize for his obvious mistake with our booking.    Our key card got deactivated 1 day into our stay when we came back after a tiring day. The front desks manager blamed us for demagnetising the key.  The second key sitting in the slot by the door suffered the same fate. The manager did not take accountability for this.  5 out of the 6 rooms in our tour group suffered the same issue with their key cards. From other reviews I can see that this is an ongoing issue that has not been rectified.    Our shower got flooded and our tour CEO came over to take care of it for us. From other reviews I can see that this is an ongoing issue.    Food was mediocre wait staff making omelettes at breakfast were lackluster and unfriendly and carried on conversations amongst themselves as they were serving customers.  There were a few friendly wait staff whom we tipped handsomely for their customer care.  The bell captains were eager to please and helpful.    Will not recommend this hotel after the bad taste that the bad treatment by the front office manager and upkeep issues.,Date of stay: October 2022,Trip type: Traveled with friends,,https://www.tripadvisor.com/Profile/119marised
Opera Plaza Hotel,Customer744 wrote a review Oct 2022,10,Terrible customer service!,Poor customer service! The ladies at reception are actually rude! They chat with each other in Arabic while they are checking customers in and hardly look at you.    The toilet in our room did not flush properly (if you poop pray that you will be able to flush it)!    Also they recommended we use a tour guide via their connection who cost us 800 dirhams for 4hrs. The guide had a heavy accent and we were not able to understand 33% of what he said even though we asked for an English speaking guide. This guide spent 20% of the time on his phone and spoke with several people in the souks while we were paying him for his service.  Shame on the hotel - they refused to tell us which company the guide is working for. Are they cutting deals with guides?    The breakfast was good with plenty of coffee breads pastries and traditional Moroccan msemen (square roti).    Our bathroom was dirty at check in - see photos.    I will not stay here again even though it is located near the train station in the new section of Marrakech.,Date of stay: October 2022,Trip type: Traveled as a couple,"Toronto, Canada",https://www.tripadvisor.com/Profile/Customer744
Opera Plaza Hotel,Ejrev wrote a review Oct 2022,30,First Time Visit,Booked a 3 bed room in September hotel is in a good location. Overall the hotel was good with a wide selection of breakfast options the fresh juices including beetroot and orange juice were great and the breakfast staff were polite. Please do keep milk next to the tea station as we had to go outside next to the cereal to get milk.  The rooms are clean however the bathroom was a total let down. The toilet had plumbing issues all week and did not flush even though they came to fix. It was all rusty inside and brown rotten which needs total replacing. We had to flush several times for the waste to go but still did not work which wasted a lot of time. (There are no bidets in the toilets) The bath was way too high which is not good for anyone.    One other thing is that they didn't place sufficient toiletries for each of us and when asked they came after a very long time. Room service and waiting times needs Improving as it is currently very very slow.    In terms of housekeeping they made a good effort but please don't touch or throw away things that are kept on the bedside which is not appropriate as all rubbish would be on the floor or in the bin. Rooms were not vacuumed every day either. Also there were no face tissues slippers or tea making facilities which isn't great for a 4 star as we were expecting this.    WiFi is free however at the balcony area there was no connection (city view)    Staff are very polite apart from a few that let's the hotel down as when we first walked in they just stared at us and we did not receive a warm welcome. First impressions count! Also the lady receptionist opened up the first passport and said we don't have a booking when she should first ask who's name it is under. Maybe she needs further training.    Overall it is a good hotel but with the above tweaks it will be fabulous.    Thank you.,Date of stay: September 2022,Trip type: Traveled with family,,https://www.tripadvisor.com/Profile/Ejrev
Opera Plaza Hotel,slim e wrote a review Sep 2022,50,Highly recommended,Excelent foodcustomer service amazing room for the amount you pay  The pool bar is the place to be.  The mangager is so friendly and very professional.  Breakfast is something else.local and midetareean buffet.  You cannot ask for better location,Date of stay: September 2022,Trip type: Traveled on business,,https://www.tripadvisor.com/Profile/994slime
Opera Plaza Hotel,Mohammed wrote a review Sep 2022,50,Excellent!!!,Fantastic hotel!! (see pictures). Staff were very warm & welcoming. Special mention to Jawad Lamia & Khaoula they went over & above to help make our stay comfortable. Always got a polite greeting whenever we walked past.  Breakfast was very good with something for everyone. Rooms were clean tidy & odour free. Room service & fresh change of towels daily.  The Red Hotel isn't closed but rather sharing the same entrance as The Opera Plaza Hotel (It's a much nicer & grande entrance). The Hotel is situated in the modern part of Marrakech a perfect & lively location with everything within 10/15mins walking distance. Overall 10/10. I would definitely recommend.,Date of stay: September 2022,Trip type: Traveled as a couple,,https://www.tripadvisor.com/Profile/mshahzad_187
Opera Plaza Hotel,TORN1 wrote a review Sep 2022,30,Great breakfast and nice pool!,Stayed on a tour. Nice and clean pool. Great location. Breaky was great.  Did laundry at the hotel. Felt a little screwed over as we checked off the quantity boxes for clothing articles as well as checked off folded. Well they came back nicely pressed on hangers. When I saw the bill it was almost twice the price as  Not only did we pay for  Washing but we also paid for pressing of clothes too.    Also the deposit for pool towels isn’t convenient for guests especially when not informed on check in.,Date of stay: September 2022,Trip type: Traveled with friends,"Toronto, Canada",https://www.tripadvisor.com/Profile/TORN1
Opera Plaza Hotel,Man-from-CFL wrote a review Aug 2022,40,Good modern hotel opposite the train station,Stayed for three nights whilst in Marrakech for business; the Opera Plaza is in the same building as the Red Hotel. The bedroom seemed slightly larger than that of the Red Hotel and the bathroom was huge with both a bath and huge powerful walk-in shower. The bed was comfortable and the air-con excellent (especially as it was up to 50˚C outside). The room had a good-sized balcony with views over the pool; the pool was excellent with plenty of sun loungers available.    Breakfast was served by the pool with more choice than at the Red Hotel; including omelettes cooked to order. Most of the restaurants in the hotel were closed again apart from the pool bar / restaurant which provides good light meals (pizza pasta etc.) there are however a number of good local restaurants nearby. The hotel is located in the new city (some distance from the old part of Marrakech) opposite the train Station (for Casablanca and the north) and coach station (for Agadir and the south) and a 15 minute cab ride from the airport making it a good location for onward travel within Morocco.,Date of stay: July 2022,Trip type: Traveled on business,"Sheffield, United Kingdom",https://www.tripadvisor.com/Profile/Man-from-CFL
Opera Plaza Hotel,Jimmy Mir wrote a review Aug 2022,40,One of the best hotels in town (Best location),Firstly i would like to say that all the people working here from the security to the people cleaning your rooms are very friendly and service minded. They are always just a moment away if you need anything. We stayed in this hotel for 21 nights and had a terrific time.    The only reason i am giving them 4 out of 5 is our last day. The pool-guy found poo in the pool most probably a kid who did that.  The pool-guy removed the poo with a big stick and threw it away. It was in the water for maybe 45-50 minutes before someone notified him. I am not blaming the hotel for that. They do not have control over this situation.    BUT what they in fact have control over is the outcome they did not tell people to get out of the pool after finding out. I understand that it was 1 hour left till 19:00 (when they close the pool) but when you have had poo floating in the pool that can cause e-coli hepatitis a giardia or crypto paraside and there are a lot of people in the pool including small kids i believe they could have made a better decision.    I did let the reception know as well after finding out and told them about the potential consequenses because there were several kids still swimming in the water. I also told her that i am going to throw all of the swim wear me and my son was using and most probably the towels and shirts we used when going back to the room. (Worth 400-600 dhm).    Maybe the pool-guy or the receptionist did not have any say or authourity to close the pool that is why the leadership should have routines in place for incidents like these. They could have closed the pool and offered the guests who were in the water free cleaning of all the clothes or something like that.    Either way apart from this incident we loved the hotel. The location is one of the best you can find in Marrakech it is right beside the main train station that can get you to Casa blanca Agadir Tanjier and so much more. The supratours main busstation is also just a block away. There is a guy right outside the hotel that can help you find taxi he is a real one and will even bargain for you :)    The cleaning staff were always so helpful and did more than expected. The buffet and the staff in the restaurant were always smiling and worked hard to please the guests. The breakfast was amazing fresh fruit veggies and moroccan specialties. Thanks to this hotel we fell in love with the area.We loved the area around the hotel so much that we are buying an apartment just a block away from the hotel. Shukran for everything 😀,Date of stay: July 2022,Trip type: Traveled with family,"Oslo, Norway",https://www.tripadvisor.com/Profile/JimmyMir
Opera Plaza Hotel,Ant P wrote a review Jul 2022,30,Not bad; just not great.,Almost immediately on boarding the transfer to the hotel the TUI rep was hassling me to book trips. These were more expensive than than in the TUI app. Not what you need really having just landed though I subsequently managed to avoid him.    The hotel is OK; not dismally bad just an unusual combination of the mediocre and the irritating. Room was basic but not bad. The air conditioning worked well. Generally clean but quite tired looking decor. Room service often didn’t turn up so on a couple of days the room wasn’t cleaned. Not a big deal really but not great either.    I was looking forward to the Havanita wine and cigar bar advertised. Disappointing that it is permanently closed - this should not be advertised if not available. Melkis the traditional Moroccan restaurant actually has the same menu as the pool bar so there’s no real difference of experience other than you’re indoors. Pool bar very expensive for the basics like soft drinks. Other restaurants advertised in reception were not open. If you want to eat definitely go out of the hotel; Dameh is good and worth trying.    Pool areas is nice and well laid out.    TUI app is useful but clunky and not intuitive. Electronic boarding passes are there if you look for them but confusingly the app says they’re not available.    Overall not a bad place to spend a week but too many niggles to make it a memorable experience. Would not return to the Opera Plaza as there are too many alternatives.,Date of stay: July 2022,Trip type: Traveled with family,"Bedford, United Kingdom",https://www.tripadvisor.com/Profile/AntPerks
Opera Plaza Hotel,simjenk wrote a review Jul 2022,40,A solid hotel - but keep in mind what kind of Marrakech visit you want!,"I stayed one night in the Opera Plaza Hotel after a 9-day journey across Morocco with my family. Coming from the desert it was nice to spend a night in a more luxury hotel for a night to refresh and recharge.    The staff were very pleasant to deal with and let us check out one hour late at 1 pm. After that we stored our bags in the baggage room which was convenient until we had to leave to go to our next destination.    The buffet breakfast may have had the most variety of any hotel I stayed at in Morocco (lots of bread fruit meats omelette bar).    One thing to keep in mind though: the hotel is in the Nouvelle ville portion of Marrakech so you don't get the atmospheric ""medina"" vibe. Some people may like that but if you'd rather experience a more traditional Marrakech it's best to book one of the riads in the old city instead.    Note if you're taking the train: The hotel is right next to the Marrakech train station.",Date of stay: July 2022,,Ottawa,https://www.tripadvisor.com/Profile/simjenk
Opera Plaza Hotel,Alberto wrote a review Jun 2022,50,Just wow,It was an unforgettable experience thank you very much🙏 it was my first time in opera plaza and I felt I was with a second family I thank the reception for warm welcome the chief for the delicious sandwichs I got in snack bar and the house keeper (I forget her name but I couldn't forget her availability and her kindness).  Anyway i will come back. The last thing you can play bowling and have drink ( American lifestyle) 😉,Date of stay: June 2022,Trip type: Traveled with friends,,https://www.tripadvisor.com/Profile/Alberto-lif
Opera Plaza Hotel,Alice Fabbrica wrote a review Jun 2022,50,Wonderful hotel in Marrakech!,I stayed at the Opera Plaza Hotel with my boyfriend and we had a great time!  The hotel is wonderful it is located in the new zone of Marrakech which is a modern and very quiet area. For us the hotel is a real oasis of relaxation in which to rest away from the hustle and bustle of the Moroccan city.  The structure is modern and minimal the internal areas are very particular well cared for and everything tidy and very clean!  Inside the structure there is a large internal courtyard in which there is a large swimming pool very suggestive and around it deckchairs and sunbeds.  We stayed in a suite number 416 super spacious modern and with a terrace overlooking the pool… truly enchanting!  The hotel staff is very kind and careful to individual customer needs.  The breakfast is very tasty there are many different choices and is served in the pool area so the atmosphere is very pleasant and relaxing.  I recommend you to come here you will have a great time!,Date of stay: June 2022,Trip type: Traveled as a couple,"Milan, Italy",https://www.tripadvisor.com/Profile/alicefabbrica
Opera Plaza Hotel,Emanuele Borriello wrote a review Jun 2022,50,Magic place for couple ❤️,Elegant hotel with a fantastic swimming pool in the center of the structure. Large rooms with typical Moroccan style. Friendly and smiling staff always available to help and advise us. Excellent location located in the new part of the city but only 20 min. walk from the main square! Absolutely recommended.,Date of stay: June 2022,Trip type: Traveled as a couple,"Milan, Italy",https://www.tripadvisor.com/Profile/emanuele_borriello
