Hotel_Name,Review_Date,Review_Rating,Review_Title,Review_Text,Reviewer_Date_Of_Stay,Reviewer_Trip_Type,Reviewer_Location,Reviewer_Profile_Link
Riad Melhoun & Spa,Edgar P wrote a review Jun 2017,40,"Relaxing and comfortable, great service",My parents and I had a wonderful stay at the Riad Melhoun. The manager Mohamed was very attentive to our requests and always tried his best to ensure that we were happy with our stay. When we arrived he treated us to traditional Moroccan tea and cookies and he also gave us a tour of the Riad to help us feel at home.    Mohamed arranged transportation to and from the hotel and he also booked our camel tours at a nearby desert. Breakfast in the morning was delicious and filling served by a very nice server named Ahmed.    Overall a fantastic stay in Marrakesh in a riad that is close to the Bahia Palace and the main square Jemaa El Fna.    Sometimes the snacks that were listed on the menu were not available.,Date of stay: June 2017,Trip type: Traveled with family,"Chicago, Illinois",https://www.tripadvisor.com/Profile/edgarp923
Riad Melhoun & Spa,mahfa386 wrote a review May 2017,50,Great Riad!,Riad Melhoun was a dream! The riad itself was beautiful clean and quiet.  The staff were very attentive and caring great breakfast in the AM cleaned room every day.  Mohammed and Nour were great managers making sure we had everything we needed and even explaining the map of the medina/marrakech. They went above and beyond our needs.  I would definitely stay at this Riad again it is very close to Bahia palace and an easy walk to the Jemaa El Fnaa. From the terrace of the riad you can see the Koutoubia mosque minaret and then the mountains on the other side.  The only thing I would caution is when you first arrive the taxi will drop you off at the Bahia Palace parking lot make sure you contact the riad to send you someone (and get their name) to escort you to the Riad; otherwise locals who pose as people from the hotel will escort you and then demand money.    I would not hesitate booking this riad trustworthy staff and wonderful atmosphere! (Oh and the wifi signal is excellent!),Date of stay: May 2017,Trip type: Traveled with family,"Atlanta, Georgia",https://www.tripadvisor.com/Profile/mahfa386
Riad Melhoun & Spa,Obaid A wrote a review May 2017,40,Professional and Helpful Staff,Stayed here for 3 days. The staff are great. The accomodation is neat and clean. Very convenient to the Jemaa El Fna and most of the local attractions. Very good breakfast. Overall if you decide to stay at Riad this one would be a good choice,Date of stay: May 2017,Trip type: Traveled solo,"San Ramon, California",https://www.tripadvisor.com/Profile/obaida674
Riad Melhoun & Spa,olga_remes wrote a review Apr 2017,50,The place that makes you feel at home,A huge thank you to the whole team at the Riad Melhoun. Mohamed Nour Ahmed and others that stayed behind the scene who have made our stay at this beautiful place unforgettable. We are very grateful for everything. You are fantastic! We recommend this Riad for many reasons: very well situated in the MÃ©dina unbeatable cleanliness tastefully decorated and the most important is the team who is very professional and kind. Bravo!    Matthieu and Olga,Date of stay: April 2017,Trip type: Traveled as a couple,"Nice, France",https://www.tripadvisor.com/Profile/olga_remes
Riad Melhoun & Spa,Fatnassi A wrote a review Apr 2017,50,Wonderful stay,strategic location : very close to best area to visit in Marrakech : Badia and Bahia palces  near very good restaurant and amazing Morrocain bath : ziani  And the best thing in our stay was the staff of the Riad : Mohammed Noureddine Ahmad  Faouzia and Khadija  they were very professional and friendly  they served us in the best manner,Date of stay: April 2017,Trip type: Traveled as a couple,,https://www.tripadvisor.com/Profile/fatnassia2017
Riad Melhoun & Spa,Nicole M wrote a review Mar 2017,50,amazing place and excellent service!,this riad is really a lovely charming place you should choose for your stay in Marrakech. Nour and his team offer an excellent service we really enjoyed our stay.  the riad is located in the centre of the city and it is a ideal place to start your walk through the Medina.,Date of stay: March 2017,Trip type: Traveled with friends,"KÃ¼snacht, Switzerland",https://www.tripadvisor.com/Profile/nicolem197
Riad Melhoun & Spa,Trine B wrote a review Mar 2017,50,Absolutely fantastic stay,I really really enjoyed my stay here. The staff is very attentive - and you get the feeling that they truly care about your well-being.    The Riad is well located and easy to find.    You'll get a lot to eat for breakfast. It is exotic and very different from Continentel breakfast.    I had a massage at the Riad and it was a lot better than the one I got in town and it cost the same.    I highly recommend this place.,Date of stay: March 2017,Trip type: Traveled with friends,"Copenhagen, Denmark",https://www.tripadvisor.com/Profile/TrineB832
Riad Melhoun & Spa,Joey M wrote a review Feb 2017,50,Great Support for Our Adventure,Riad Melhoun and especially Mohammed and Nor our hosts really made our stay delightful. We were picked up from the airport and brought to the hotel. Mohammed sat down over tea and explained the small yet elegant riad to us and next day Nor explained the best way to explore the city. The riad was a great retreat from the hussle of the city and was very relaxed. The breakfast was a delicious array of local dishes that really got our days off to good starts. Highly recommend this riad and really hope to bring more of our family here! Great for first timers in Marrakech,Date of stay: February 2017,Trip type: Traveled as a couple,,https://www.tripadvisor.com/Profile/952joeym
Riad Melhoun & Spa,km5050 wrote a review Feb 2017,50,"God value, Clean, Breakfast, Wifi",Location is perfect Walking distance to all must see in Marrakech. Very friendly service.  Good breakfast. Clean. Wi-Fi. You get all help from the personal you need to find what you want to see in Marrakech.,Date of stay: February 2017,Trip type: Traveled as a couple,"Stockholm, Sweden",https://www.tripadvisor.com/Profile/km5050
Riad Melhoun & Spa,dia z wrote a review Feb 2017,50,The BEST of the best,I stayed here for a total of 3 nights It is a very short walk from the main square Jamaa El Fna which means that it is easy to get every where from here. The staff were very welcoming and gave me a map pointing out the main attractions.The rooms are individually decorated and are so different from the homogenous rooms you'd find in a hotel chain. And the Hotel Manager Mohammed was the highlight of our trip his kind soul will be forever part of our memories.    Will defiantly be staying there again. All-in-all a fab stay with kind people and the heart of Morocco enstilled in the essence of the riad.,Date of stay: February 2017,Trip type: Traveled with friends,"London, United Kingdom",https://www.tripadvisor.com/Profile/diwaz2015
Riad Melhoun & Spa,Nomad664372 wrote a review Feb 2017,50,Wonderful three days.,We have just returned from a 3 night stay at this wonderful Riad. Mohammed & Nour we can't thank you enough. Nothing was too much trouble and you both made us feel so welcome.    If you're looking for a well managed clean and welcome stay whilst visiting marakesh look no further. You've just found it. Excellent location. Genuinely friendly staff and wonderful decor and all round service. The spa was a huge bonus and so glad we booked on our last night.    We will use the Riad everytime we return to Marakesh on business. It really was that good.    Mohammed Nour it was wonderful to meet you and thank you so much again for everything and making us feel so welcome.    We shall see you both soon.    Ian & Camilla.,Date of stay: February 2017,Trip type: Traveled on business,,https://www.tripadvisor.com/Profile/Nomad664372
Riad Melhoun & Spa,427amirulh wrote a review Feb 2017,50,Warm welcome in a beautiful Moroccan interior,Riad Melhoun was a great welcome to Morocco and Marrakech. Wouldn't have exchanged it for another place in the Medina.    Airport transfer: We were welcome at the Menara Airport by a transfer service which was seamless and convenient.    Arrival: Upon arrival we were welcome by Nouruddin with a pot of Moroccan mint tea. And he made us feel at home at once explaining a little background of Morocco as a country before showing us to our room.    Ambiance: I love the courtyard beautiful and yet feels very private. True Moroccan style.    Warmth: The staffers from Nouruddin Mohamed and Ahmed they were all very nice and helpful and speak good English. Made us instantly feel at home. Wish we could spend more nights at Melhoun to get to know Marrakech.    All in all a good experience and I would not hesitate to stay here again.,Date of stay: January 2017,Trip type: Traveled with friends,Bangkok,https://www.tripadvisor.com/Profile/427amirulh
Riad Melhoun & Spa,mhaines94108 wrote a review Feb 2017,20,Enjoyable stay but overcharged by 11% on checkout,Overcharged me by 11%. They calculated the bill in Euros then converted to Dirhams using an inflated exchange rate (10.96 instead of 10.33) then added a 5% surcharge for paying by credit card.    The staff was very attentive but we were also very disappointed by our room which had been described as being a suite and having various amenities that simply weren't there.,Date of stay: December 2016,Trip type: Traveled as a couple,Cluj-Napoca,https://www.tripadvisor.com/Profile/mhaines94108
Riad Melhoun & Spa,Mutima17 wrote a review Jan 2017,50,Veux-tu m'Ã©pouser - oui oui ;),Beautiful hotel lovely room excellent personal service (Mohamed is awesome...he attended to our every need nothing was too difficult for him!) and in a good location â€“ easy access to a lot of the tourist sites.,Date of stay: January 2017,Trip type: Traveled as a couple,"London, United Kingdom",https://www.tripadvisor.com/Profile/Mutima17
Riad Melhoun & Spa,Marcia R wrote a review Jan 2017,50,Excellent stay for 11 days,Our stay was just amazing! Mohammed and his team treated us fantastic. Food was really good especially the friday evenings are much fun. Its a special day for muslims and they organise typical marrocan music and the couscous was delicious. We had a long stay and everything was great. There is nothing we can think of that wasn't good. It's worth staying here since your very close to everything and if you want to book any trips further away Mohammed is super helpful and arranges everything for you.  Thanks so much for having us and we hope so see you all very soon. Stay safe!,Date of stay: January 2017,,,https://www.tripadvisor.com/Profile/marciar565
Riad Melhoun & Spa,LJIBrown wrote a review Jan 2017,50,Like being at home,I travelled with my husband 3 year old and my mum for a week. I read through a few of the reviews and would agree with comments that the approach of the Riad is not modern western approach i.e. not all bookable by a tick box on the internet. It is more one to one email Mohammed and he will do all he can to help. He arranged a transfer from the airport and they were there.    The actual Riad is in the Jewish quarter and you can walk everywhere. We got a guide through Mohammed for the first day which is highly recommended to get your bearings. Mohammed also had tips for the souk shopping etc.    The Riad has eight bedrooms (roof terrace and small plunge pool) and Mohammed and Noor (and the rest of the team) cannot do enough for you. My son slipped in the bathroom (my fault) but next day there were more floor mats. The bedroom Gaya has a small single bed which was fine for my son. I was offered a travel cot as well. My son wanted some fruit which I asked for assuming they would have it but when they didn't Mohammed popped out to buy it.    The food is really good for breakfast pancakes bread jam etc. Dinner is also good and varied like home cooking and Friday is a good night with music. A lot of the guests went out but you don't have to.    We also had a hamman and massage which was about two hours for 50euro each. The hamman is in the Riad.    All in all it was a great experience like being at home but with great service. Mohammed never stops moving but everything is always done. I don't often write reviews and I don't want to appear gushing but the review is genuinely deserved and such service is rarely found nowadays.,Date of stay: December 2016,Trip type: Traveled with family,"Milford, United Kingdom",https://www.tripadvisor.com/Profile/LJIBrown
Riad Melhoun & Spa,jbl2017 wrote a review Jan 2017,50,Wonderfull riad with exceptional personal service!,I spent 5 days / 4 nights at Riad Melhoun and it was an extraordinary experience. Mohamed the manager had arranged for someone to pick me up at the airport and take me all the way to the riad which made for an easy arrival in unfamiliar territory. The riad is such a pleasant place! Great architecture design and interior nice and calm. The roof top terrasse is spacious with chairs/tables sunbeds and lounge areas. The common area on the ground floor has relaxing alcoves and a soothing atmosphere. The pictures tell the story - just have a look... But as all the other reviews confirm the real gem of Riad Melhoun is Mohamed Nour Ahmed Naima and the other staff members. I have travelled quite a bit throughout the world but I have never encountered such exceptional and personal service! Mohamed truly enjoys people and strives to ensure you have the best time both when in the riad and in Marrakech. He provided me with very useful advise on where to go what to see where and what to eat - and also what things ought to cost (very useful)! For a first-timer in Marrakech the Medina can be a bit overwhelming but Mohamed's guidance took the edge of that and made my stay so much more enjoyable. And when my stomach on one occasion didn't entirely agree with the cuisine of the souk Mohamed personally went out and got me some easy-to-digest food stuff to remedy the situation. Priceless!  In the morning of the day of my departure (my flight was at 15:00) Mohamed had also arranged for a hammam and massage session in their on-site spa. Pure delight and a great way to relax before the trip home.  I highly recommend a stay at Riad Melhoun. Personally I will return to Marrakech and staying elsewhere is just not an option. Mohamed & all: I'm so looking forward to seeing you again! :),Date of stay: December 2016,Trip type: Traveled solo,"Stavanger, Norway",https://www.tripadvisor.com/Profile/jbl2017
Riad Melhoun & Spa,Paula A wrote a review Dec 2016,50,"Cozy place, amazing hosts, great experience!",My boyfriend and I decided to stay at this riad and it was actually the best of our trip to Marrakech! Mohamed was an amazing host: he welcomed us with Moroccan tea right upon arrival and he made us feel like home throughout our whole stay in the riad. He was so thoughtful kind and gave us some very useful tips about the city of Marrakech.  He also suggested a homemade dinner at the riad on our first evening which we accepted and it was totally worth it. We enjoyed delicious Moroccan food accompanied by some traditional music players that Mohamed organised as a surprise for us! He even danced to the music as well! We had such an amazing time that night.  On our last day we enjoyed hammam and massage in the riad. Very interesting experience too.  Breakfast was also very good and included in our booking. Fresh orange juice three different types of Moroccan pancakes bread coffee fruits...  I have to say that everything in the riad even the smallest details had been taken care of. The atmosphere was very authentic the rooms were spotless the bathroom was huge...  I highly recommend this riad to everyone looking for a cozy feels-like-home authentic Moroccan place to spend their holidays.,Date of stay: December 2016,Trip type: Traveled as a couple,"Paris, France",https://www.tripadvisor.com/Profile/paulaknt
Riad Melhoun & Spa,Morgan wrote a review Dec 2016,50,Absolutely marvelous!,Everything about Riad Melhoun surpassed our expectations. From the incredible dinner of apricot and beef tagine to the heated bathroom and elegant shower we were beyond impressed! Perhaps the best part however was the sincere and caring staff: Muhammad Ahmed and their team kept us relaxed and anticipated our needs with grace. I can't recommend this place enough!! A must for Marrakech.,Date of stay: December 2016,Trip type: Traveled as a couple,,https://www.tripadvisor.com/Profile/Thekidescaped_again
Riad Melhoun & Spa,Clive L wrote a review Oct 2016,50,An oasis in the red walls,I have read other reviews prior to booking Riad Melhoun and I am very pleased to see they actually took quite a bit of the feedback here to improve so if you read something that may not be too positive I can see they are actually making an effort to do it better.    My 5 day and 4 night stay in Riad Melhoun was a fantastic experience. Like other reviewers might have said it already the location of the Riad is very central but the convenient didn't bring the noise with it so it's perfect for city explorations. Some said the spot seems sketchy I kinda understand because of the sudden remote feeling of that spot but I never felt threaten or insecure walking in and out if it really is it's just like any other part of Marrakech.    Service is superb Mohamed and Nour speaks English well and Ahamed can understand some but the language is only secondary to the warmth they show in their service. They want you to feel well and make sure you are ok and get everything you need when you go out or have breakfast or just being in the riad in general. They check on you a lot and are almost always available for anything. When I dipped myself in the pool they will provide towel I can request tea to be served at certain time in certain place they are always on point.    Rooms are not exactly spacious unless you take the suites but you get what you pay for and I felt completely fine and comfortable staying in the room. A/C works well shower restroom heat lamp all work as they should. Shower gel and shampoo are there they change towels or at least tidy them up. Yes they do go in even if you lock the room but I know they are doing it to make sure you come back to a tidy room with some of the stuff reset to a good shape.    Something remarkable about this place or Moroccan people to say is that they keep their words very well. I requested a desert visit thru them and whatever they have promised to me actually happened. This may sound strange but given the way they do not use a computer system or without any paperwork to mark anything not even my name I don't actually know how some of the verbal ideas materialized. BUT THEY DID! So both my wife and I were impressed.    As for the beauty of the riad I think the photos you see are all very realistic representation of the place. Nothing to hid or anything. Keep it that way. I love the pool. I still miss it.    The dinner I had on the first night of my visit was wonderful. I love the food so much it gave me and my wife such a memorable experience because we were greeted by the excellent reception on our first night. I recommend you spend at least a night there to have dinner they have surprises for you. The mint tea is also fantastic it soothed my mind so much just to taste that.    Suggestions for improvement:  1. Actively provide details of the info for guest online/email instead of just responding to questions when asked. This is because we may not know why some info are not communicated and people may feel insecure or the trust level may drop. After all a trip to Morocco can be quite wild in some the travelers' minds. We want to know as much as possible basically your whole menu book!    2. Trip communication can do better. Like I mentioned about I had no security whatsoever before the trip and I basically just let it flow and go with it. I didn't know the price I paid will give me what I was told. Even though in the end they did happen I'd think as travelers we want more guarantee than that.    Overall thank you for being great. I recommend this place for sure.,Date of stay: September 2016,Trip type: Traveled as a couple,,https://www.tripadvisor.com/Profile/456clivel
Riad Melhoun & Spa,SinclairDC wrote a review Oct 2016,50,A beautiful quiet Oasis from the hustle and bustle,A beautiful interior comfortable beds and a great rooftop patio. Mohammad and Achmed really took care of us. They ensured our stay was great and we had everything we needed. They scheduled a massage and pedicure the day we arrived arranged a trip to ride a camel arranged transfers to and from the airport and gave us tips on the area. We would definitely go back. Also very family friendly.,Date of stay: October 2016,Trip type: Traveled with family,"Washington DC, District of Columbia",https://www.tripadvisor.com/Profile/SinclairDC
Riad Melhoun & Spa,mariapiq wrote a review Oct 2016,50,The staff made this riad amazing,Beautiful riad and amazing rooftop. The location is great -- right in the medina about a block away from the beautiful Bahia Palace but far away enough from the main square and the souks to not be too crazy. The breakfast was delicious especially that homemade yogurt -- I still think about it! We had dinner one night and it was also pretty amazing.    But really the highlight of our stay was the wonderful staff. Mohamed was the friendliest person I've ever met at a hotel and all of his tips on how to get around Marrakech how to avoid being scammed what to expect to pay for taxis etc. were so helpful. We were the only people in the riad at the time so he upgraded our room and on our last day let us do a late late checkout (3 pm!) free of charge. I've never encountered this level of hospitality. Truly a wonderful experience.,Date of stay: September 2016,Trip type: Traveled as a couple,"New York City, New York",https://www.tripadvisor.com/Profile/mariapiq
Riad Melhoun & Spa,KiwiinNorway wrote a review Oct 2016,50,Beautiful riad and wonderful service,Right from the time of booking we were extremely well looked after by Riad Melhoun & Spa â€“ it seemed that nothing was too much trouble for Mohamed and all the staff. As soon as we arrived we felt very welcome we were offered mint tea and an introduction to Marrakech and Moroccan culture. We were given maps told about many attractions and activities to visit and were given helpful tips about bargaining in the souks and acclimatising to local food before trying the street stalls. It was clear that making sure guests had the best possible experience of Marrakech was a high priority.  The riad is in a great location â€“ short walking distance to the main square and souks as well as many other attractions. I do recommend organising arrival transport from the airport through the riad though as itâ€™s not so easy to find your way around at first.  Inside the riad is peaceful and calm you would never know that the busy medina is just outside. We stayed in Amessan room (suite) which was clean really spacious and beautifully decorated. This room is located on the ground floor beside the pool.  Food at the riad was also amazing â€“ breakfast was included and changed a little each day I really enjoyed trying all the different types of Moroccan crepes. We also had dinner at the riad on the Friday evening which was delicious and a there was lot of food!  The riad also has a hammam which we booked for just before our flight out this was a nice relaxing end to our stay.  Overall the riad itself is very beautiful but it is really the wonderful service and personal touch which makes for a great experience. We would definitely visit again if weâ€™re lucky enough to return to Marrakech!,Date of stay: September 2016,Trip type: Traveled as a couple,"Oslo, Norway",https://www.tripadvisor.com/Profile/KiwiinNorway
Riad Melhoun & Spa,ha1210 wrote a review Oct 2016,50,Beautiful Riad - Highlight of our trip,We absolutely loved our stay at Riad Melhoun. The Riad itself is beautiful - the intricate wood work the doors the ceilings - simply stunning. The staff at the Riad made the trip such a wonderful experience for us. Mohammed and Nourudin were extremely welcoming kind and made us feel like we were at home. We spend 3 nights at the Riad and on our first day Nourudin gave us a breakdown of the Medina and highlighted some spots for us to visit.    The location of the Riad is terrific as everything is within walking distance.    The breakfast provided was also delicious and there is a great variety.    I would highly recommend Riad Melhoun to anyone and would def. stay there again!,Date of stay: October 2016,Trip type: Traveled as a couple,"Toronto, Canada",https://www.tripadvisor.com/Profile/ha1210
Riad Melhoun & Spa,Sarah C wrote a review Oct 2016,50,A sanctuary of calm,We booked this riad just the day before as a last minute holiday and were delighted when we got there. Riad Melhoun is an oasis of calm cleanliness and hospitality hidden just off one of Marrakech medina's bustling noisy and dusty streets. Mohammed Nour and the team will welcome you with open arms (and fresh mint tea) and the entire riad is just a perfect sanctuary. It's a really great location too - not far from the main square and souks and the top floor balcony means you can enjoy the sunshine from a number of lounge seats.    This hotel is particularly good for couples - quiet romantic and perfectly placed for exploring more of Marrakech. And make sure you book dinner under the stars for at least one night you're there....as well as a traditional hamman for a true Moroccan spa experience. Heavenly!,Date of stay: September 2016,Trip type: Traveled as a couple,,https://www.tripadvisor.com/Profile/sarahcE3496VT
