Hotel_Name,Review_Date,Review_Rating,Review_Title,Review_Text,Reviewer_Date_Of_Stay,Reviewer_Trip_Type,Reviewer_Location,Reviewer_Profile_Link
Riad Melhoun & Spa,Gabrielle R wrote a review Jan 2020,50,Gorgeous oasis of calm,From the moment we were met at the door of Riad Melhoun we felt genuinely welcomed - such a lovely retreat from the madness of the Medina! The riad is beautiful - lovely intricate carvings with quiet nooks and crannies everywhere plus a magic roof-top retreat. Our room - Maya - was on the 2nd floor - spacious really comfortable bed & pillows - and we couldnâ€™t believe how quiet (& dark!) the room was - couldnâ€™t even hear the calls to prayer. We had 2 dinners here - great meals - each dish explained & fantastic service. When I mentioned that I loved the olives in one of the salads they bought another bowl of them! Direction wise we found it easy to find our way home after each day of wandering as itâ€™s quite a direct walking route from the Jamaa fna square - after youâ€™ve done it once! Also thoroughly recommend the spa & hammam- more like a western spa experience than a traditional hammam but with a little more nudity :)! We would come back to stay in a heart-beat!,Date of stay: January 2020,,"Adelaide, Australia",https://www.tripadvisor.com/Profile/worldstar99
Riad Melhoun & Spa,Jon B wrote a review Jan 2020,50,Service!!,Firstly the property is just as beautiful as the pictures. The staff however really made the experience. Always willing to make our every request their personal quest. They also each greeted us warmly every time they encountered us. In particular Mohamed went out of his way to deliver. The whole staff was top notch!,Date of stay: December 2019,Trip type: Traveled as a couple,"Detroit, Michigan",https://www.tripadvisor.com/Profile/jonpbeasley
Riad Melhoun & Spa,Alejandra wrote a review Jan 2020,50,Amazing,I was eight days in Morocco and this is the best hotel I stayed in. The food is very good so is the location the staff is very friendly the room is beautiful and clean the place in general is beautiful. The best value for money you will find,Date of stay: January 2020,Trip type: Traveled solo,,https://www.tripadvisor.com/Profile/donnabreu1
Riad Melhoun & Spa,809anujav wrote a review Jan 2020,40,Great location & hospitality,We are a family of 4 adults stayed for 3 nights at the Riad Melhoun in December 2019.    Positives:  1. Superb location if you want to stay within the walled city it is close by to the main square with all the souvenir shops and souks a short 5min walk away.    2. Service is excellent and the staff is super helpful and will take extra efforts to fulfill every need. Special mention to Mohammad and Ahmed for all their help during our stay. We really appreciated when they arranged for some special items for breakfast at our request.    3. The dinner at the Riad is a must have experience with beautiful table decor soothing Morrocan music in the background and traditional cuisine. The food was freshly prepared and extremely flavorful and our two dinners there was one of the highlights of our stay in Marrakesh.    4. The rooms are very clean and housekeeping standards are high. Bed and bath linen was spotless.    5. The terrace is very beautiful and has a lovely sitting to enjoy the sun/evenings.    Things to keep in mind:    1. We were quite surprised by the size and layout of the rooms as we were expecting them to be larger. We had one suite and one deluxe room which were located at the terrace. As a family of 4 adults on a 2week trip across the region we had big suitcases and there was no space to open them especially in the deluxe room. We ended up keeping all our bags in the suite itself.    2. The deluxe room: The size of the room is extremely small. The bed can be a little cramped for two adults and is more suited for a solo traveler. The transparent glass door to the bathroom makes it a little tougher if you are staying with someone.    3. The suite: While the size is larger than the deluxe room the lighting is extremely dim so that even in the day we had to keep the door open to let some sunlight in. Also the bathroom of the suite is not very convenient to use. There is a bathtub only and no separate shower area and one needs to be extremely careful while getting in and out of the tub. Additionally since there is no partition or curtain to the tub the water sloshes out and result in a slippery floor. There are no hooks/towel racks etc in the bathroom for hanging towels/clothes etc.    4. A shout out to travellers who might not be comfortable with stairs most of the rooms are in the upper floors which would involve climbing stairs which are slightly thick and uneven.    Overall would recommend for it's great location and superb service & food. However would be good to keep in mind the layout of the rooms and size especially if travelling in a group/with family.,Date of stay: December 2019,Trip type: Traveled with family,"New Delhi, India",https://www.tripadvisor.com/Profile/809anujav
Riad Melhoun & Spa,Alaw58 wrote a review Dec 2019,50,"Beautiful Riad Close to Center, Excellent Hospitality",Riad Melhoun is BEAUTIFUL perfect for every kind of traveler. The moment we arrived we were greeted by Ahmed who carried our luggage and walked us directly to Riad Melhoun. Everything was perfect we were offered a tour of the courtyard rooftop terrace and the hammam and spa. They offered us dinner for 20 euro per person at our convenience so we took advantage at 9:30pm! Ahmed even went the extra mile and found Casablanca beer for us! Our room was clean the water was hot (which was perfect since we had just come from 3 days in the desert) and we were able to sleep immediately since the surroundings of the Riad was so quiet! The WiFi was also the best out of all our stays in Morocco. The breakfast and dinner was amazing!! And again thank you to the staff (Nour Ahmed Tarek and Issam)!,Date of stay: December 2019,Trip type: Traveled with friends,"Los Angeles, California",https://www.tripadvisor.com/Profile/Alaw58
Riad Melhoun & Spa,S Lawlor wrote a review Dec 2019,50,Outstanding hotel,Outstanding hotel. It was our first time in Marrakech and wow what an experience. The hotel was lovely and clean. The staff were exceptional. From the moment we walked in right up to our last day. All staff treated us with respect and exceeded our expectations. Mohammad and Nour at the front desk were brilliant at explaining places to go and visit as well as tips when walking around in Marrakech. Ahmed and Tarik served some amazing authentic food. Ensuring that our dietery needs were met. Also we had a day in the spa with a hammam and massage. Which were so amazing. Would definitely return to this delightful hotel. Thank you all for making our first experience in Morocco a fantastic one.,Date of stay: December 2019,Trip type: Traveled with family,,https://www.tripadvisor.com/Profile/Shugs72
Riad Melhoun & Spa,Robert B wrote a review Dec 2019,50,Christmas,We stayed here as a family of 4 on Christmas Day. Wonderful Hammam and massage. Great location and staff. We had the room on the rooftop terrace which was great (but a bit small). We recommend this place.,Date of stay: December 2019,Trip type: Traveled with family,"Englefield Green, United Kingdom",https://www.tripadvisor.com/Profile/robertbP6808SN
Riad Melhoun & Spa,sylvie m wrote a review Dec 2019,50,A home away from home,My stay here at Melhoun Spa has been an unforgettable experience. Very friendly and professional staff. They have all been exceptionally warm helpful and welcoming. Breakfast was great they helped me out with activities inside and outside of town recommended spots for sightseeing etc-I was never bored and felt like at home from day one! The room was warm and cozy too! :)  will definitely come back.,Date of stay: December 2019,Trip type: Traveled solo,"Santa Catalina, Panama",https://www.tripadvisor.com/Profile/sylviem2361
Riad Melhoun & Spa,Ankit A wrote a review Dec 2019,50,Amazing Stay,I traveled with to Marrakech with 3 friends in December 2019. We had an amazing stay at Riad Melhoun. The location is great - right next to some of the palaces and about a 10 minute walk to the center square of the medina (Jemaa el-Fnaa).    What really stood out was the staff and how awesome they were! Tariq was helpful throughout the stay and took us out to the cab area called the cab when it didn't show up on time and was just a friendly presence (at 4 AM when were heading to the airport!). The other folks (ah! Can't remember the names) - were also very helpful recommending restaurants telling us where to go making reservations etc! They were very proactive and I felt it significantly enhanced the experience in the city.    The property itself is beautiful! It was nice to stay in a traditional Riad. The one downside is that the rooms (although beautifully decorated and comfortable) are relatively small compared to what you would expect at a typical 4-5 star hotel (think a room in a nice Hyatt/Marriott).    We did do the dinner 1 night at 20 euros/person and I highly recommend that. The apple pie type dessert was delicious!    We did the hammam elsewhere (at Heritage Spa) just to try something else outside of the Riad. While it was great there in retrospect we probably would have done the in house hammam (comparable price and I'm sure it would have been a comparable experience but much more convenient to be able to go your room right after).    Overall 5/5 - was our best accommodation in Morocco and would recommend highly to anyone coming for a visit!,Date of stay: December 2019,,"Chapel Hill, North Carolina",https://www.tripadvisor.com/Profile/580ankita
Riad Melhoun & Spa,Alfonso Tomas wrote a review Dec 2019,50,Going the extra mile,Unfortunately we only stayed in this lovely Riad overnight but the place is beautiful and they serve a simple but yummy breakfast. I am most impressed by their friendly and accommodating staff. Everyone from the front desk to the kitchen staff and cleaning personnel seemed to make an effort to make our stay a pleasant one. A great choice.,Date of stay: November 2019,,,https://www.tripadvisor.com/Profile/alfonsotomas
Riad Melhoun & Spa,Federica A wrote a review Dec 2019,50,More than only a Riad,This place is just more than a Riad: it felt like home.  People are so nice and helpful and they do everything to make you feel comfortable.    The position is really good really close to the Bahia Palace and 10 mins walking from the main square.    The place is beautiful a typical riad. Room are very clean and breakfast is great!,Date of stay: November 2019,,"Paris, France",https://www.tripadvisor.com/Profile/federicaaJ7783CU
Riad Melhoun & Spa,VlaÄka D wrote a review Dec 2019,50,Oasis of peace in Marrakesh,We have spend 3 days in Marrakesh and choose this hotel because of good reviews.    Staff were super pleasent and helpfull.    I definitely recommend to get traditional  hamam and dinner here.    Hotel is clean and is located in city center.    You dont get wrong to choose this riad.,Date of stay: December 2019,Trip type: Traveled with friends,"Prague, Czech Republic",https://www.tripadvisor.com/Profile/vla_kad
Riad Melhoun & Spa,Tereza G wrote a review Dec 2019,50,Oasis of peace of Marrakech,We stayed for four days and it was stunning in every way. The staff are impossibly friendly and helpful and brought sunshine into every interaction. Cosy compelling rooms generous breakfasts amazing hamam and a glorious terrace.  We can reccomend for 100 %! Thank you.,Date of stay: December 2019,Trip type: Traveled with friends,,https://www.tripadvisor.com/Profile/terezag628
Riad Melhoun & Spa,Hakimi wrote a review Dec 2019,50,A gem in the medina,Beautiful riad very close to main attractions all within walking distance- Bahia Palace 120m Jemaa el Fna 720m Katoubia Mosque shops selling Moroccan souvenirs and lots of restaurants. Has own spa and hammam. The room is clean and quite spacious ( compared to some other riads we have been to). Very friendly reception who are willing to give you useful tips about how to avoid other hagglers in the Jemaa el Fna. I highly recommend this beuautiful riad,Date of stay: December 2019,Trip type: Traveled with family,Clayton,https://www.tripadvisor.com/Profile/433nurh
Riad Melhoun & Spa,Sufi A wrote a review Dec 2019,50,The Best Ever,Great location great breakfast and ultimately the best customer service that makes this holiday the one of the most most enjoyable and unforgettable we had. Will definitely stay with Riad Melhoun again if we ever come back.,Date of stay: November 2019,Trip type: Traveled with family,,https://www.tripadvisor.com/Profile/sufia2018
Riad Melhoun & Spa,Zen wrote a review Dec 2019,50,A Gem In Bustling Marrakech Medina,Absolutely beautiful riad! The courtyard with the pool is gorgeous. The rooms were amazingly furnished and styled but most importantly they were also a comfortable size compared to other riads in Marrakech. The location is also very central. It is near attractions like the Bahia Palace Dar Si Said Museum and around 12 minutes walk to the Jemaa el-fna square. But what really blew us away was the genuine hospitality of the staff. Everybody from the reception to the serving staff were helpful and friendly. Simple things like requesting for extra eggs for breakfast was attended to very quickly. Unfortunately we stayed at Riad Melhoun for just a night since we were there during the last leg of our trip. I attempted to add a day to our stay but the riad was really fully booked. So if you want to experience this riad my only advice is to plan your trip and book this riad early!,Date of stay: November 2019,,"Quezon City, Philippines",https://www.tripadvisor.com/Profile/zenhernandez
Riad Melhoun & Spa,jofong440 wrote a review Dec 2019,50,A trye authentic gem in the Medina,I was cautious about my expectations of hotels in Marrakesh. This Riad is not only beautiful but has the very best staff. Friendly knowledgable and detail oriented Ahmed and Isaah provided consistently cheery help. I loved it here. I highly recommend the Riad which is also priced for value.,Date of stay: November 2019,,"New York City, New York",https://www.tripadvisor.com/Profile/jofong440
Riad Melhoun & Spa,GMN wrote a review Dec 2019,50,Riad in the Medinna,"I traveled here with my husband and 18 y/o daughter. Riad was very helpful - staff were friendly and I felt comfortable. I would rec'd going here if you want an ""authentic"" experience. This is definitely not a ""western"" hotel so if you're looking for a TV telephone and alcohol don't come here. If you're looking for a fabulous massage (I suggest the hamman + massage combo) and typical Moroccan food I would come here. You're in the Medina - and once ""inside"" it's quiet and clean. Good location to the market square (10 min walk) so you're close to the action but far enough away that it's quiet at midnight! I can't say enough about the friendliness of the staff - they take hospitality seriously.",Date of stay: November 2019,,,https://www.tripadvisor.com/Profile/mcgaughe
Riad Melhoun & Spa,Madison Kennedy wrote a review Nov 2019,50,Excellent,Such a beautiful Riad ! We loved our stay here the food is absolutely delicious and they prepared gluten free options for me. The massages are so relaxing ! The atmosphere smells of jasmine flowers... We will be back for sure :) Thank you,Date of stay: November 2019,Trip type: Traveled as a couple,,https://www.tripadvisor.com/Profile/iconamerica
Riad Melhoun & Spa,LuÃ­sa P wrote a review Nov 2019,50,The best riad ever!!,We had an amazing experience in Marrakech. The staff is very helpful and kind specially Ahmed and Mohamed. They gave us a lot of tips about Marrakech.  We can't forget the smell and the breakfast of the Riad. The room is very quiet spacious and clean. And...we couldn't forget the pool...what an amanzing ambience in the cute Riad.  The riad is very well located near to the center but in a quiet place!  We would like to stay here again!  All the best to the staff! We were treat like kings :),Date of stay: November 2019,,,https://www.tripadvisor.com/Profile/lulu_margarida
Riad Melhoun & Spa,Miguel Baptista Alves wrote a review Nov 2019,50,Amazing riad with super friendly staff.,Great location very close to the main square but in a quiet place. Very good rooftop and super friendly staff. Nice breakfast with homemade food amazing tea and hammam. For sure worth trying. Would go back right away :),Date of stay: November 2019,Trip type: Traveled with friends,,https://www.tripadvisor.com/Profile/MiguelBaptistaAlves
Riad Melhoun & Spa,Jennifer S wrote a review Nov 2019,50,Riad Melhoun & Spa is a Special Place!,From the moment I arrived I was treated like a queen. Mint tea served upon arrival & the staff was always smiling & happy so friendly. Everyone was so nice & just wanted you to feel at home. The decor the food it was clean they helped me plan excursions which were amazing & nothing I asked was too much. I would stay here again. Peaceful safe and relaxing a real authentic Moroccan experience. Thank you everyone I appreciate all of your generous hospitality. I'm going to miss it here. Jen.S. from Toronto Canada,Date of stay: November 2019,Trip type: Traveled solo,,https://www.tripadvisor.com/Profile/Northtorontoliving
Riad Melhoun & Spa,PJ Wright wrote a review Nov 2019,50,My home in Marrakech,We visited Marrakech from Jamaica and it was amazing to feel the warm love of Morocco at Riad Melhoun the staff was first class and the rooms amazing. Breakfast was great for the 4 days we stayed and itâ€™s footsteps away from everything. Will recommend to all.,Date of stay: November 2019,Trip type: Traveled with friends,"Kingston, Jamaica",https://www.tripadvisor.com/Profile/pjwrightimage
Riad Melhoun & Spa,Naia wrote a review Nov 2019,50,Relaxing and beatiful Riad,I stayed in this Riad with two friends for a long 3-day weekend. Riad Melhoune is just the perfect place to stay when visiting this beautiful city.  The rooms are tastefully decorated with confortable beds. The patio area with the small pond in the middle is amazing...the terraze the inside balconies...all decorated with style.  The staff very polite and always looking after us to make our stay perfect.  If I ever come back to Marrakech I will repeat for sure ðŸ˜ƒ,Date of stay: November 2019,Trip type: Traveled with friends,"Bilbao, Spain",https://www.tripadvisor.com/Profile/NaiaM1
Riad Melhoun & Spa,Andrewebe wrote a review Nov 2019,50,Wonderful !,I really loved this Riad in the heart of MÃ©dina.  Everything perfect spaces are very clean and the even the food is amazing !  The staff is really kindly and helpfully.  Unfortunately Iâ€™ve just spent two days in Melhoun Riad but I hope to come back soon !!,Date of stay: November 2019,,"Barcelona, Spain",https://www.tripadvisor.com/Profile/andrewebe
Riad Melhoun & Spa,Heidi Y wrote a review Nov 2019,50,Amazing!,Ahmed and Rashid were incredible! Food was delicious they were incredibly helpful and cannot say enough good things about them their service and the Riad itself. HIGHLY recommend anyone to stay there while in Marrakech.,Date of stay: November 2019,Trip type: Traveled with friends,"Grand Rapids, Michigan",https://www.tripadvisor.com/Profile/HeidiY127
Riad Melhoun & Spa,Symba wrote a review Nov 2019,50,Wonderful!,It was our first visit to Marrakech and we were greeted with warmth and hospitality by Mohammed who served us delicious mint tea and made us feel at home instantly! Great location clean lovely rooms and a beautiful setting. Very close to all the souks. We would definitely recommend Riad Melhoun and hope to be back again!,Date of stay: November 2019,Trip type: Traveled as a couple,,https://www.tripadvisor.com/Profile/Symbasails
Riad Melhoun & Spa,Justyna W wrote a review Nov 2019,50,"Amazing stay,",Very friendly and helpful stuff. The Riad is of architectural interest and beautiful. We enjoyed swimming pÃ³Å‚ the roof terrace and the central courtyard space for meals. The location is just perfect a quiet spot within the medina so we felt relaxed. Definitely will be back. Thank you very much,Date of stay: November 2019,Trip type: Traveled with friends,,https://www.tripadvisor.com/Profile/316justynaw
Riad Melhoun & Spa,Alessia F wrote a review Nov 2019,50,AMAZING,Beautiful property great hosts and amazing breakfast!!!  Super friendly and smiley people.. We could really feel home and weâ€™ll definitely come back when weâ€™ll have the possibility!!  Thank you!!!! :),Date of stay: November 2019,Trip type: Traveled with friends,,https://www.tripadvisor.com/Profile/alessiaf739
Riad Melhoun & Spa,niccabalquinto wrote a review Oct 2019,50,Paradise!! Here it is!,I almost canceled this reservation after some issues traveling back from Merzouga- so glad I did not! My stay at the Riad Melhoun was a highlight of my trip in Morocco. Mohamed was extremely helpful in helping me figure how to travel to Marrakech and (after an 11 hour trip) Ahmed couldn't have given me a warmer welcome which included tea as he prepared my room and a tour of the riad.    I loved every aspect of my stay here! The room had rose water among its amenities and the staff decorate our table with rose petals for our dinner!! Also the riad had the fastest Wifi of anywhere I visited while in Morocco.,Date of stay: October 2019,,"New York City, New York",https://www.tripadvisor.com/Profile/niccabalquinto
Riad Melhoun & Spa,Anthony Vazquez wrote a review Oct 2019,50,A Gorgeous Oasis. Amazing Staff.,My partner and I decided to stay at the Riad Melhoun for the later half our trip - after visiting the Sahara near Merzouga. This location was everything we needed for a relaxing two day stay after traveling. As soon as you walk in the door the calming scent of the main space lets you know that you've left the busy city streets behind you. All the furnishings and decorations were beautiful and you can tell the space was designed with details in mind. This was far above any other locations I stayed for my trip and was still an easy quick walk to main city locations.    Most notable of all- the staff are amazing here! We mostly interacted with Ahmed and Mohamed but everyone we came in contact with was extremely accommodating and ready to go the extra mile; from talking to a taxi driver bringing us over from the bus station to providing a scale for us to weight bags for our flight. They really make this place unlike any other place I've stayed.    Also! we had a delightful hammam and massage activity as part of our stay. I would recommend this too. Breakfast and dinner were delicious. They even readily accommodated a last minute change to our plans to have dinner at the hotel. I could go on and on- will definitely recommend to any folks traveling to Marrakech.,Date of stay: October 2019,,,https://www.tripadvisor.com/Profile/Avazque03
Riad Melhoun & Spa,Christian N wrote a review Oct 2019,50,Excellent Riad and Spa,Everything was excellent from check in to check out. Great room and service. Nothing but good things to say about the Riad. Definitely recommend the Spa. 5 stars!!! Great location only a short walk from the center.,Date of stay: October 2019,Trip type: Traveled as a couple,"Oklahoma City, Oklahoma",https://www.tripadvisor.com/Profile/324nilsens
Riad Melhoun & Spa,dendreten wrote a review Oct 2019,50,Excellent,Stayed 3 nights here with 3 kids in 2 rooms. Excellent location (medina center but quiet location) classy interior varied (moroccan) breakfast and a truly excellent genuinly friendly service. Spa (hammam and massage) also recommended.,Date of stay: October 2019,Trip type: Traveled with family,"Grimbergen, Belgium",https://www.tripadvisor.com/Profile/dendreten
Riad Melhoun & Spa,Rollsy87 wrote a review Oct 2019,50,Wonderful Riad Stay,I am not one for writing reviews but I felt I needed to share my experience of Marrakech and our wonderful stay we had at Riad Melhoun. I was a bit nervous after reading reviews about the busy streets but our hosts greeted us and made us feel at home and very relaxed from the off. They were so friendly and attentive and went above and beyond for us. One of the lovely guys from reception even went out to a souk to get me a particular item I was after for a fantastic price.    The hotel is very small and exclusive which we liked. It's in a fantastic location only 5/10 minutes depending on how distracted you get by the souks to the main square. The streets can be a maze but this location was easy to find for us and felt very safe and quiet from the busy streets.    The hotel staff Nour Ahamed and Mohamed to name a few were always around to help us and gave us some great tips and advice to prepare us for the shopping experience.  Breakfast was a highlight for me and the food just kept coming. We had everything we needed from tea coffee pancakes crepes omlettes and muffins with all the jams and honey. Mint tea was on tap and also brought to us when requested throughout the day/evening and it was included with our stay.  Enjoying it on the beautiful roof terrace was a highlight.    We ate one meal in the Riad and if I known I would have definitely eaten more. It was very reasonable priced and was cooked to perfection the traditional Morrocan way.    The building itself has some great history and is beautifully furnished. It makes for some gorgeous pictures.    The staff are also fantastic camera men and spend the time if you ask to get the perfect shot. Literally nothing is too much trouble and everything is done with a smile.    I would without a doubt recommend this Riad to friends and family and would love to come back hoping to see the fantastic staff that served us so well and made us feel like friends.,Date of stay: October 2019,Trip type: Traveled as a couple,,https://www.tripadvisor.com/Profile/rollsy87
