Hotel_Name,Review_Date,Review_Rating,Review_Title,Review_Text,Reviewer_Date_Of_Stay,Reviewer_Trip_Type,Reviewer_Location,Reviewer_Profile_Link
Riad Melhoun & Spa,TravelGuru530 wrote a review Mar 2019,50,Wonderful Riad!,We stayed here just one night while in Marrakech but we wish we could have stayed longer! The rooms were clean and nice and the staff was very helpful in making our trip easy and enjoyable. The included breakfast was very good. They also have a beautiful terrace where you can sunbathe or have your breakfast or dinner when it is warm outside. They also have many wonderful options for massages spa treatments and others. We will definitely stay here again when we come back to Marrakech!,Date of stay: March 2019,Trip type: Traveled with friends,,https://www.tripadvisor.com/Profile/TravelGuru530
Riad Melhoun & Spa,chrislatt wrote a review Mar 2019,50,Superfriendly Staff Excellent location Top Service,Very nice warm welcome at the Arrival we really enjoy hospitality & Service beautifull Riad/Hotel clean rooms the staff assisted us with our Programme. They even found my lost wedding ring! Highly recommend!!!,Date of stay: March 2019,Trip type: Traveled as a couple,"Vienna, Austria",https://www.tripadvisor.com/Profile/chrislatt
Riad Melhoun & Spa,Olivia W wrote a review Mar 2019,50,Faultless!,We stayed for one night at Riad Melhoun and Spa for the last day of our trip. It was the perfect place to stay to get some needed R&R after a busy week in Morocco. The location was great the room was beautiful and the staff treated us like royalty. We also booked the couple's hammam and massage which we highly recommend. Faultless stay!,Date of stay: February 2019,Trip type: Traveled as a couple,"St. Albans, United Kingdom",https://www.tripadvisor.com/Profile/oliviaw711
Riad Melhoun & Spa,Laura A wrote a review Feb 2019,50,small and historic paradise,We were lucky of founding this beautiful place. We really got the historical feeling by picking typical riad. Just a few rooms make place even more cozy. Every room has different design and it is nice to pick room what you like the most. People working at hotel are super friendly taking care of every detail and every customer here. This place make us feel specially welcomed. Atmosohere with the dinner at the riad pool in the evening or breakfast which you can chose also at the rooftop terrace made our vacation special.,Date of stay: February 2019,Trip type: Traveled as a couple,"Hamburg, Germany",https://www.tripadvisor.com/Profile/lauraaspazija
Riad Melhoun & Spa,melancholy wrote a review Feb 2019,50,Beautiful riad with first class staff,I stayed here with my husband and daughter for 5 nights. We had an amazing trip. The hotel was beautiful and the staff as so many other reviews say were extremely accommodating while also being discreet. They booked trips the hammam and restaurants for us. When we had a problem with our airline they helped us sort it out.  For what we paid we thought it was great value. The main sights are generally within walking distance once you get used to the geography - we even walked back from the Majorelle Gardens but it was February so not too hot.,Date of stay: February 2019,Trip type: Traveled with family,"Fowey, United Kingdom",https://www.tripadvisor.com/Profile/melancholy
Riad Melhoun & Spa,Wendy B. wrote a review Feb 2019,50,Great!!,We had a great stay in Riad Melhoun all the staff is so kind you can ask them anything! We booked the Gaya Suite typical Moroccan room everything was perfect. Good food in the restaurant. We also booked the hamam and massage very relaxing. We really recommend this riad to everyone and hope to come back some time. Thanks Nour and team:),Date of stay: February 2019,Trip type: Traveled as a couple,,https://www.tripadvisor.com/Profile/Wendybogaard
Riad Melhoun & Spa,Raul Escalona wrote a review Feb 2019,50,Our first visit to Marrakech,The staff was superb and lovely. Always willing to help us. Since we arrived they explain us how to visit whole Medina. Dinner was amazing. Best food we tried in Marrakech. We highly recommend this Riad. See u next time. RaÃºl & Rosario,Date of stay: February 2019,Trip type: Traveled as a couple,"Granada, Spain",https://www.tripadvisor.com/Profile/raulescalona
Riad Melhoun & Spa,Maciej N wrote a review Jan 2019,50,Amazing,Really beautiful place. It's hard to find at first but it's worth looking for it! Very kind and helpful staff cozy rooms and 15 minutes walking from the big town square where you can see snakes monkeys tons of food and much more!,Date of stay: January 2019,Trip type: Traveled as a couple,,https://www.tripadvisor.com/Profile/Traitor696
Riad Melhoun & Spa,PÃ¡l Ãgnes wrote a review Jan 2019,50,"Debrecen, Hungary",Riad Melhound & Spa.  Above average ambitious riad in Marrakesh.  We recommend it wholeheartedly for everyone this traditional accomodation facility.  The unconventionally friendly hospitality and the intentness of the staff increases the standard of this hotel even more.  We would also like ro recommend the dinner. They spoiled us with the best dishes of Marocco every evening.  We would like to say thank you for your kindness.,Date of stay: January 2019,Trip type: Traveled with family,,https://www.tripadvisor.com/Profile/agnespal
Riad Melhoun & Spa,manuelrauch wrote a review Jan 2019,50,Beautiful oasis in the heart of Marrakech,A great Riad with everything you could possibly be looking for on your Moroccan adventure! Beautiful rooftop where breakfast is served! The pictures represent the place well. No need to look further for your accommodation.,Date of stay: January 2019,Trip type: Traveled as a couple,Baden-Baden,https://www.tripadvisor.com/Profile/manuelrauch
Riad Melhoun & Spa,aplasencia40 wrote a review Jan 2019,50,Kindness and Hospitality,The staff at Riad Melhoun were gracious kind and incredibly accommodating. They made sure that we were as comfortable as possible and they provided great recommendations for our visit to Marrakech. Take some time and enjoy the courtyard after a busy morning in the souk. The hotel also provided a very tasty breakfast in the peace and calm of the courtyard. We opted for the rooftop breakfast on our first day but the heat from the sun and the numerous bees buzzing around us caused us to move downstairs. One word of caution is that the riad is not exactly in a remote area but it is down an alley that feels remote and isn't particularly well-lit at night.,Date of stay: July 2018,,,https://www.tripadvisor.com/Profile/aplasencia40
Riad Melhoun & Spa,Dana F wrote a review Jan 2019,50,Great stay at AMAZING Riad!,We had a great stay at Riad Melhoun and Spa. We had dinner there twice and breakfast there every morning and the food was so good. The whole Riad is set up very nicely and everyone that worked there was so friendly and helpful. We received such great recommendations on things to do around Marrakech. We recommend this Riad to everyone wishing to go to Morocco and have a nice calm place to stay amidst the bustling city.,Date of stay: November 2018,Trip type: Traveled with friends,,https://www.tripadvisor.com/Profile/733danaf
Riad Melhoun & Spa,Maria Guldbrandt wrote a review Jan 2019,50,Beautiful place,Absolutely beautiful surroundings at the Riad. It is located in the best possible part of Marrakech combining a quiet location and a short walk to the city center. Located near tourist-friendly restuarants as well.,Date of stay: January 2019,Trip type: Traveled as a couple,"Vejle, Denmark",https://www.tripadvisor.com/Profile/mariaguldbrandt
Riad Melhoun & Spa,BoiseIdahoMike wrote a review Jan 2019,50,Beautiful Riad with Exceptional Staff,We stayed here for two nights on our trip around Morocco. From the second you walk in the staff is always looking to make your stay as wonderful as possible - they are always saying hello and asking if there is anything you need / they can assist you with. We had the Hammam service here as well. We also did it at our Riad in Fez and that experience was underwhelming so we figured that we would try it again here. I am glad we did because the Hammam experience here was excellent.    The Riad itself is beautifully restored to like original condition. The attention to detail and craftsmanship is incredible.    We had dinner here both nights as well and the food was great! Very nice Riad with incredible staff / service.,Date of stay: December 2018,Trip type: Traveled as a couple,"Boise, Idaho",https://www.tripadvisor.com/Profile/BoiseIdahoMike
Riad Melhoun & Spa,sondra t wrote a review Jan 2019,50,Not to be missed,The Riad was absolutely beautiful well kept and in a great part of the city. More importantly the service and hospitality made the experience in Marrakech so special. From tips on where to buy rugs and how to negotiate the price to helping us organize transportation and other things around the city we wouldnâ€™t have had such a great time if it hadnâ€™t been for Mohammed and the team. They really made us feel at home! We will absolutely stay here next time in Marrakech!,Date of stay: January 2019,Trip type: Traveled as a couple,"Boston, Massachusetts",https://www.tripadvisor.com/Profile/sondrat2013
Riad Melhoun & Spa,N Miles - Bird wrote a review Jan 2019,50,Riad Melhoun - A breath of fresh air,Beautiful Riad Melhoun really was a breath of fresh air and an oasis of calm in busy Marrakesh. I loved experiencing all the hustle & bustle of Marrakesh and it was wonderful to retreat to the peace and order created by the team at Riad Melhoun.    The staff deserve special mention for working together to seamlessly provide a first class experience for their guests: the management and reception staff offer impeccable service and hospitality standards (honestly second to none); the cook & serving staff provide breakfast lunch and dinner that were always fresh and delicious; and the cleaner kept the whole place immaculate. Weâ€™d also recommend taking up the Hammam & massage.    The Riad is of architectural interest and beautifully restored. We enjoyed both the roof terrace and the central courtyard space for meals and even spent a couple of afternoons just relaxing on the sun beds on the roof terrace. The location couldnâ€™t be more perfect a quiet spot within the medina so we felt relaxed but all the city sites were walkable.    Outside of our Riad the restaurants we enjoyed the most were The Nomad for its chicken tagine the YSL museum for its salads and La Fassia for its ambience. We visited the Marjorelle gardens YSL museum secret garden palaces tombs souk and photographic gallery in Marrakesh - so lots to do as well as day trips to Essouria & to the Atlas Mountains during our week long stay.    As our stay was over Christmas (22nd-29th December 2018) I thought the Christmas tree & tasteful decorations a particularly nice touch.    Thank you all so much for your generous hospitality.    Naz Miles-Bird,Date of stay: December 2018,Trip type: Traveled as a couple,"London, United Kingdom",https://www.tripadvisor.com/Profile/NBirdLondon
Riad Melhoun & Spa,Andy Miles wrote a review Dec 2018,50,Christmas Holiday,My wife and I stayed at Riad Melhoun and Spa in Marrakesh over Christmas 2018. This was our first time in Morocco. Research in 'prior reviews' is important to us and I sincerely hope my followimg comments will help future travellers when choosing where to stay. Firstly I should add that this Riad is centrally located to the south of the Medina close to the Bahia and El Badii Palaces Saadian tombs and only a short walk to Jemaa el-fna square which is a hive of activity particularly evening time. On arrival we were initially greeted by Mohamed who was extremely friendly and welcoming. Mohamed gave us the lowdown on local customs and generally what to expect during our stay. I would highly recommend booking a Hammam and massage at Melhoun a perfect way to start or end your stay in Morocco. There are many cultural activities to enjoy all within walking distance of the Riad. For stays of 4 days or more day trips to the Atlas Mountains or Essaouira are well worth the experience. Breakfast is freshly prepared daily and having sampled the cuisine in various other establishments you would be hard pushed to find better elsewhere (Including lunches and evening meals). Food can be enjoyed on the ground floor courtyard & pool area or on the beautiful private roof top terrace both of which are tastefully furnished and landscaped. Lastly a well deserved mention to the 'Melhoun Team' who made our stay a memorable one. We had dealings mainly with Mohamed Nour Issam Rachid and Ahmed but house keeping kitchen cleaning and admin reception was all delivered to an exemplary standard. It takes effort and dedication to ensure such a high level of service and this team should make the owners and in fact the whole of Morocco proud. Thanks again we'll be back. A J H Miles (London).,Date of stay: December 2018,Trip type: Traveled as a couple,,https://www.tripadvisor.com/Profile/AJHMiles
Riad Melhoun & Spa,Sabrian42 wrote a review Dec 2018,50,A Perfect Stay,The biggest mistake of my stay in Marrakech might have been that we only spent one night here. Everything about this Riad was absolutely perfect. They were in contact with us before our stay Mohammad met our driver and personally escorted us to the Riad where we were greeted with Mint Tea and a small tour the room was comfortable the place was decorated for Christmas which was a wonderful touch... I could go on and on.  The main highlights of our extremely short stay:  The location. The other Riad we stayed in was hard to find and had us going through some confusing streets and passing kids who constantly pestered us by saying we were going the wrong way Riad Melhoun was only a stoneâ€™s throw away from the Bahia palace and extremely easy to find.  The food. The dinner we had here was easily the best meal we had in Morocco. Not only was it a beautiful atmosphere but the service was impeccable and Iâ€™m still dreaming about the tagine a week later.  The Hammam. Earlier in my vacation I heard horror stories from other tourists about their hammam experience and I almost canceled ours but Iâ€™m so glad I didnâ€™t. The small private spa was steps away from our room and an absolutely amazing experience. It was so relaxing and it was set up so after our hammam and massage we only had to change in our room and then walk down the stairs to get dinner. Everything was perfect.  If I could give six stars I truly would because our stay at Riad Melhoun was absolutely magical. If Iâ€™m ever lucky enough to return to Marrakech I would go back there in a heartbeat.,Date of stay: December 2018,Trip type: Traveled as a couple,,https://www.tripadvisor.com/Profile/Sabrian42
Riad Melhoun & Spa,Sebastian Roos wrote a review Dec 2018,50,Wonderful Riad and perfect hosts :),We felt like staying at a moroccan family or friends! The Riad is clean and very rich in detail. The stuff was very helpful and kind! We enjoyed everyday a very tasty breakfast in the middle of a magic atmosphere! Thank you very much for such a great time,Date of stay: December 2018,Trip type: Traveled as a couple,,https://www.tripadvisor.com/Profile/sebastianroos
Riad Melhoun & Spa,Jan wrote a review Dec 2018,50,Great Riad!,We stayed four days at the Riad Melhoun. Great hotel delicious food nice and clean rooms super nice staff hammam really recommendable an oasis in the hustle and bustle. We would book again immediately.,Date of stay: December 2018,Trip type: Traveled with family,"Hamburg, Germany",https://www.tripadvisor.com/Profile/Freakywaves
Riad Melhoun & Spa,Kirsty Chin wrote a review Dec 2018,50,Beautiful Riad with attentive staff attention to detail,My family & I stayed in this beautiful Riad for 2 nights. We were greeted warmly by Mohammed & the Riadâ€™s manager whom shared the facilities of the Riad and even walked with us to a nearby restaurant for dinner as we were unfamiliar with the routes surrounding the Riad. The Road was situated inside the MÃ©dina making it close to tourist attractions & the souks. Breakfast & dinner in the Riad was delicious and the staff were attentive towards our needs in a timely manner. The roof terrace provided a wonderful sunrise view! Thank you for your hospitality and will definitely recommend this Riad for anyone who travels to Marrakech!,Date of stay: December 2018,Trip type: Traveled with family,"Singapore, Singapore",https://www.tripadvisor.com/Profile/KirstyChin
Riad Melhoun & Spa,VÃ­ctor L wrote a review Dec 2018,50,Great Riad!,We stayed two days at the Riad Melhoun which were really delightful. The Riad is great beautiful clean peaceful... and the staff is super nice! We really recommend it! Also it is located in the perfect area: inside the medina but not in the busiest side. Next to the beautiful palaces Bahia and El Badi.,Date of stay: December 2018,Trip type: Traveled as a couple,"Pamplona, Spain",https://www.tripadvisor.com/Profile/vlarripa
Riad Melhoun & Spa,Mariska D wrote a review Dec 2018,50,Warm welcome and a very pleasant stay,Place is gorgeous and the staff is very friendly and take the time to give information about the riad an marrakech. Perfect location! The roof terrace is very relaxing and the hamam is something one should do when staying at this riad.,Date of stay: December 2018,Trip type: Traveled with friends,,https://www.tripadvisor.com/Profile/502mariskad
Riad Melhoun & Spa,Guide17678521113 wrote a review Dec 2018,50,Amazing Riad,This was a lovely riad. Nice and attentive staff who made the stay even better. Nice common area and beautiful roof terrace. The hammam and massage were absolutely fantastic especially after long days walking in the medina. Highly recommended!,Date of stay: November 2018,Trip type: Traveled as a couple,,https://www.tripadvisor.com/Profile/Guide17678521113
Riad Melhoun & Spa,GFerny wrote a review Nov 2018,50,"Kind staff, great location, gorgeous riad!",On our first visit to Marrakech we struck gold by choosing Riad Melhoun. Every element of our stay was perfect and we can't recommend it enough!    Riad Melhoun is just a five minute walk from Djemaa el-Fna Marrakech's main square and about two minutes from El Bahia Palace. It's also tucked away a few turns off a main street which makes it quiet peaceful and very relaxing after the hustle and bustle of the city.    While it was Riad Melhoun's beautiful decor that initially caught our attention it was really the riad staff's kindness and attentiveness that made our visit so lovely. Everyone was extremely helpful and a pleasure to chat with. They always anticipated our every need and took of arranging our airport transfer a 3-day desert tour early breakfast luggage storage a hammam appointment . . .everything we hoped for and more! They're superstars!    Our room at Riad Melhoun was spacious tastefully decorated and very comfortable. The room was quiet and cool at night the bathroom had a beautiful tile sink and walk-in stone shower and both were well-stocked with anything you could need. Our room was also conveniently located near the hammam and we HIGHLY recommend taking advantage of the spa offerings here! The riad's hammam was one of the best parts of our trip.    Riad Melhoun also has a great collection of public spaces that are all lovely to spend time in. The rooftop terrace has numerous places to sit and nice views of the surrounding neighborhood. The courtyard is stocked with cute tables and chairs as well as a library nook with a fireplace and a small red seating area with plush cushions and video footage of Moroccan excursions. After a long day of walking and sightseeing it was nice to be able to sit in a comfy chair next to a crackling fire.    Our stay at Riad Melhoun was perfect. The riad had everything we needed and more and it's a fantastic place to stay in Marrakech. We'll definitely be back!,Date of stay: November 2018,Trip type: Traveled with friends,,https://www.tripadvisor.com/Profile/GFerny
Riad Melhoun & Spa,Simon wrote a review Nov 2018,50,Lovely Riad with great staff,We stayed at Riad Melhoun for 5 nights and loved every moment of our stay. The Riad is just inside the Medina and although very central was very peaceful. Our room was extremely comfortable and beautifully decorated as was the rest of the Riad. We had dinner at the Riad on 2 evenings with the highlight being a superb fish Tagine. Whilst at the Riad we had a Hamman and a massage of which both were excellent. The staff were all very friendly and went out of their way to make us welcome. Highly recommended!,Date of stay: November 2018,Trip type: Traveled as a couple,,https://www.tripadvisor.com/Profile/simoninlondon18
Riad Melhoun & Spa,Ayushi R wrote a review Nov 2018,50,Amazing staff!,This was our first Riad stay in Morocco and it was promising. Although rooms are small the kind staff make it up for all its little beauty. The mint tea and breakfast is amazing! Social recommendation for Mohammed Nour and the helping staff. That are so kind and will make you feel at home.,Date of stay: November 2018,Trip type: Traveled with friends,"Dar es Salaam, Tanzania",https://www.tripadvisor.com/Profile/330ayushir
Riad Melhoun & Spa,Gemma Coull wrote a review Nov 2018,50,Beautiful Riad,Beautiful Riad with wonderful and attentive staff that make you feel so at home! A perfect place to stay and unwind after the hustle and bustle of Marrakesh! The food was beautifully presented both for breakfast and evening dinners and delivered on flavour (the tagines were excellent) ! Also they offer spa experiences so after a busy day we booked to have a massage which was a lovely treat! The overall experience is 10/10,Date of stay: November 2018,Trip type: Traveled as a couple,"Bristol, United Kingdom",https://www.tripadvisor.com/Profile/GemmaL1259
Riad Melhoun & Spa,Sophia K wrote a review Nov 2018,50,Beautiful Riad!,We stayed at the Riad Melhoun and spa for 2 nights and absolutely loved it! The Riad is gorgeous and our room was very comfortable. Beyond that the staff was hospitable and we felt so welcomed and attentive to. Nour and Mohammed definitely went out of their way for us and we really appreciated it. Breakfast is also included and it is very yummy.,Date of stay: November 2018,Trip type: Traveled with friends,"Miami, Florida",https://www.tripadvisor.com/Profile/SophiaK455
Riad Melhoun & Spa,R.R wrote a review Nov 2018,50,Oasis,We had a very nice stay at the Riad with perfect service and hospitality of the staff. They made us feel at home instantly. The Riad serves delicious Moroccan breakfast and diner. It has very nice rooftop terras to chill.,Date of stay: November 2018,Trip type: Traveled as a couple,,https://www.tripadvisor.com/Profile/r13371337
Riad Melhoun & Spa,Ida N wrote a review Nov 2018,50,Absolutely beautiful place,We've stayed at many high quality hotels but nothing as good as Riad Melhoun. Wonderful atmosphere with the best service you can imagine. The service and support were exceptional. We felt so welcomed. The Staff at Riad Melhoun were absolutely amazing from start to finish we couldn't have asked for a more perfect stay.  The inside is beautifuthe room was awesome. The rooftop space is a great oasis for breakfast. Location is excellent you can walk to almost every touristic place in town.  We love this place we love Marrakesch. We are already at home but we still remember Marrakesh. Greetings to everyone Muhamed Noor Ahmed Rashid and all staff.  Thanks for everything,Date of stay: November 2018,Trip type: Traveled with family,"Sutton, United Kingdom",https://www.tripadvisor.com/Profile/537idan
Riad Melhoun & Spa,Richard Vink wrote a review Nov 2018,50,This Riad is like paradise!!!,We had such an amazing stay! Mohammad and his staff make you feel at home. Unwinding and relaxing while enjoying the beautiful city of Marakesh!  We got great tips oin where to go eat what to do and how to enjoy this trip to the fullest.  We were pleasantly surprised by their hospitality.    Mohammad and your team thanks again you guys are amazing!!,Date of stay: November 2018,Trip type: Traveled with friends,,https://www.tripadvisor.com/Profile/RichardVink78
Riad Melhoun & Spa,Radhwane Z wrote a review Oct 2018,50,Radhwane,After discovering the magical Marrakech I can say that RIAD MELHOUN is one of the most beautiful roads of Marrakech with special charm also an adorable stuff  a smiling and caring staff  delicious breakfast with a handmade preparation comfortable rooms  a large terrace on the roof  short stay and unforgettable memories,Date of stay: October 2018,Trip type: Traveled with friends,"Sheffield, United Kingdom",https://www.tripadvisor.com/Profile/radhwanez
Riad Melhoun & Spa,Cameron Chiaro wrote a review Oct 2018,50,Fabulous Stay at Riad Melhoun,If you're reading this you are probably debating between several Riad's in Marrakech. I did that for weeks until I finally booked Melhoun and I can't tell you enough how happy I am with our stay. My husband and I booked for 3 nights. I wish we could have stayed longer! The rooms are wonderful the staff is amazing (they know you by name & will help you plan out your time in Marrakech) and the whole atmosphere is very tranquil & peaceful. It's nice after a long day of exploring to come back to such an incredible place! The breakfast is great. We also had dinner one night by the pool and they sure know how to host- candle light rose pedals everywhere and several courses of traditional Moroccan cuisine. I'd highly suggest!,Date of stay: November 2017,,"Bury St. Edmunds, United Kingdom",https://www.tripadvisor.com/Profile/camchiaro
