Hotel_Name,Review_Date,Review_Rating,Review_Title,Review_Text,Reviewer_Date_Of_Stay,Reviewer_Trip_Type,Reviewer_Location,Reviewer_Profile_Link
Riad Melhoun & Spa,Janet F wrote a review Yesterday,50,A beautiful riad right in the centre of Marrakech.,Our tour company So Morocco recommend this Riad and we are so glad they did .Excellent service and the food was great  They made us feel like family  The spa was amazing .I had my first ever hamman and massage.  We loved the pool on the terrace . It was a very hot day!!,Date of stay: March 2023,Trip type: Traveled with family,,https://www.tripadvisor.com/Profile/janetfD8204FS
Riad Melhoun & Spa,Nina P wrote a review Feb 2022,50,Beautiful Riad in the heart of Marrakech and the Best staff,How do I even begin to describe such a beautiful riad in a country where you felt so much at home? Morocco has been on my bucket list for sometime so I braved travelling during Covid time dragged the parentals along with me and flew to Marrakech on Nov 2021. Our adventure began at Riad Melhoun where we met the most amazing staff who went above and beyond during our short stay. From airport pick up to checking in everything was seamless. I will never forget the smell of Jasmine upon entering the riad; such a wonderful scent to have on the lobby. The riad itself is beautiful-- decorated with traditional Moroccan designs. It was an oasis in the middle of the medina. We stayed in the two rooms at the very top and it was very peaceful -- a sanctuary in the midst of the medina and the bustling Djemaa El Fna.    Dinner at the riad is also a must-- all the dishes served were just so delicious and appetizing! Kudos to Ahmed Khadija and Anass for that amazing first dinner we had in Marrakech. A wonderful evening of Moroccan gastronomy. Massage was also so good especially coming from a long haul flight. Thank you to Asmaa and Oumaima for giving us such a relaxing massage.    Everything about this riad is beautiful but the ones that really shine and the real gem of this beautiful riad are its amazing staff. At the end of our trip we have found friends in each one of them. They are one of the reasons why we love Morocco so much! Thank you-- Nour Tarik Ahmed Khadija Ghizlane Anass and Mohamed for all that you do. You are all amazing. You are the real treasure of this beautiful riad. Memories we had in Morocco were surely one for the books. We'll keep coming back to you InshaAllah :),Date of stay: November 2021,,"Calgary, Canada",https://www.tripadvisor.com/Profile/Nins821
Riad Melhoun & Spa,Mdurian wrote a review Mar 25,50,Stunningly renovated riad boutique hotel near Bahia Palace,We were a family of five (three generations) who stayed in two rooms. The place is meticulously restored and a work of art. We had one suite (gaya) and another normal room. The bathrooms are large and the gaya suite is good sized whereas the normal room was fairly modestly sized but all very cosy and comfortable. Great breakfast and superb service. The common spaces (ground floor and roof top) are amazing.,Date of stay: March 2023,Trip type: Traveled with family,"Washington DC, District of Columbia",https://www.tripadvisor.com/Profile/Mdurian
Riad Melhoun & Spa,TE wrote a review Mar 25,50,Amazing hospitality in a beautiful centrally located Riad,We loved our stay at Riad Melhoun & Spa thanks to the amazing hospitality of General Manager Mr. Nour Mr. Ahmed and the entire Melhoun staff who left no corner unturned to make our stay delightful and comfortable.    The Riad is located in a peaceful part of the Medina right next to Bahia palace. We stayed in the spacious Gaia suite with our 9 year old son and my elderly parents stayed in the Maysar suite which was a little smaller but just as luxurious.    The staff was incredible. They did everything to make our stay more comfortable and easy. We loved the delicious breakfasts the Hamams and the tonic massage treatments. Would recommend highly.,Date of stay: March 2023,Trip type: Traveled with family,"Madrid, Spain",https://www.tripadvisor.com/Profile/Excursion35146001128
Riad Melhoun & Spa,Catherine D wrote a review Mar 24,50,Everything was perfect,We really enjoyed our stay at Riad Melhoun.  The staff is very helpful.  Great location near all the attractions.  The Riad is very clean and the food is delecious.  We highly recommend this wonderful place  We'll come back for sure.,Date of stay: March 2023,Trip type: Traveled as a couple,"County Sligo, Ireland",https://www.tripadvisor.com/Profile/catherined26
Riad Melhoun & Spa,Faraz A wrote a review Mar 21,50,Your perfect home in Marrakech,Beautiful clean and well functioning Riad in a very good location. The staff are fantastic (I remember specially Noor and Ahmad) helpful and kind. Amazing hammam with world class massage. Home made food offered if you book a day in advance. Overall a very nice place to relax a few days.,Date of stay: March 2023,,,https://www.tripadvisor.com/Profile/358faraza
Riad Melhoun & Spa,Kim D wrote a review Mar 17,50,Most beautiful Riad with amazing service,Absolutely gorgeous riad. Spent many hours soaking in the sun around the rooftop pool. The staff were exceptional - every single person knows your name and is always close at hand to help with any thing you need honestly I felt like a queen here. Breakfast was delicious and huge great location to all the tourist areas and minute walk to bahia palace. :),Date of stay: March 2023,Trip type: Traveled solo,"Waterloo, Canada",https://www.tripadvisor.com/Profile/kimd90
Riad Melhoun & Spa,Shauna M wrote a review Mar 13,50,"Beautiful, Romantic Oasis in the Heart of Marrakesh <3",Where to begin to say we enjoyed our stay at the Riad Melhoun & Spa would be an huge understatement. We simply fell in love with the riad service offered food and overall ambience of what i would say is more boutique style establishment. Everything from the suite to the interior decor to the outdoor terrace is just unbelievably considered and beautiful. We enjoyed three nights earlier this month and we're made feel like we were the only guests at the Riad the entire time which only added to the experience. There was other guests we did see during our stay however the tranquil calm energy of the Riad just made you feel so relaxed and peaceful it was honestly one of the most relaxing city breaks we've ever had. Close enough to the hustle and excitement of the Medina streets but a real oasis of calm within The Medina. Breakfast served is a delightful addition to the stay i particularly recommend the omelette and the mint tea served here really is the best in Marrakesh. The riad was accommodating in arranging wine for us on request which we enjoyed with Lunch and dinner at the hotel something we were hesitant about our stay however found no issues in this area. Lastly the heated pool on the terrace brought me so much joy enjoying an evening dip with my partner after a heavy day in the souks was just the perfect way to end each day. Will recommend this Riad to all i know wishing to pay Marrakesh a visit honestly one of the nicest stays i've had in a long time. Thank you to all the wonderful staff and people of Marrakesh for the perfect city break <3,Date of stay: March 2023,Trip type: Traveled as a couple,,https://www.tripadvisor.com/Profile/144shaunam
Riad Melhoun & Spa,Sandrycka wrote a review Mar 12,50,"Beautiful place, top level service!",The Riad was amazing. Very beautiful and exclusive with very few guests at once. Due to this the staff are extremely customer focused kind and will always try their best to keep you happy which they always will. Choose where to breakfast whether its at the top terrace with some nice sun or by the bottom pool same with lunch and dinner. Very tasty food and fresh juice hard to be disappointed here. We loved it and recommend to everyone! 10/10!,Date of stay: March 2023,Trip type: Traveled as a couple,"London, United Kingdom",https://www.tripadvisor.com/Profile/Sandrycka
Riad Melhoun & Spa,ShariBLM wrote a review Mar 11,50,Riad Mehoun & Spa was outstanding!,Our stay at Riad Melhoun was outstanding from the very personalized service of all the staff to the spa treatments food and our lovely suite...the Gaya Suite we could not have asked for a better experience. We were 3 adult family members and our suite was comfortable. The rooftop space with heated pool was lovely and we had breakfast each day on the rooftop terrace. On our last night we had a superb dinner in the courtyard with delicious Moroccan wine! We enjoyed the spa for facials and foot massages after returning from our Atlas Mountains trek. The Riad also arranged a city guide for us who was excellent and gave us recommendations and arranged reservations for other dinners out. We will recommend Riad Melhoun to all of our traveling friends!!,Date of stay: March 2023,Trip type: Traveled with family,"Windham, Maine",https://www.tripadvisor.com/Profile/ShariBLM
Riad Melhoun & Spa,Suleman V wrote a review Mar 10,50,Worldtraveler999,This quaint Riad is in a great location. We had a wonderful time during our 3-night stay. When we arrived we were given a reception with some snacks with Moroccan tea. Our room was clean and elegantly decorated. We cannot say enough good things about the amazing staff at this Riad. They made us feel special every single time we encountered any one of them - whether in the reception area or at meal times. There is a rooftop area with a hot tub and lounge chairs. We enjoyed having dinner and breakfast on the roof top dining area. After extending our checkout time by 2 hours we still had 3 hours before we departed. They let us stay in the main lounge and served us tea twice. We look forward to staying here during our next visit to Marrakesh.,Date of stay: March 2023,,,https://www.tripadvisor.com/Profile/sulemanv2023
Riad Melhoun & Spa,Juliette wrote a review Mar 8,50,Wonderful & welcoming place,I had a wonderful stay at Riad Melhoun - would be so happy to go again and will definitely recommend it to others.    The service was incredible and felt so personal - with assistance in organizing the arrival a very warm welcome checking in to make sure I had everything I needed and even noting small details like food /drinks preferences. They made me feel like a princess :)    The location is convenient right at the entrance to the Medina - central yet quiet. It also felt like a safe place for a woman traveling solo. The riad itself is really beautiful and well looked after too. The rooftop terrace & plunge pool are definitely a plus.    I can also highly recommend the dinner option. It was better and probably more authentic than the food I had at the restaurants. Plus it came with a background story which allowed me to get a glimpse into the culture.,Date of stay: March 2023,,"Zurich, Switzerland",https://www.tripadvisor.com/Profile/juliettelionheart
Riad Melhoun & Spa,Josh wrote a review Mar 2,50,Beautiful riad with amazing hospitality,We had a wonderful time at Riad Melhoun. It's a beautiful riad as you can tell from the pictures with fantastic extremely welcoming staff delicious breakfast and a great hammam and massage experience. The hot tub on the roof terrace was an extra bonus! I can't say enough about the service - everyone at the riad was welcoming and gracious with great advice when we needed it. The riad is quiet - away from the crazier areas of the Medina but close enough to wonderful restaurants (we especially liked Naranj) and Bahia Palace. Everything was great - right down to helping us with a ride back to the airport!,Date of stay: March 2023,Trip type: Traveled as a couple,"San Francisco, California",https://www.tripadvisor.com/Profile/CaliTraveler100
Riad Melhoun & Spa,AJ M wrote a review Feb 2023,50,Very nice hotel and staff. Will stay again.,Very nice hotel and staff. Rooms are small for king beds to fit. Lovely ornamentation everywhere inside. Very good location.    Again Very nice hotel and staff. Rooms are small for king beds to fit. Lovely ornamentation everywhere inside. Very good location.,Date of stay: February 2023,Trip type: Traveled as a couple,"Paradise Valley, Nevada",https://www.tripadvisor.com/Profile/SteveMartin702
Riad Melhoun & Spa,Thomas P wrote a review Feb 2023,50,Boutique hotel in the market area,"Like everyone has said these guys are a breath of fresh air in the city. Nothing is too much trouble. A boutique hotel right in the hustle and bustle of the market area. Tucked away in a side street is not to far from the markets. If I was to return to Marrakesh I would go again. Who ever runs this hotel is doing a great job.    From  ""Mr Tom""",Date of stay: January 2023,Trip type: Traveled solo,,https://www.tripadvisor.com/Profile/Isleofwightcandepres
Riad Melhoun & Spa,Megan L wrote a review Jan 2023,50,Luxury and Pampering,We enjoyed every aspect of our stay at Riad Melbourne & Spa. The staff thought about what we might need before we could even ask. Their personal service and extreme hospitality made us feel like royalty. The boutique hotel experience could not be beat. They helped us experience Marrakech to the fullest - even arranging for a special cooking class just for us. If you want luxury and pampering - this is the place to stay.,Date of stay: January 2023,Trip type: Traveled as a couple,,https://www.tripadvisor.com/Profile/A8698GBmeganl
Riad Melhoun & Spa,David G wrote a review Jan 2023,50,An excellent experience!,We spent five nights over Christmas with the wonderful people at Riad Melhoun. Really an excellent experience. The property is easy to access either to explore the Medina or to go elsewhere in Marrakech. Breakfast every day was excellent and the one dinner we had there was superb. We took almost all our meals on the rooftop which is very comfortable and relaxing. The entire place is stylishly decorated so much so that we held a previously scheduled photo shoot at the Riad instead of elsewhere in the Medina. We also made use of the hammam and massage service. Both were very relaxing. Best of all though were the people who saw to every detail in such an efficient and easygoing way. They truly made the experience five stars. So overall I highly recommend Riad Melhoun and would stay there again in a heartbeat.,Date of stay: December 2022,,"Bend, Oregon",https://www.tripadvisor.com/Profile/DSG2024
Riad Melhoun & Spa,Mara D wrote a review Jan 2023,50,"Authentic Beauty, Architectural Detail",Enjoy the stunning history of this traditional 16th century Moraccan snd Andalusi palace with its peaceful interior courtyard. Beautiful rooms Morrocan art tapestries and rugs. Beautiful and discreet interior pool and rooftop garden with warm water soaker tub. The hospitality is exceptional with kind polite and attentive staff and delicious Moroccan breakfasts. A perfect stay...,Date of stay: January 2023,Trip type: Traveled with friends,"Toronto, Canada",https://www.tripadvisor.com/Profile/Maradb61
Riad Melhoun & Spa,dinahillel wrote a review Jan 2023,50,Wonderfull,Best riad excellent service from every one at the riad very good breakfast. We had dinner twice and it was really good.the staff helped us get taxis travel tips and were really helpful.we will come again!!,Date of stay: January 2023,Trip type: Traveled as a couple,"Jerusalem, Israel",https://www.tripadvisor.com/Profile/dinahillel
Riad Melhoun & Spa,Nick D wrote a review Jan 2023,50,Fabulous place to stay in old Marrakech,We stayed in Riad Melhoun over my wife's birthday earlier this month. The riad is in great condition and is very well equipped. It is really well situated near to the square in the Jewish quarter and only 10 minutes interesting walk down narrow streets from the better known main square in Marrakech.    The staff at the riad are all very friendly and helpful; nothing is too much trouble for them and if they can make your day easier or more pleasurable then they will. They have a real family feel to their culture and will for example readily stay late to help each other out even after a long shift. They efficiently pass on relevant information about guests and their requirements when they go off duty which means that nothing falls between two stools. Someone from the team noticed from her passport that it was my wifeâ€™s birthday while we were there and a nice bunch of roses appeared in the room. It was a really nice and thoughtful touch.    In a place like Marrakech which is so culturally different from the UK or in our case France reliable advice is highly desirable and whoever at the riad is on reception at the time you will get all the advice and help you need. They are definitely on your side. Oh and the food is good too!    Would I stay there again on a future visit? Definitely.,Date of stay: January 2023,,"Maureillas-las-Illas, France",https://www.tripadvisor.com/Profile/47nickd
Riad Melhoun & Spa,rosie m wrote a review Jan 2023,50,Beautiful tranquil place,We had a wonderful time. Very friendly staff with a lovely breakfast which could be taken by the pool or upstairs. Very convenient to everything. Although down a little alley don't let that put you off. We had dinner there the first night which was great as we arrived late. Very close to palaces and main square about 8-10 minutes walk away,Date of stay: January 2023,Trip type: Traveled with friends,"Belfast, United Kingdom",https://www.tripadvisor.com/Profile/rosiem761
Riad Melhoun & Spa,Jgc1963 wrote a review Jan 2023,30,Not what we expected,Despite all of the reviews given we did not feel the same way. Our room on the first floor smelled musty and old. Towels were all frayed and when asked to replenish we had a bit of attitude. That being said the hamam was great as was the rooftop. Great location but hard to recommend.,Date of stay: January 2023,Trip type: Traveled with family,,https://www.tripadvisor.com/Profile/Jgc1963
Riad Melhoun & Spa,N8572JTlaurenh wrote a review Jan 2023,50,A Riad Above and Beyond All the Others!,Riad Melhoun was one of the best places we've ever stayed. From the moment you walk in the staff greets you warmly serves you delicious mint tea and helps you relax after a long journey. The smells of the riad transport you to another world--mixed with jasmine spices and other amazing scents you feel like you are in one of the most amazing places ever. The rooms and beds were super comfortable there was a working safe to secure important docs and there were rose petals welcoming us in the room. We had dinner at the riad our first night and it was one of the best meals of our trip to Morocco. We highly recommend having dinner there for at least one night! The breakfasts were amazing too. We also all did a Hammam at their spa and it was one of the most wonderful experiences and not to be missed! The roof terrace is a beautiful place to relax. And while we visited in December (so we didn't swim) they do have two pools for those who wish to cool off when it gets hotter. The staff was friendly and you really felt like they cared about your stay. The location is perfect--only about a 10ish minute walk to the main square and the souks. We hope to return to Marrakech some day in the next few years and will definitely stay at Riad Melhoun when we do!,Date of stay: December 2022,,"Boston, United States",https://www.tripadvisor.com/Profile/N8572JTlaurenh
Riad Melhoun & Spa,ZFL069 wrote a review Dec 2022,50,A great place to stay,The service was fabulous. Nothing was too much trouble. The food was great weâ€™d recommend the breakfast and evening meal.  Loved the hamam and treatment . Brilliant location. Great nights sleep. Will return here and have already recommended this riad as a great place to stay and explore Marrakech.,Date of stay: December 2022,Trip type: Traveled as a couple,"Warrington, United Kingdom",https://www.tripadvisor.com/Profile/ZFL069
Riad Melhoun & Spa,DSK75 wrote a review Dec 2022,50,Extraordinary hospitality in Marrakech,We had a great experience at this riad. The staff was extraordinarily hospitable. My 15 year old daughter celebrated her birthday on our second day in Marrakech and was greeted with a surprise of a beautiful bouquet of roses by the staff. She said it was one of the nicest warmest experiences she has ever had traveling. The riad is beautifully decorated the breakfast was excellent and the young staff members are warm and welcoming. The riad is close to an area with several good restaurants. Our children's room is on the top level and was spacious and elegant. Our room was smaller but still very nicely furnished and comfortable. We had a really great experience staying here for three nights and would happily return.,Date of stay: December 2022,,Washington DC,https://www.tripadvisor.com/Profile/DSK75
Riad Melhoun & Spa,Jane B wrote a review Dec 2022,50,Fantastic Riad with 5* service,I cannot recommend this Riad more highly. It is spotless and beautiful in a great location and with a wonderful roof terrace with a pool that is so peaceful and picturesque. What made it totally special though was the care and attention of the team. Abdul Ahmed Tarik Nour and Mohamed who were so welcoming and attentive. Our spa experience was amazing and the food incredible. Make sure you also book for dinner as it was absolutely delicious. Do not miss out on this special place you will love it! â¤ï¸ðŸ‡²ðŸ‡¦,Date of stay: December 2022,,"London, United Kingdom",https://www.tripadvisor.com/Profile/janebC1233ST
Riad Melhoun & Spa,Catherine P wrote a review Dec 2022,50,A home away from home. Just perfect.,These guys can teach 5star hotels a thing or two about service! Just outstanding. It was so homely. The staff couldnâ€™t have been more amazing. Definitely make sure you have dinner here and enjoy breakfast on the roof terrace. You must go for the full hamman experience. It was amazing. Thank you to Noor Tarik and Mohammed for standing out particularly and really looking after us. Giving us recommendations guiding us and just making us feel so comfortable. The riad was beautiful. A stunning setting in a fantastic location - a quite area only 5/10 mins easy walk to the souks and main square. Itâ€™s so peaceful you can lay in in the morning and not be woken. We donâ€™t often return to places as we like to try new but when we return to morroco we will be staying here!,Date of stay: December 2022,Trip type: Traveled as a couple,,https://www.tripadvisor.com/Profile/catherinepY6593LE
Riad Melhoun & Spa,Bestadvisors wrote a review Dec 2022,50,Feeling at home,It was a very pleasant experience. The staff is very friendly and attentive. The Riad is beautiful and very well located in the Medina.  We felt like home staying there.  We look forward to coming back very soon.,Date of stay: December 2022,Trip type: Traveled as a couple,,https://www.tripadvisor.com/Profile/Bestadvisors
Riad Melhoun & Spa,JAB wrote a review Dec 2022,50,Perfect experience,Wow what an amazing Riad in a great area of Marrakesh. From the moment we arrived we felt we were somewhere special. Every detail has been thought out for the guests. We had a fantastic Hamaan and massage as well as fabulous evening meal. Just amazing as was breakfast on the upstairs terrace. Just wish we could have stayed longer than one night.,Date of stay: November 2022,Trip type: Traveled as a couple,"Derby, United Kingdom",https://www.tripadvisor.com/Profile/Jubu1962
Riad Melhoun & Spa,Laura MÃ¸llehave wrote a review Nov 2022,50,"Beautiful riad, great staff, great location!",Beautiful riad! Both the rooms and the pool areas are extremely beautiful tastefully decorated with a luxurious feel. The building is old completely renovated so not much of the original is left but everything is kept in the authentic vibe og spotless. The staff was very helpful and sweet to us and our 25 year old daughter. The heated pool was a huge plus in November and I believe not so easy to find in Marrakech.  Breakfast was great and included omelet - also rare in Marrakech where most breakfast is sweet.  I have absolutely nothing bad to say about Melhoun Riad and spa! Best recommendations!,Date of stay: November 2022,Trip type: Traveled with family,,https://www.tripadvisor.com/Profile/lauraaJ78HR
Riad Melhoun & Spa,Anita V wrote a review Nov 2022,50,They treated us like royalty,We stayed one week in Riad Melhoun and felt like home. Everything was just amazing!: The location is perfect to walk around in Medina; the staff is very kind helpful always smiling; the dinner is the most delicious than any other restaurant we tried in Marrakesh; we had Hammam and massage also which was very pleasant; our room was always clean and comfort; the rooftop with the little pool is perfect place to relax on the sun. Last but not least the riad is a wonderful cultural building we were constantly admiring its architecture and typical local handcrafted decorations. Thank you to all the staff for an unforgettable experience!,Date of stay: November 2022,,Belgium,https://www.tripadvisor.com/Profile/AnitaV1500
